EVENT_ID,CZ_NAME_STR,BEGIN_LOCATION,BEGIN_DATE,BEGIN_TIME,Time,time_location,EVENT_TYPE,MAGNITUDE,TOR_F_SCALE,DEATHS_DIRECT,INJURIES_DIRECT,DAMAGE_PROPERTY_NUM,DAMAGE_CROPS_NUM,STATE,CZ_TIMEZONE,MAGNITUDE_TYPE,EPISODE_ID,CZ_TYPE,CZ_FIPS,WFO,INJURIES_INDIRECT,DEATHS_INDIRECT,SOURCE,FLOOD_CAUSE,TOR_LENGTH,TOR_WIDTH,BEGIN_RANGE,BEGIN_AZIMUTH,END_RANGE,END_AZIMUTH,END_LOCATION,BEGIN_LAT,BEGIN_LON,END_LAT,END_LON,EVENT_NARRATIVE,EPISODE_NARRATIVE,ABSOLUTE_ROWNUMBER492737,WESTERN WHATCOM COUNTY (ZONE), ,1/3/14,700,7:00,2014-01-03  7:00:00 | Washington,Coastal Flood, , ,0,0,1000,0,Washington,PST-8, ,81984,Z,503,SEW,0,0,Emergency Manager, , , , , , , , , , , , ,"Near Birch bay, minor coastal flooding damaged some outdoor furniture.","Near Birch bay, minor coastal flooding damaged some outdoor furniture.",1494011,WEST SLOPES NORTHERN CASCADES AND PASSES (ZONE), ,1/8/14,1100,11:00,2014-01-08  11:00:00 | Washington,Heavy Snow, , ,0,0,0,0,Washington,PST-8, ,82123,Z,518,SEW,0,0,Park/Forest Service, , , , , , , , , , , , ,"USFS NWAC station at Mt Baker measured 12 inches snow in 12 hours ending 9 pm Jan 8, and 18 inches in 24 hours ending 11 am Jan 9.","A frontal system moved through western Washington, bringing heavy snow to Mt Baker and Paradise at Mt Rainier.",2494012,WEST SLOPES CENTRAL CASCADES AND PASSES (ZONE), ,1/8/14,1100,11:00,2014-01-08  11:00:00 | Washington,Heavy Snow, , ,0,0,0,0,Washington,PST-8, ,82123,Z,519,SEW,0,0,Park/Forest Service, , , , , , , , , , , , ,USFS NWAC station at Paradise measured 13 inches snow in 12 hours ending 11 pm Jan 8.,"A frontal system moved through western Washington, bringing heavy snow to Mt Baker and Paradise at Mt Rainier.",3489461,NORTHEAST MOUNTAINS (ZONE), ,1/8/14,1400,14:00,2014-01-08  14:00:00 | Washington,Heavy Snow, , ,0,0,0,0,Washington,PST-8, ,81556,Z,37,OTX,0,0,Public, , , , , , , , , , , , ,Storm total snowfall totals of nine and ten inches at 49 Degrees North Ski Resort and Mt. Spokane Ski Resort respectively.,"A moist Pacific storm system pushing into the region off of the Pacific brought heavy snow across the mountains of northeast Washington.  Strong low level warm air advection limited heavy snowfall above 4,000 feet in elevation.",4492754,SNOHOMISH CO.,INDEX,1/9/14,600,6:00,2014-01-09  6:00:00 | Washington,Debris Flow, , ,0,0,2000,0,Washington,PST-8, ,81985,C,61,SEW,0,0,Newspaper,Heavy Rain, , ,2,SW,2,WSW,INDEX,47.7995,-121.5805,47.8089,-121.5898,Scores of residents near Index remained without power and stranded by a massive landslide that blocks the access road to their homes and prevents emergency crews from reaching the area in Snohomish County.,"Strong wind knocked out power to nearly 90,000 customers in western Washington.  A landslide blocked a road near Index, cutting off access to about 90 homeowners.",5498206,EASTERN COLUMBIA RIVER GORGE (ZONE), ,1/10/14,230,2:30,2014-01-10  2:00:00 | Washington,High Wind,61, ,0,0,0,0,Washington,PST-8,MG,80673,Z,24,PDT,0,0,Mesonet, , , , , , , , , , , , ,,High winds ripped through the Columbia River Gorge overnight (early morning) on January 10th. Wind gust reported by a Mesonet of 70 MPH was measured.  Also wind gusts of at least 55 mph or greater were measured for 3 consecutive hours.,6483001,SIMCOE HIGHLANDS (ZONE), ,1/10/14,256,2:56,2014-01-10  2:00:00 | Washington,High Wind,59, ,0,0,0,0,Washington,PST-8,MG,80674,Z,521,PDT,0,0,Mesonet, , , , , , , , , , , , ,Goldendale East Raws and Highbridge Raws.,"High winds due to mountain waves produced very strong wind gusts across the Simcoe Highlands and portions of the western and southern Yakima Valley.  Wind gusts in MPH include: (68) south southwest of Tampico, (68) west northwest of Bickleton, (63) east northeast of Goldendale, and (60) North of Maryhill.  Damage from wind was reported in the Trout Lake area as well.",7483052,EAST SLOPES OF THE WASHINGTON CASCADES (ZONE), ,1/10/14,530,5:30,2014-01-10  5:00:00 | Washington,High Wind,59, ,0,0,0,0,Washington,PST-8,MG,80674,Z,520,PDT,0,0,Trained Spotter, , , , , , , , , , , , ,,"High winds due to mountain waves produced very strong wind gusts across the Simcoe Highlands and portions of the western and southern Yakima Valley.  Wind gusts in MPH include: (68) south southwest of Tampico, (68) west northwest of Bickleton, (63) east northeast of Goldendale, and (60) North of Maryhill.  Damage from wind was reported in the Trout Lake area as well.",8489582,EAST SLOPES NORTHERN CASCADES (ZONE), ,1/10/14,1900,19:00,2014-01-10  19:00:00 | Washington,Heavy Snow, , ,0,0,0,0,Washington,PST-8, ,81564,Z,42,OTX,0,0,COOP Observer, , , , , , , , , , , , ,"Heavy snowfall above 3,000 feet in elevation with over a foot reported in the mountains, mainly near the Cascade crest.","A deep fetch of Pacific moisture brought heavy snow to the mountains and moderate to heavy rain to the valleys across the area overnight on January 10th into the 11th.  Localized flooding was observed in the northeast mountains of Washington due to a combination of rainfall, snow melt and frozen soils.  Rainfall amounts were generally up into the half inch to one inch range for this period, which typically would not cause flooding if not in combination with low elevation snow melt and frozen soils preventing water from seeping into the ground.  Flooding impacts were minor and limited to low spots in the terrain, in urban areas and along small streams.  Rain and heavy snow was followed by a strong cold front passage during the early morning hours of January 11th with strong and damaging winds observed across the much of the area.",9485188,ADMIRALTY INLET AREA (ZONE), ,1/10/14,1914,19:14,2014-01-10  19:00:00 | Washington,High Wind,36, ,0,0,0,0,Washington,PST-8,MS,81020,Z,510,SEW,0,0,ASOS, , , , , , , , , , , , ,"Numerous reports of sustained wind or gusts in the high wind category were reported, from the KNUW ASOS, from a mesonet location in Port Townsend, and from the Keystone ferry dock.",Prefrontal southeast high winds occurred on the coast and over the north interior. This was the first of three separate high wind episodes.,10496910,SOUTH COAST (ZONE), ,1/10/14,2115,21:15,2014-01-10  21:00:00 | Washington,High Wind,69, ,0,0,0,0,Washington,PST-8,MG,82532,Z,21,PQR,0,0,Official NWS Observations, , , , , , , , , , , , ,"Strong winds were reported at several weather stations along the South Washington Coast including 55mph sustained winds with a gust of 79 mph at Megler Bridge (ODT76). Cape Disappointment (82sW1) also measured a peak gust of 70 mph, with Toke Point (TOKW1) measuring sustained winds of 40 mph and a gust of 56 mph.",A strong Pacific Storm brought windy conditions to the Southwest Washington coast and the Willapa Hills.,11485189,WESTERN WHATCOM COUNTY (ZONE), ,1/10/14,2301,23:01,2014-01-10  23:00:00 | Washington,High Wind,36, ,0,0,0,0,Washington,PST-8,MS,81020,Z,503,SEW,0,0,Mesonet, , , , , , , , , , , , ,"A CWOP site near Bellingham recorded 40-42 mph sustained wind with a gust of 59 mph.|The windstorm caused a tree to crash through the roof of a mobile home on Emily Dr. east of Bellingham, in the morning hours Saturday.",Prefrontal southeast high winds occurred on the coast and over the north interior. This was the first of three separate high wind episodes.,12485186,WESTERN SKAGIT COUNTY (ZONE), ,1/11/14,10,0:10,2014-01-11  0:00:00 | Washington,High Wind,35, ,0,0,0,0,Washington,PST-8,MS,81020,Z,506,SEW,0,0,Department of Highways, , , , , , , , , , , , ,A state department of transportation sensor recorded 40 mph sustained wind.,Prefrontal southeast high winds occurred on the coast and over the north interior. This was the first of three separate high wind episodes.,13485182,CENTRAL COAST (ZONE), ,1/11/14,53,0:53,2014-01-11  0:00:00 | Washington,High Wind,37, ,0,0,0,0,Washington,PST-8,MS,81020,Z,517,SEW,0,0,ASOS, , , , , , , , , , , , ,The ASOS at KHQM recorded 43 mph sustained wind off and a peak wind of 63 mph.,Prefrontal southeast high winds occurred on the coast and over the north interior. This was the first of three separate high wind episodes.,14496911,SOUTHWEST INTERIOR (ZONE), ,1/11/14,500,5:00,2014-01-11  5:00:00 | Washington,High Wind,36, ,0,0,0,0,Washington,PST-8,MS,82532,Z,20,PQR,0,0,RAWS, , , , , , , , , , , , ,The Abernathy RAWS (ABNW1) reported sustained winds of 41 mph with a peak gust of 67 mph.,A strong Pacific Storm brought windy conditions to the Southwest Washington coast and the Willapa Hills.,15483168,EAST SLOPES OF THE WASHINGTON CASCADES (ZONE), ,1/11/14,550,5:50,2014-01-11  5:00:00 | Washington,High Wind,50, ,0,0,0,0,Washington,PST-8,EG,80676,Z,520,PDT,0,0,Trained Spotter, , , , , , , , , , , , ,Strong winds downed a tree into power lines causing a power outage in Trout Lake.  Trees also fell across highway 141.,"Strong winds moved into the interior Pacific Northwest over the January 10-12th weekend. Several reports of high wind gusts and damage were recorded with these winds. Wind gusts in MPH were reported: (76) Hanford, (71) southwest of Harrah, (70) Hanford, (68) north of West Richland,  (66) Hanford, (65) south west of Harrah, (64) southeast Hanford, (64) Hanford, (62) northwest of West Richland, (62) north east of Sunnyside, (61) southwest of Harrah, (61) east of Glenwood, (61) east of Selah, (61) north of Richland, (60) west northwest of Bickleton, (60) west of Basin City, (60) north northeast of Sunnyside, (59) southeast of Eltopia, (59) south of Yakima, (58) northeast of Sunnyside, (58) east of Goldendale, (58) southeast of Dayton, (58) Hanford, (58) west of Basin City, and sustained winds of 45 mph just west of College Place.  Also strong winds downed a tree into power lines causing a power outage in Trout Lake.  Trees also fell across Highway 141.  A semi Truck was blown over on Highway 240 and the driver was hospitalized.  Trees were reported down in Dayton.  A trained spotter reported small trees down an a 4.5 foot childs playhouse was carried from their backyard to their front yard.",16483172,YAKIMA VALLEY (ZONE), ,1/11/14,553,5:53,2014-01-11  5:00:00 | Washington,High Wind,62, ,0,0,0,0,Washington,PST-8,MG,80676,Z,27,PDT,0,0,Mesonet, , , , , , , , , , , , ,,"Strong winds moved into the interior Pacific Northwest over the January 10-12th weekend. Several reports of high wind gusts and damage were recorded with these winds. Wind gusts in MPH were reported: (76) Hanford, (71) southwest of Harrah, (70) Hanford, (68) north of West Richland,  (66) Hanford, (65) south west of Harrah, (64) southeast Hanford, (64) Hanford, (62) northwest of West Richland, (62) north east of Sunnyside, (61) southwest of Harrah, (61) east of Glenwood, (61) east of Selah, (61) north of Richland, (60) west northwest of Bickleton, (60) west of Basin City, (60) north northeast of Sunnyside, (59) southeast of Eltopia, (59) south of Yakima, (58) northeast of Sunnyside, (58) east of Goldendale, (58) southeast of Dayton, (58) Hanford, (58) west of Basin City, and sustained winds of 45 mph just west of College Place.  Also strong winds downed a tree into power lines causing a power outage in Trout Lake.  Trees also fell across Highway 141.  A semi Truck was blown over on Highway 240 and the driver was hospitalized.  Trees were reported down in Dayton.  A trained spotter reported small trees down an a 4.5 foot childs playhouse was carried from their backyard to their front yard.",17489554,SPOKANE CO.,DEER PARK,1/11/14,600,6:00,2014-01-11  6:00:00 | Washington,Flood, , ,0,0,1000,0,Washington,PST-8, ,81564,C,63,OTX,0,0,Trained Spotter,Heavy Rain / Snow Melt, , ,1,NNE,0,E,DEER PARK,47.9651,-117.465,47.9506,-117.4617,"Minor urban flooding reported in and around Deer Park.  Residence living on 2nd Avenue indicated water over the roadway and some water seeping into a basement of a building.  Large puddles covering other roads around town, but all were passable without any closures reported.  Damage costs were estimated.","A deep fetch of Pacific moisture brought heavy snow to the mountains and moderate to heavy rain to the valleys across the area overnight on January 10th into the 11th.  Localized flooding was observed in the northeast mountains of Washington due to a combination of rainfall, snow melt and frozen soils.  Rainfall amounts were generally up into the half inch to one inch range for this period, which typically would not cause flooding if not in combination with low elevation snow melt and frozen soils preventing water from seeping into the ground.  Flooding impacts were minor and limited to low spots in the terrain, in urban areas and along small streams.  Rain and heavy snow was followed by a strong cold front passage during the early morning hours of January 11th with strong and damaging winds observed across the much of the area.",18483171,LOWER COLUMBIA BASIN (ZONE), ,1/11/14,700,7:00,2014-01-11  7:00:00 | Washington,High Wind,66, ,0,0,0,0,Washington,PST-8,MG,80676,Z,28,PDT,0,0,Mesonet, , , , , , , , , , , , ,,"Strong winds moved into the interior Pacific Northwest over the January 10-12th weekend. Several reports of high wind gusts and damage were recorded with these winds. Wind gusts in MPH were reported: (76) Hanford, (71) southwest of Harrah, (70) Hanford, (68) north of West Richland,  (66) Hanford, (65) south west of Harrah, (64) southeast Hanford, (64) Hanford, (62) northwest of West Richland, (62) north east of Sunnyside, (61) southwest of Harrah, (61) east of Glenwood, (61) east of Selah, (61) north of Richland, (60) west northwest of Bickleton, (60) west of Basin City, (60) north northeast of Sunnyside, (59) southeast of Eltopia, (59) south of Yakima, (58) northeast of Sunnyside, (58) east of Goldendale, (58) southeast of Dayton, (58) Hanford, (58) west of Basin City, and sustained winds of 45 mph just west of College Place.  Also strong winds downed a tree into power lines causing a power outage in Trout Lake.  Trees also fell across Highway 141.  A semi Truck was blown over on Highway 240 and the driver was hospitalized.  Trees were reported down in Dayton.  A trained spotter reported small trees down an a 4.5 foot childs playhouse was carried from their backyard to their front yard.",19483169,SIMCOE HIGHLANDS (ZONE), ,1/11/14,756,7:56,2014-01-11  7:00:00 | Washington,High Wind,53, ,0,0,0,0,Washington,PST-8,MG,80676,Z,521,PDT,0,0,Mesonet, , , , , , , , , , , , ,,"Strong winds moved into the interior Pacific Northwest over the January 10-12th weekend. Several reports of high wind gusts and damage were recorded with these winds. Wind gusts in MPH were reported: (76) Hanford, (71) southwest of Harrah, (70) Hanford, (68) north of West Richland,  (66) Hanford, (65) south west of Harrah, (64) southeast Hanford, (64) Hanford, (62) northwest of West Richland, (62) north east of Sunnyside, (61) southwest of Harrah, (61) east of Glenwood, (61) east of Selah, (61) north of Richland, (60) west northwest of Bickleton, (60) west of Basin City, (60) north northeast of Sunnyside, (59) southeast of Eltopia, (59) south of Yakima, (58) northeast of Sunnyside, (58) east of Goldendale, (58) southeast of Dayton, (58) Hanford, (58) west of Basin City, and sustained winds of 45 mph just west of College Place.  Also strong winds downed a tree into power lines causing a power outage in Trout Lake.  Trees also fell across Highway 141.  A semi Truck was blown over on Highway 240 and the driver was hospitalized.  Trees were reported down in Dayton.  A trained spotter reported small trees down an a 4.5 foot childs playhouse was carried from their backyard to their front yard.",20494013,WEST SLOPES NORTHERN CASCADES AND PASSES (ZONE), ,1/11/14,800,8:00,2014-01-11  8:00:00 | Washington,Heavy Snow, , ,0,0,0,0,Washington,PST-8, ,82124,Z,518,SEW,0,0,Park/Forest Service, , , , , , , , , , , , ,USFS NWAC station at Mt Baker measured 13 inches snow in 12 hours ending 8 pm Jan 11. USFS NWAC station at Stevens Pass measured 19 inches snow in 24 hours ending 9 am Jan 12.,A frontal system and the Puget Sound Convergence Zone that formed in its wake brought heavy snow to several spots in the Cascades.,21494014,WEST SLOPES CENTRAL CASCADES AND PASSES (ZONE), ,1/11/14,800,8:00,2014-01-11  8:00:00 | Washington,Heavy Snow, , ,0,0,0,0,Washington,PST-8, ,82124,Z,519,SEW,0,0,Park/Forest Service, , , , , , , , , , , , ,"USFS NWAC station at Stevens Pass measured 19 inches snow in 24 hours ending 9 am Jan 12. USFS NWAC station at Paradise measured 12 inches snow in 12 hours ending 9 am Jan 12, and 30 inches storm total.",A frontal system and the Puget Sound Convergence Zone that formed in its wake brought heavy snow to several spots in the Cascades.,22489543,NORTHEAST MOUNTAINS (ZONE), ,1/11/14,815,8:15,2014-01-11  8:00:00 | Washington,High Wind,61, ,0,0,0,0,Washington,PST-8,EG,81564,Z,37,OTX,0,0,Public, , , , , , , , , , , , ,A 40 foot cell phone tower collapsed due to high winds at 49 Degrees North Ski Area.  The cell tower smashed through the rough of an adjacent building that contained some transmission equipment.  A tree also was knocked over into some power lines near the resort at 0948PST; power was later restored at 1135PST.,"A deep fetch of Pacific moisture brought heavy snow to the mountains and moderate to heavy rain to the valleys across the area overnight on January 10th into the 11th.  Localized flooding was observed in the northeast mountains of Washington due to a combination of rainfall, snow melt and frozen soils.  Rainfall amounts were generally up into the half inch to one inch range for this period, which typically would not cause flooding if not in combination with low elevation snow melt and frozen soils preventing water from seeping into the ground.  Flooding impacts were minor and limited to low spots in the terrain, in urban areas and along small streams.  Rain and heavy snow was followed by a strong cold front passage during the early morning hours of January 11th with strong and damaging winds observed across the much of the area.",23483170,BLUE MOUNTAIN FOOTHILLS (ZONE), ,1/11/14,823,8:23,2014-01-11  8:00:00 | Washington,High Wind,50, ,0,0,0,0,Washington,PST-8,MG,80676,Z,29,PDT,0,0,Mesonet, , , , , , , , , , , , ,,"Strong winds moved into the interior Pacific Northwest over the January 10-12th weekend. Several reports of high wind gusts and damage were recorded with these winds. Wind gusts in MPH were reported: (76) Hanford, (71) southwest of Harrah, (70) Hanford, (68) north of West Richland,  (66) Hanford, (65) south west of Harrah, (64) southeast Hanford, (64) Hanford, (62) northwest of West Richland, (62) north east of Sunnyside, (61) southwest of Harrah, (61) east of Glenwood, (61) east of Selah, (61) north of Richland, (60) west northwest of Bickleton, (60) west of Basin City, (60) north northeast of Sunnyside, (59) southeast of Eltopia, (59) south of Yakima, (58) northeast of Sunnyside, (58) east of Goldendale, (58) southeast of Dayton, (58) Hanford, (58) west of Basin City, and sustained winds of 45 mph just west of College Place.  Also strong winds downed a tree into power lines causing a power outage in Trout Lake.  Trees also fell across Highway 141.  A semi Truck was blown over on Highway 240 and the driver was hospitalized.  Trees were reported down in Dayton.  A trained spotter reported small trees down an a 4.5 foot childs playhouse was carried from their backyard to their front yard.",24489539,SPOKANE AREA (ZONE), ,1/11/14,910,9:10,2014-01-11  9:00:00 | Washington,High Wind,50, ,0,0,0,0,Washington,PST-8,EG,81564,Z,36,OTX,0,0,Trained Spotter, , , , , , , , , , , , ,A ten inch diameter tree snapped off in the Five Mile Prairie area north of Spokane; some houses also lost shingles in the area.  There was also a report of an old growth tree that lost four large branches with a girth of eight inches in diameter north of Davenport.  One of these branches flew about ten feet away from the tree.,"A deep fetch of Pacific moisture brought heavy snow to the mountains and moderate to heavy rain to the valleys across the area overnight on January 10th into the 11th.  Localized flooding was observed in the northeast mountains of Washington due to a combination of rainfall, snow melt and frozen soils.  Rainfall amounts were generally up into the half inch to one inch range for this period, which typically would not cause flooding if not in combination with low elevation snow melt and frozen soils preventing water from seeping into the ground.  Flooding impacts were minor and limited to low spots in the terrain, in urban areas and along small streams.  Rain and heavy snow was followed by a strong cold front passage during the early morning hours of January 11th with strong and damaging winds observed across the much of the area.",25492739,SEATTLE/BREMERTON AREA (ZONE), ,1/11/14,1000,10:00,2014-01-11  10:00:00 | Washington,Strong Wind,49, ,0,0,300000,0,Washington,PST-8,MG,81985,Z,508,SEW,0,0,Newspaper, , , , , , , , , , , , ,"About 30,000 people in the Seattle area were without power.","Strong wind knocked out power to nearly 90,000 customers in western Washington.  A landslide blocked a road near Index, cutting off access to about 90 homeowners.",26489535,LOWER GARFIELD & ASOTIN (ZONE), ,1/11/14,1000,10:00,2014-01-11  10:00:00 | Washington,High Wind,52, ,0,0,0,0,Washington,PST-8,MG,81564,Z,32,OTX,0,0,Mesonet, , , , , , , , , , , , ,,"A deep fetch of Pacific moisture brought heavy snow to the mountains and moderate to heavy rain to the valleys across the area overnight on January 10th into the 11th.  Localized flooding was observed in the northeast mountains of Washington due to a combination of rainfall, snow melt and frozen soils.  Rainfall amounts were generally up into the half inch to one inch range for this period, which typically would not cause flooding if not in combination with low elevation snow melt and frozen soils preventing water from seeping into the ground.  Flooding impacts were minor and limited to low spots in the terrain, in urban areas and along small streams.  Rain and heavy snow was followed by a strong cold front passage during the early morning hours of January 11th with strong and damaging winds observed across the much of the area.",27492740,EVERETT AND VICINITY (ZONE), ,1/11/14,1000,10:00,2014-01-11  10:00:00 | Washington,Strong Wind,45, ,0,0,100000,0,Washington,PST-8,MG,81985,Z,507,SEW,0,0,Newspaper, , , , , , , , , , , , ,"About 10,000 people in Snohomish county were without power.","Strong wind knocked out power to nearly 90,000 customers in western Washington.  A landslide blocked a road near Index, cutting off access to about 90 homeowners.",28489537,WASHINGTON PALOUSE (ZONE), ,1/11/14,1010,10:10,2014-01-11  10:00:00 | Washington,High Wind,48, ,0,0,0,0,Washington,PST-8,MS,81564,Z,33,OTX,0,0,Mesonet, , , , , , , , , , , , ,,"A deep fetch of Pacific moisture brought heavy snow to the mountains and moderate to heavy rain to the valleys across the area overnight on January 10th into the 11th.  Localized flooding was observed in the northeast mountains of Washington due to a combination of rainfall, snow melt and frozen soils.  Rainfall amounts were generally up into the half inch to one inch range for this period, which typically would not cause flooding if not in combination with low elevation snow melt and frozen soils preventing water from seeping into the ground.  Flooding impacts were minor and limited to low spots in the terrain, in urban areas and along small streams.  Rain and heavy snow was followed by a strong cold front passage during the early morning hours of January 11th with strong and damaging winds observed across the much of the area.",29485190,CENTRAL COAST (ZONE), ,1/11/14,1012,10:12,2014-01-11  10:00:00 | Washington,High Wind,43, ,0,0,0,0,Washington,PST-8,MS,81021,Z,517,SEW,0,0,ASOS, , , , , , , , , , , , ,The ASOS at KQHM recorded a peak wind of 58 mph.  The tide gauge at Westport recorded sustained high wind between 40 and 49 mph.,Strong onshore flow in the wake of a frontal passage brought westerly high wind to the coast and north interior.  This is the second of three separate high wind episodes.,30485193,WESTERN WHATCOM COUNTY (ZONE), ,1/11/14,1136,11:36,2014-01-11  11:00:00 | Washington,High Wind,36, ,0,0,0,0,Washington,PST-8,MS,81021,Z,503,SEW,0,0,Mesonet, , , , , , , , , , , , ,A CWOP near Bellingham recorded 41 mph sustained wind with a 59 mph gust.,Strong onshore flow in the wake of a frontal passage brought westerly high wind to the coast and north interior.  This is the second of three separate high wind episodes.,31496884,SOUTH WASHINGTON CASCADES (ZONE), ,1/11/14,1300,13:00,2014-01-11  13:00:00 | Washington,Heavy Snow, , ,0,0,0,0,Washington,PST-8, ,82526,Z,19,PQR,0,0,SNOTEL, , , , , , , , , , , , ,Twenty inches of snow was measured at June lake (3340 feet). A snow rate of 1 inch per hour was measured around 1900 PST on January 11th.,A complex low pressure system brought a series of fronts across the Pacific Northwest January 11 through January 12 that resulted in heavy snow for the South Washington Cascades.,32485195,ADMIRALTY INLET AREA (ZONE), ,1/11/14,1405,14:05,2014-01-11  14:00:00 | Washington,High Wind,36, ,0,0,0,0,Washington,PST-8,MS,81021,Z,510,SEW,0,0,Mesonet, , , , , , , , , , , , ,A mesonet site on Camano Island recorded 40-41 mph sustained wind.,Strong onshore flow in the wake of a frontal passage brought westerly high wind to the coast and north interior.  This is the second of three separate high wind episodes.,33489538,MOSES LAKE AREA (ZONE), ,1/11/14,1410,14:10,2014-01-11  14:00:00 | Washington,High Wind,56, ,0,0,0,0,Washington,PST-8,MG,81564,Z,34,OTX,0,0,Mesonet, , , , , , , , , , , , ,A portion of Highway 24 was closed due to an overabundance of wind-blown tumble weeds onto the highway.  Snow plows had to be called out to remove the tumble weeds before the highway could be reopened.,"A deep fetch of Pacific moisture brought heavy snow to the mountains and moderate to heavy rain to the valleys across the area overnight on January 10th into the 11th.  Localized flooding was observed in the northeast mountains of Washington due to a combination of rainfall, snow melt and frozen soils.  Rainfall amounts were generally up into the half inch to one inch range for this period, which typically would not cause flooding if not in combination with low elevation snow melt and frozen soils preventing water from seeping into the ground.  Flooding impacts were minor and limited to low spots in the terrain, in urban areas and along small streams.  Rain and heavy snow was followed by a strong cold front passage during the early morning hours of January 11th with strong and damaging winds observed across the much of the area.",34489553,WENATCHEE AREA (ZONE), ,1/11/14,2000,20:00,2014-01-11  20:00:00 | Washington,Strong Wind,41, ,0,0,1000,0,Washington,PST-8,EG,81564,Z,41,OTX,0,0,COOP Observer, , , , , , , , , , , , ,Winds snapped off the top of some trees.  Damage cost was estimated.,"A deep fetch of Pacific moisture brought heavy snow to the mountains and moderate to heavy rain to the valleys across the area overnight on January 10th into the 11th.  Localized flooding was observed in the northeast mountains of Washington due to a combination of rainfall, snow melt and frozen soils.  Rainfall amounts were generally up into the half inch to one inch range for this period, which typically would not cause flooding if not in combination with low elevation snow melt and frozen soils preventing water from seeping into the ground.  Flooding impacts were minor and limited to low spots in the terrain, in urban areas and along small streams.  Rain and heavy snow was followed by a strong cold front passage during the early morning hours of January 11th with strong and damaging winds observed across the much of the area.",35485197,CENTRAL COAST (ZONE), ,1/11/14,2042,20:42,2014-01-11  20:00:00 | Washington,High Wind,37, ,0,0,0,0,Washington,PST-8,MS,81022,Z,517,SEW,0,0,Other Federal Agency, , , , , , , , , , , , ,The Westport tide gauge recorded 40-43 mph sustained wind.,Northwesterly high wind occurred on the central coast on the evening of January 11.  This is the third of three separate high wind episodes.,36483053,EAST SLOPES OF THE WASHINGTON CASCADES (ZONE), ,1/13/14,600,6:00,2014-01-13  6:00:00 | Washington,High Wind,52, ,0,0,0,0,Washington,PST-8,EG,80677,Z,520,PDT,0,0,Newspaper, , , , , , , , , , , , ,Local reporter passed along information about numerous trees and power poles down in the Roslyn area and Cle Elum area.,January 13th High Wind Event for the East Slopes of the Washington Cascades.,37493483,SPOKANE AREA (ZONE), ,1/15/14,2300,23:00,2014-01-15  23:00:00 | Washington,Freezing Fog, , ,0,0,0,0,Washington,PST-8, ,82066,Z,36,OTX,0,0,Utility Company, , , , , , , , , , , , ,The Bonneville Power Administration reported issues of riming on their transmission lines running from the Mead area (Bell substation) out onto the west plains.  Avista Utility also reported riming on their transmission lines with power outages reported across the Spokane area.  This included a broken conductor and broken poles between the Four Mounds area to the Idaho state border.,This period was dominated by a strong upper level ridge of high pressure.  Subsidence associated with this ridge trapped low level moisture with widespread fog developing across the area.  Freezing temperatures and dense fog produced some rime on power lines leading to power outages across the area.,38493482,UPPER COLUMBIA BASIN (ZONE), ,1/15/14,2300,23:00,2014-01-15  23:00:00 | Washington,Freezing Fog, , ,0,0,0,0,Washington,PST-8, ,82066,Z,35,OTX,0,0,Utility Company, , , , , , , , , , , , ,The Bonneville Power Administration reported issues of riming on their transmission lines running across the northern portions of the Columbia Basin.,This period was dominated by a strong upper level ridge of high pressure.  Subsidence associated with this ridge trapped low level moisture with widespread fog developing across the area.  Freezing temperatures and dense fog produced some rime on power lines leading to power outages across the area.,39545749,WEST SLOPES NORTHERN CASCADES AND PASSES (ZONE), ,1/18/14,1215,12:15,2014-01-18  12:00:00 | Washington,Avalanche, , ,1,0,0,0,Washington,PST-8, ,91037,Z,518,SEW,0,0,Park/Forest Service, , , , , , , , , , , , ,"Two climbers, one climber involved with a cornice failure resulting in one fatality.","Two climbers, one climber involved with a cornice failure resulting in one fatality.",40497160,GREATER VANCOUVER AREA (ZONE), ,1/23/14,1200,12:00,2014-01-23  12:00:00 | Washington,Strong Wind,35, ,0,0,20000,0,Washington,PST-8,MG,82567,Z,39,PQR,0,0,Newspaper, , , , , , , , , , , , ,Strong East winds tipped a semi-trailer over while traveling across the Glen Jackson Bridge on January 23rd. This accident resulted in traffic delays on Interstate 205 and closed boat traffic for just over an hour. Additional winds on January 24th resulted in the collapse of a carport at a Vancouver apartment complex. Over 2000 Clark Power Utility customers lost power for around an hour due to downed tree limbs on power lines.,A strong upper level ridge resulted in gusty easty winds through the Columbia River Gorge and Vancouver Area. These winds resulted in minor damage including tipping over a semi-trailer on the Glen Jackson Bridge.,41494015,WEST SLOPES CENTRAL CASCADES AND PASSES (ZONE), ,1/28/14,2200,22:00,2014-01-28  22:00:00 | Washington,Winter Storm, , ,0,0,0,0,Washington,PST-8, ,82125,Z,519,SEW,0,0,Department of Highways, , , , , , , , , , , , ,Washington DOT at Snoqualmie Pass and White Pass reported ice accumulation of 0.25 inch from freezing rain.,"Strong, cold easterly flow ahead an approaching warm front produced a mix of snow and freezing rain in the Cascades passes, with ice accumulations of 0.25 inch or more at both Snoqualmie Pass and White Pass.",42489522,WENATCHEE AREA (ZONE), ,1/28/14,2230,22:30,2014-01-28  22:00:00 | Washington,Heavy Snow, , ,0,0,0,0,Washington,PST-8, ,81561,Z,41,OTX,0,0,COOP Observer, , , , , , , , , , , , ,Widespread storm total snowfall amounts of two to five inches reported.,A deepening shortwave trough of low pressure spun up a low pressure system at the surface.  This low pressure system swung through a strong warm front that tapped into an atmospheric river with sub-tropic origins out of the Pacific Ocean.  There were two regions in eastern Washington that experienced heavy snowfall with most other areas seeing rain or light snowfall before transitioning over to rain.  The first area to receive heavy snowfall was in the lee of the northern Cascade Mountains.  Thermal profiles during the event for this area supported snow due to cold air damning.  Strong warm air advection across the basin resulted in mostly rain with heavy snow observed further north where temperatures were colder across the Spokane area and northeast mountains of Washington.,43489523,WATERVILLE PLATEAU (ZONE), ,1/28/14,2230,22:30,2014-01-28  22:00:00 | Washington,Heavy Snow, , ,0,0,0,0,Washington,PST-8, ,81561,Z,44,OTX,0,0,COOP Observer, , , , , , , , , , , , ,Storm total snowfall amounts generally between three to five inches.,A deepening shortwave trough of low pressure spun up a low pressure system at the surface.  This low pressure system swung through a strong warm front that tapped into an atmospheric river with sub-tropic origins out of the Pacific Ocean.  There were two regions in eastern Washington that experienced heavy snowfall with most other areas seeing rain or light snowfall before transitioning over to rain.  The first area to receive heavy snowfall was in the lee of the northern Cascade Mountains.  Thermal profiles during the event for this area supported snow due to cold air damning.  Strong warm air advection across the basin resulted in mostly rain with heavy snow observed further north where temperatures were colder across the Spokane area and northeast mountains of Washington.,44489524,SPOKANE AREA (ZONE), ,1/28/14,2330,23:30,2014-01-28  23:00:00 | Washington,Heavy Snow, , ,0,0,0,0,Washington,PST-8, ,81561,Z,36,OTX,0,0,COOP Observer, , , , , , , , , , , , ,Storm total snowfall totals of up to four inches.,A deepening shortwave trough of low pressure spun up a low pressure system at the surface.  This low pressure system swung through a strong warm front that tapped into an atmospheric river with sub-tropic origins out of the Pacific Ocean.  There were two regions in eastern Washington that experienced heavy snowfall with most other areas seeing rain or light snowfall before transitioning over to rain.  The first area to receive heavy snowfall was in the lee of the northern Cascade Mountains.  Thermal profiles during the event for this area supported snow due to cold air damning.  Strong warm air advection across the basin resulted in mostly rain with heavy snow observed further north where temperatures were colder across the Spokane area and northeast mountains of Washington.,45489526,NORTHEAST MOUNTAINS (ZONE), ,1/29/14,130,1:30,2014-01-29  1:00:00 | Washington,Heavy Snow, , ,0,0,0,0,Washington,PST-8, ,81561,Z,37,OTX,0,0,Trained Spotter, , , , , , , , , , , , ,Widespread storm total snowfall totals of between three and seven inches.,A deepening shortwave trough of low pressure spun up a low pressure system at the surface.  This low pressure system swung through a strong warm front that tapped into an atmospheric river with sub-tropic origins out of the Pacific Ocean.  There were two regions in eastern Washington that experienced heavy snowfall with most other areas seeing rain or light snowfall before transitioning over to rain.  The first area to receive heavy snowfall was in the lee of the northern Cascade Mountains.  Thermal profiles during the event for this area supported snow due to cold air damning.  Strong warm air advection across the basin resulted in mostly rain with heavy snow observed further north where temperatures were colder across the Spokane area and northeast mountains of Washington.,46499051,NORTHEAST MOUNTAINS (ZONE), ,2/5/14,100,0.069444444,2014-02-05  1:00:00 | Washington,Extreme Cold/Wind Chill, , ,0,0,0,0,Washington,PST-8, ,82810,Z,37,OTX,0,0,Mesonet, , , , , , , , , , , , ,Wind chill values varied due to complex terrain and sheltering. Windier locations experienced wind chills between minus 15 and minus 20 degrees Fahrenheit. Wind chills in the sheltered valleys only dropped between minus 5 and minus 12 degrees Fahrenheit.  The Deer Park ASOS observed a wind chill of minus 20 degrees Fahrenheit.,An Arctic air mass spilled into the Inland Northwest between the 4th and 5th of February. The combination of single digit temperatures and winds on the order of 10 to 25 mph with gusts in excess of 30 mph created wind chills between minus fifteen and minus twenty-five degrees Fahrenheit in the valleys and up to minus thirty degrees Fahrenheit in the mountains during the morning hours on the 5th.   Bitterly cold wind chills continued during the morning of the 6th but were paired with slightly cooler temperatures and weaker winds.  The cold and bitterly cold wind chills led to school closures in the Ephrata School District.,47499052,SPOKANE AREA (ZONE), ,2/5/14,300,3:00,2014-02-05  3:00:00 | Washington,Extreme Cold/Wind Chill, , ,0,0,0,0,Washington,PST-8, ,82810,Z,36,OTX,0,0,Mesonet, , , , , , , , , , , , ,Wind chill values of minus 15 to minus 20 degrees Fahrenheit were observed across the West Plains and higher benches surrounding the city of Spokane.  More sheltered locations only observed winds chills between minus 10 and minus 15 degrees Fahrenheit.,An Arctic air mass spilled into the Inland Northwest between the 4th and 5th of February. The combination of single digit temperatures and winds on the order of 10 to 25 mph with gusts in excess of 30 mph created wind chills between minus fifteen and minus twenty-five degrees Fahrenheit in the valleys and up to minus thirty degrees Fahrenheit in the mountains during the morning hours on the 5th.   Bitterly cold wind chills continued during the morning of the 6th but were paired with slightly cooler temperatures and weaker winds.  The cold and bitterly cold wind chills led to school closures in the Ephrata School District.,48507463,SOUTH WASHINGTON CASCADES (ZONE), ,2/5/14,600,6:00,2014-02-05  6:00:00 | Washington,Extreme Cold/Wind Chill, , ,0,0,0,0,Washington,PST-8, ,84057,Z,19,PQR,0,0,Official NWS Observations, , , , , , , , , , , , ,Temperatures in the single digits combined with persistent 20 to 30 mph winds produced wind chills in the -15 to -20 degrees Fahrenheit range.,An Arctic air mass combined with strong easterly winds resulted in extremely low wind chill values for the Cascades.,49499056,NORTHEAST MOUNTAINS (ZONE), ,2/6/14,400,4:00,2014-02-06  4:00:00 | Washington,Extreme Cold/Wind Chill, , ,0,0,0,0,Washington,PST-8, ,82810,Z,37,OTX,0,0,Mesonet, , , , , , , , , , , , ,Very cold temperatures and winds near 10 mph resulted in wind chills of minus 10 to minus 21 across the zone.  The coldest reading of minus 21 was at the Teepee Seed Orchard RAWS.,An Arctic air mass spilled into the Inland Northwest between the 4th and 5th of February. The combination of single digit temperatures and winds on the order of 10 to 25 mph with gusts in excess of 30 mph created wind chills between minus fifteen and minus twenty-five degrees Fahrenheit in the valleys and up to minus thirty degrees Fahrenheit in the mountains during the morning hours on the 5th.   Bitterly cold wind chills continued during the morning of the 6th but were paired with slightly cooler temperatures and weaker winds.  The cold and bitterly cold wind chills led to school closures in the Ephrata School District.,50506576,GREATER VANCOUVER AREA (ZONE), ,2/6/14,530,5:30,2014-02-06  5:00:00 | Washington,Heavy Snow, , ,0,0,0,0,Washington,PST-8, ,83930,Z,39,PQR,0,0,Social Media, , , , , , , , , , , , ,"A band of Heavy snow moved through Clark County, with heavier snow early in the day than the rest of the Greater Portland/Vancouver metro area. Snow accumulations were generally 5 to 9 inches. A blogger reported 9.5 inches of snow in Ridgefield, and we received a Facebook post of 7.5 inches of snow in Salmon Creek. A HAM amateur radio operator repoted 7 inches of snow in Battle Ground.",A preceding cold arctic air mass combined with a moist Pacific storm resulted in widespread heavy snow for Southwest Washington. East winds through the Columbia River Gorge maintained colder air to the north where the precipitation fell mainly as snow.,51506477,WESTERN COLUMBIA GORGE (ZONE), ,2/6/14,800,8:00,2014-02-06  8:00:00 | Washington,Blizzard, , ,0,0,0,0,Washington,PST-8, ,83907,Z,45,PQR,0,0,Official NWS Observations, , , , , , , , , , , , ,"Biddle Butte gusted greater than 35 mph with a peak gust of 60 mph, and a CWOP station in Washougal (AP164) frequently gusted to 25 mph with a peak of 44 mph. There were no snow reports with in this snow, but snow reports near by support that 4 to 8 inches of snow in the area. Near by Cascade Locks reported 8 inches of snow.",Preceding cold arctic air mass combined with Strong East winds and a moist front resulted in blizzard conditions for the Western Columbia River Gorge.,52506577,CENTRAL COLUMBIA RIVER GORGE (ZONE), ,2/6/14,800,8:00,2014-02-06  8:00:00 | Washington,Heavy Snow, , ,0,0,0,0,Washington,PST-8, ,83930,Z,46,PQR,0,0,Department of Highways, , , , , , , , , , , , ,"Although there were no reports on the Washington side of the Central Columbia River Gorge there were several reports of heavy snow in the more populated areas just across the River in Oregon. The Hood River County Emegency Manager reported 10 inches of snow in hood River. The oregon Department of Transportation reported 9 inches of snow in Hood River, and 8 inches in Cascade Locks. With these observations it is estimated that 7 to 12 inches of snow fell on the Washington side of the Central Columbia River Gorge.",A preceding cold arctic air mass combined with a moist Pacific storm resulted in widespread heavy snow for Southwest Washington. East winds through the Columbia River Gorge maintained colder air to the north where the precipitation fell mainly as snow.,53506575,LOWER COLUMBIA (ZONE), ,2/6/14,800,8:00,2014-02-06  8:00:00 | Washington,Heavy Snow, , ,0,0,0,0,Washington,PST-8, ,83930,Z,22,PQR,0,0,Trained Spotter, , , , , , , , , , , , ,"Light snow began early in the morning, then increased during the afternoon resulting in a Winter Weather Advisory being upgraded to a Winter Weather Warning. A person from the gernal public reported 7 inches of snow in Woodland, and two trained NWS spotters reported 6 inches of snow at Kalama and Longview.",A preceding cold arctic air mass combined with a moist Pacific storm resulted in widespread heavy snow for Southwest Washington. East winds through the Columbia River Gorge maintained colder air to the north where the precipitation fell mainly as snow.,54495679,WENATCHEE AREA (ZONE), ,2/6/14,1830,18:30,2014-02-06  18:00:00 | Washington,Winter Weather, , ,0,0,0,0,Washington,PST-8, ,82179,Z,41,OTX,0,0,CoCoRaHS, , , , , , , , , , , , ,Snowfall amounts ranged from three to four inches with locally up to five inches.,"A strong Pacific jet with ties to subtropical moisture setup across central Oregon allowing an active storm track along the Washington, Oregon border.  The second low pressure system in as many days took aim on southeastern Washington during the overnight and morning hours of the 8th of February.  A band of light to moderate snow on the northeastern periphery brought one to three inches of snow across the Washington Palouse.  A third low pressure system during the evening of the 8th into the morning of the 9th dropped another three to four inches.  Meanwhile, northeast winds drawn into the system continued to bring modified arctic air from Canada into the region.  The combination of temperatures in the teens and northeast winds between 15 and 25 mph resulted in blowing snow and large drifts across the Palouse closing sections of Highway 27 on each the 8th and 9th of February.  Road closures on the 8th were centered between mile posts 59 and the community of Latah.  On the 9th, Highway 27 was closed between mile posts 48 and 63.",55495856,UPPER COLUMBIA BASIN (ZONE), ,2/6/14,1900,19:00,2014-02-06  19:00:00 | Washington,Winter Weather, , ,0,0,0,0,Washington,PST-8, ,82159,Z,35,OTX,0,0,COOP Observer, , , , , , , , , , , , ,"Two to three inches of snow fell across southern portions of zone 35, mainly in Adams County.  Northern sections of the zone only received around an inch of snow.",A strong Pacific jet nosing into central Oregon from the northwest drove a cold upper-level low from Canada into the Inland Northwest.  Southwest flow ahead of the trough resulted in a period of moist isentropic ascent across southeastern Washington bringing the first round of light snow.  Snow intensified overnight on the 6th as a surface low deepened over northeastern Oregon setting up a narrow deformation band of moderate to heavy snow.  Many locations across southeastern Washington received between one and three inches of snow but upwards of four to six inches fell within the deformation and across the Washington Palouse.,56494973,WASHINGTON PALOUSE (ZONE), ,2/6/14,2300,23:00,2014-02-06  23:00:00 | Washington,Heavy Snow, , ,0,0,0,0,Washington,PST-8, ,82159,Z,33,OTX,0,0,COOP Observer, , , , , , , , , , , , ,Snowfall amounts ranged from three to five inches leading to hazardous travel during the Friday morning commute.,A strong Pacific jet nosing into central Oregon from the northwest drove a cold upper-level low from Canada into the Inland Northwest.  Southwest flow ahead of the trough resulted in a period of moist isentropic ascent across southeastern Washington bringing the first round of light snow.  Snow intensified overnight on the 6th as a surface low deepened over northeastern Oregon setting up a narrow deformation band of moderate to heavy snow.  Many locations across southeastern Washington received between one and three inches of snow but upwards of four to six inches fell within the deformation and across the Washington Palouse.,57494985,SPOKANE AREA (ZONE), ,2/7/14,0,0:00,2014-02-07  0:00:00 | Washington,Winter Weather, , ,0,0,0,0,Washington,PST-8, ,82159,Z,36,OTX,0,0,COOP Observer, , , , , , , , , , , , ,Snowfall amounts ranged between one and three inches leading to slick travel across the Spokane area.  An accident related to slick road conditions led to temporarily closures of eastbound lanes of Interstate 90 near the Sprague exit.,A strong Pacific jet nosing into central Oregon from the northwest drove a cold upper-level low from Canada into the Inland Northwest.  Southwest flow ahead of the trough resulted in a period of moist isentropic ascent across southeastern Washington bringing the first round of light snow.  Snow intensified overnight on the 6th as a surface low deepened over northeastern Oregon setting up a narrow deformation band of moderate to heavy snow.  Many locations across southeastern Washington received between one and three inches of snow but upwards of four to six inches fell within the deformation and across the Washington Palouse.,58494983,NORTHEAST BLUE MOUNTAINS (ZONE), ,2/7/14,100,0.069444444,2014-02-07  1:00:00 | Washington,Winter Weather, , ,0,0,0,0,Washington,PST-8, ,82159,Z,31,OTX,0,0,COOP Observer, , , , , , , , , , , , ,Snowfall amounts ranged between two and four inches.,A strong Pacific jet nosing into central Oregon from the northwest drove a cold upper-level low from Canada into the Inland Northwest.  Southwest flow ahead of the trough resulted in a period of moist isentropic ascent across southeastern Washington bringing the first round of light snow.  Snow intensified overnight on the 6th as a surface low deepened over northeastern Oregon setting up a narrow deformation band of moderate to heavy snow.  Many locations across southeastern Washington received between one and three inches of snow but upwards of four to six inches fell within the deformation and across the Washington Palouse.,59494984,LOWER GARFIELD & ASOTIN (ZONE), ,2/7/14,100,0.069444444,2014-02-07  1:00:00 | Washington,Winter Weather, , ,0,0,0,0,Washington,PST-8, ,82159,Z,32,OTX,0,0,COOP Observer, , , , , , , , , , , , ,Snowfall amounts ranged between two and four inches.,A strong Pacific jet nosing into central Oregon from the northwest drove a cold upper-level low from Canada into the Inland Northwest.  Southwest flow ahead of the trough resulted in a period of moist isentropic ascent across southeastern Washington bringing the first round of light snow.  Snow intensified overnight on the 6th as a surface low deepened over northeastern Oregon setting up a narrow deformation band of moderate to heavy snow.  Many locations across southeastern Washington received between one and three inches of snow but upwards of four to six inches fell within the deformation and across the Washington Palouse.,60488299,EASTERN COLUMBIA RIVER GORGE (ZONE), ,2/7/14,1300,13:00,2014-02-07  13:00:00 | Washington,Heavy Snow, , ,0,0,0,0,Washington,PST-8, ,81341,Z,24,PDT,0,0,Trained Spotter, , , , , , , , , , , , ,,"The next wave of precipitation would move in mid day on the 7th and bring widespread snow to the forecast area. While warning amounts fell across all cities of the warning zones the highest snowfall amounts in inches are as followed: (13) southwest of Bickleton, (13) northeast of Goldendale, (13) in Naches, (12.3) southeast of Cliffdell, (10) in Lyle, (10) in Snowden, (9.7) in Yakima, (7.5) in Walla Walla, (7) in Dayton, (6) in Ellensburg, and (6) north of Kennewick..",61507439,CENTRAL COLUMBIA RIVER GORGE (ZONE), ,2/7/14,1500,15:00,2014-02-07  15:00:00 | Washington,Winter Storm, , ,0,0,0,0,Washington,PST-8, ,84047,Z,46,PQR,0,0,Trained Spotter, , , , , , , , , , , , ,"There were not many reports in this area, but 4 inches of snow in nearby Parkdale, OR and 9 inches in BZ Corner, OR provide an estimate of 4 to 6 inches of snow. There were also early reports of 1 to 2 inches of snow in the Gorge as the event began. There were intermittent closures on Highway 84 due to snow and icy roads.",A frontal system brought snow and ice to Southwest Washington February 7th and 8th after a previous storm produced widespread heavy snow across the area on February 6th.,62507438,WESTERN COLUMBIA GORGE (ZONE), ,2/7/14,1500,15:00,2014-02-07  15:00:00 | Washington,Winter Storm, , ,0,0,0,0,Washington,PST-8, ,84047,Z,45,PQR,0,0,Trained Spotter, , , , , , , , , , , , ,"There were not many reports in this area, but 4 inches of snow in nearby Parkdale, OR and 9 inches in BZ Corner, OR provide an estimate of 4 to 6 inches of snow. There were also early reports of 1 to 2 inches of snow in the Gorge as the event began. There were intermittent closures on Highway 84 due to snow and icy roads.",A frontal system brought snow and ice to Southwest Washington February 7th and 8th after a previous storm produced widespread heavy snow across the area on February 6th.,63507440,LOWER COLUMBIA (ZONE), ,2/7/14,1600,16:00,2014-02-07  16:00:00 | Washington,Winter Storm, , ,0,0,0,0,Washington,PST-8, ,84047,Z,22,PQR,0,0,Trained Spotter, , , , , , , , , , , , ,A trained spotter in Longview reported 4 inches of snow. Archived radar data estimates that this snow was over a 6 hour period.,A frontal system brought snow and ice to Southwest Washington February 7th and 8th after a previous storm produced widespread heavy snow across the area on February 6th.,64495437,NORTHEAST BLUE MOUNTAINS (ZONE), ,2/7/14,2200,22:00,2014-02-07  22:00:00 | Washington,Winter Weather, , ,0,0,0,0,Washington,PST-8, ,82342,Z,31,OTX,0,0,SNOTEL, , , , , , , , , , , , ,Snowfall amounts ranged between four and seven inches.,"A cold and conditionally unstable air mass had become established across the Inland Northwest as a cold upper-level trough anchored over the region.  A second low pressure system within a 36 hour period tracked across northern Oregon spreading a band of moderate snow within a deformation axis across extreme southeastern Washington and the lower Idaho Panhandle.  As the low pressure system departed to the east, northwest flow in its wake led to numerous snow showers across the rising terrain of the Blue Mountains.",65495438,LOWER GARFIELD & ASOTIN (ZONE), ,2/7/14,2300,23:00,2014-02-07  23:00:00 | Washington,Winter Weather, , ,0,0,0,0,Washington,PST-8, ,82342,Z,32,OTX,0,0,COOP Observer, , , , , , , , , , , , ,Snowfall amounts ranged between three to four inches.,"A cold and conditionally unstable air mass had become established across the Inland Northwest as a cold upper-level trough anchored over the region.  A second low pressure system within a 36 hour period tracked across northern Oregon spreading a band of moderate snow within a deformation axis across extreme southeastern Washington and the lower Idaho Panhandle.  As the low pressure system departed to the east, northwest flow in its wake led to numerous snow showers across the rising terrain of the Blue Mountains.",66495599,WASHINGTON PALOUSE (ZONE), ,2/8/14,0,0:00,2014-02-08  0:00:00 | Washington,Winter Weather, , ,0,0,0,0,Washington,PST-8, ,82179,Z,33,OTX,0,0,Law Enforcement, , , , , , , , , , , , ,"One to three inches of snow fell across the Washington Palouse on the 8th, falling on top of two to four inches from the previous day.  Meanwhile, modified arctic air moving into the region brought gusty northeast winds resulting in blowing and drifting snow.  Large drifts resulted in a road closure on the 8th along a section of Highway 27 which stretches across southern Spokane and northern Whitman Counties.","A strong Pacific jet with ties to subtropical moisture setup across central Oregon allowing an active storm track along the Washington, Oregon border.  The second low pressure system in as many days took aim on southeastern Washington during the overnight and morning hours of the 8th of February.  A band of light to moderate snow on the northeastern periphery brought one to three inches of snow across the Washington Palouse.  A third low pressure system during the evening of the 8th into the morning of the 9th dropped another three to four inches.  Meanwhile, northeast winds drawn into the system continued to bring modified arctic air from Canada into the region.  The combination of temperatures in the teens and northeast winds between 15 and 25 mph resulted in blowing snow and large drifts across the Palouse closing sections of Highway 27 on each the 8th and 9th of February.  Road closures on the 8th were centered between mile posts 59 and the community of Latah.  On the 9th, Highway 27 was closed between mile posts 48 and 63.",67507449,GREATER VANCOUVER AREA (ZONE), ,2/8/14,1130,11:30,2014-02-08  11:00:00 | Washington,Winter Storm, , ,0,0,0,0,Washington,PST-8, ,84051,Z,39,PQR,0,0,Trained Spotter, , , , , , , , , , , , ,Up to 3 inches of additional snow fell on March 8th before the precipitation changed to freezing rain in the afternoon. The freezing rain persisted through midnight. A Battleground Spotter reported 1 inch of snow followed by 0.25 inch of ice. Another spotter reported 0.25 inch of ice accumulation in Camas.,A Weather system brought additional snow and ice to Southwest Washington March 8th. This is the third cold weather event in a series where there was a widespread snow/ice event on March 7th that followed a widespread heavy snow event on the 6th.,68507451,CENTRAL COLUMBIA RIVER GORGE (ZONE), ,2/8/14,1130,11:30,2014-02-08  11:00:00 | Washington,Ice Storm, , ,0,0,0,0,Washington,PST-8, ,84051,Z,46,PQR,0,0,Broadcast Media, , , , , , , , , , , , ,"Although there were not many reports in the Washington side of the Gorge, reports from the Oregon side can be used to verify snow and ice for the Washington side of the Columbia River Gorge. A local media meteorologist reported 0.5 to 0.75 inch of ice in Corbett, and there were numerous crashes along Interstate 84 due to snow and ice near Cascade Locks.",A Weather system brought additional snow and ice to Southwest Washington March 8th. This is the third cold weather event in a series where there was a widespread snow/ice event on March 7th that followed a widespread heavy snow event on the 6th.,69507450,WESTERN COLUMBIA GORGE (ZONE), ,2/8/14,1130,11:30,2014-02-08  11:00:00 | Washington,Ice Storm, , ,0,0,0,0,Washington,PST-8, ,84051,Z,45,PQR,0,0,Broadcast Media, , , , , , , , , , , , ,"Although there were not many reports in the Washington side of the Gorge, reports from the Oregon side can be used to verify snow and ice for the Washington side of the Columbia River Gorge. A local media meteorologist reported 0.5 to 0.75 inch of ice in Corbett, and there were numerous crashes along Interstate 84 due to snow and ice near Cascade Locks.",A Weather system brought additional snow and ice to Southwest Washington March 8th. This is the third cold weather event in a series where there was a widespread snow/ice event on March 7th that followed a widespread heavy snow event on the 6th.,70488257,SIMCOE HIGHLANDS (ZONE), ,2/8/14,1209,12:09,2014-02-08  12:00:00 | Washington,Heavy Snow, , ,0,0,0,0,Washington,PST-8, ,81341,Z,521,PDT,0,0,Trained Spotter, , , , , , , , , , , , ,,"The next wave of precipitation would move in mid day on the 7th and bring widespread snow to the forecast area. While warning amounts fell across all cities of the warning zones the highest snowfall amounts in inches are as followed: (13) southwest of Bickleton, (13) northeast of Goldendale, (13) in Naches, (12.3) southeast of Cliffdell, (10) in Lyle, (10) in Snowden, (9.7) in Yakima, (7.5) in Walla Walla, (7) in Dayton, (6) in Ellensburg, and (6) north of Kennewick..",71488259,EAST SLOPES OF THE WASHINGTON CASCADES (ZONE), ,2/8/14,1209,12:09,2014-02-08  12:00:00 | Washington,Heavy Snow, , ,0,0,0,0,Washington,PST-8, ,81341,Z,520,PDT,0,0,Trained Spotter, , , , , , , , , , , , ,,"The next wave of precipitation would move in mid day on the 7th and bring widespread snow to the forecast area. While warning amounts fell across all cities of the warning zones the highest snowfall amounts in inches are as followed: (13) southwest of Bickleton, (13) northeast of Goldendale, (13) in Naches, (12.3) southeast of Cliffdell, (10) in Lyle, (10) in Snowden, (9.7) in Yakima, (7.5) in Walla Walla, (7) in Dayton, (6) in Ellensburg, and (6) north of Kennewick..",72488258,BLUE MOUNTAIN FOOTHILLS (ZONE), ,2/8/14,1209,12:09,2014-02-08  12:00:00 | Washington,Heavy Snow, , ,0,0,0,0,Washington,PST-8, ,81341,Z,29,PDT,0,0,Trained Spotter, , , , , , , , , , , , ,,"The next wave of precipitation would move in mid day on the 7th and bring widespread snow to the forecast area. While warning amounts fell across all cities of the warning zones the highest snowfall amounts in inches are as followed: (13) southwest of Bickleton, (13) northeast of Goldendale, (13) in Naches, (12.3) southeast of Cliffdell, (10) in Lyle, (10) in Snowden, (9.7) in Yakima, (7.5) in Walla Walla, (7) in Dayton, (6) in Ellensburg, and (6) north of Kennewick..",73516315,LOWER COLUMBIA (ZONE), ,2/8/14,1300,13:00,2014-02-08  13:00:00 | Washington,Winter Storm, , ,0,0,0,0,Washington,PST-8, ,84054,Z,22,PQR,0,0,Trained Spotter, , , , , , , , , , , , ,"A trained spotter in nearby Longview, WA reported 4 inches of snow followed by 0.1 to 0.25 inch of ice accumulation.","A Weather system brought additional snow and ice to Southwest Washington February 8th. This is the third cold weather event after a widespread snow/ice event on the 7th, and a  widespread heavy snow event on the 6th.",74511810,EAST PUGET SOUND LOWLANDS (ZONE), ,2/8/14,1400,14:00,2014-02-08  14:00:00 | Washington,Heavy Snow, , ,0,0,0,0,Washington,PST-8, ,84731,Z,505,SEW,0,0,Trained Spotter, , , , , , , , , , , , ,"A Pacific frontal system and cold air over western Washington resulted in 3 to 7 inches of snow, according to numerous reports from trained spotters.","Heavy snow fell over the lowlands of portions of the Southwest Interior, Tacoma Area, and the southern part of the East Puget Sound Lowlands zones. Snowfall ranged generally from 3 to 7 inches.",75511813,SOUTHWEST INTERIOR (ZONE), ,2/8/14,1400,14:00,2014-02-08  14:00:00 | Washington,Heavy Snow, , ,0,0,0,0,Washington,PST-8, ,84731,Z,504,SEW,0,0,Trained Spotter, , , , , , , , , , , , ,"A Pacific frontal system and cold air over western Washington resulted in 3 to 7 inches of snow, according to numerous reports from trained spotters.","Heavy snow fell over the lowlands of portions of the Southwest Interior, Tacoma Area, and the southern part of the East Puget Sound Lowlands zones. Snowfall ranged generally from 3 to 7 inches.",76511812,TACOMA AREA (ZONE), ,2/8/14,1400,14:00,2014-02-08  14:00:00 | Washington,Heavy Snow, , ,0,0,0,0,Washington,PST-8, ,84731,Z,509,SEW,0,0,Trained Spotter, , , , , , , , , , , , ,"A Pacific frontal system and cold air over western Washington resulted in 3 to 7 inches of snow, according to numerous reports from trained spotters.","Heavy snow fell over the lowlands of portions of the Southwest Interior, Tacoma Area, and the southern part of the East Puget Sound Lowlands zones. Snowfall ranged generally from 3 to 7 inches.",77507452,GREATER VANCOUVER AREA (ZONE), ,2/8/14,1630,16:30,2014-02-08  16:00:00 | Washington,Ice Storm, , ,0,0,0,0,Washington,PST-8, ,84054,Z,39,PQR,0,0,Trained Spotter, , , , , , , , , , , , ,"The City of Portland issued its first Wireless Emergency Alert in history on March 9th at 8 AM warning people to stay indoors due to dangerous ice conditions. While most of the icing has stopped by then, there was still significant ice loading on branches and power lines as well as several of each downed. Power outages continued into the 9th due to the ice, but ice slowly melted as temperatures crept above freezing. Some ice accumulations reported from spotters include a 0.25 inch in Camas, and a 0.25 inch of ice in Battle Ground.","A Weather system brought additional snow and ice to Southwest Washington February 8th. This is the third cold weather event after a widespread snow/ice event on the 7th, and a  widespread heavy snow event on the 6th.",78499242,EAST SLOPES NORTHERN CASCADES (ZONE), ,2/8/14,1800,18:00,2014-02-08  18:00:00 | Washington,Winter Weather, , ,0,0,0,0,Washington,PST-8, ,82179,Z,42,OTX,0,0,Trained Spotter, , , , , , , , , , , , ,"Snowfall amounts across southern Chelan County ranged from five to seven inches.  Further north near Lake Chelan and the Methow Valley, snowfall amounts were between two and three inches.","A strong Pacific jet with ties to subtropical moisture setup across central Oregon allowing an active storm track along the Washington, Oregon border.  The second low pressure system in as many days took aim on southeastern Washington during the overnight and morning hours of the 8th of February.  A band of light to moderate snow on the northeastern periphery brought one to three inches of snow across the Washington Palouse.  A third low pressure system during the evening of the 8th into the morning of the 9th dropped another three to four inches.  Meanwhile, northeast winds drawn into the system continued to bring modified arctic air from Canada into the region.  The combination of temperatures in the teens and northeast winds between 15 and 25 mph resulted in blowing snow and large drifts across the Palouse closing sections of Highway 27 on each the 8th and 9th of February.  Road closures on the 8th were centered between mile posts 59 and the community of Latah.  On the 9th, Highway 27 was closed between mile posts 48 and 63.",79488261,LOWER COLUMBIA BASIN (ZONE), ,2/8/14,1817,18:17,2014-02-08  18:00:00 | Washington,Heavy Snow, , ,0,0,0,0,Washington,PST-8, ,81341,Z,28,PDT,0,0,Trained Spotter, , , , , , , , , , , , ,,"The next wave of precipitation would move in mid day on the 7th and bring widespread snow to the forecast area. While warning amounts fell across all cities of the warning zones the highest snowfall amounts in inches are as followed: (13) southwest of Bickleton, (13) northeast of Goldendale, (13) in Naches, (12.3) southeast of Cliffdell, (10) in Lyle, (10) in Snowden, (9.7) in Yakima, (7.5) in Walla Walla, (7) in Dayton, (6) in Ellensburg, and (6) north of Kennewick..",80488260,YAKIMA VALLEY (ZONE), ,2/8/14,1817,18:17,2014-02-08  18:00:00 | Washington,Heavy Snow, , ,0,0,0,0,Washington,PST-8, ,81341,Z,27,PDT,0,0,Trained Spotter, , , , , , , , , , , , ,,"The next wave of precipitation would move in mid day on the 7th and bring widespread snow to the forecast area. While warning amounts fell across all cities of the warning zones the highest snowfall amounts in inches are as followed: (13) southwest of Bickleton, (13) northeast of Goldendale, (13) in Naches, (12.3) southeast of Cliffdell, (10) in Lyle, (10) in Snowden, (9.7) in Yakima, (7.5) in Walla Walla, (7) in Dayton, (6) in Ellensburg, and (6) north of Kennewick..",81495681,WATERVILLE PLATEAU (ZONE), ,2/8/14,1900,19:00,2014-02-08  19:00:00 | Washington,Winter Weather, , ,0,0,0,0,Washington,PST-8, ,82179,Z,44,OTX,0,0,Trained Spotter, , , , , , , , , , , , ,Snowfall amounts ranged between three and four inches.,"A strong Pacific jet with ties to subtropical moisture setup across central Oregon allowing an active storm track along the Washington, Oregon border.  The second low pressure system in as many days took aim on southeastern Washington during the overnight and morning hours of the 8th of February.  A band of light to moderate snow on the northeastern periphery brought one to three inches of snow across the Washington Palouse.  A third low pressure system during the evening of the 8th into the morning of the 9th dropped another three to four inches.  Meanwhile, northeast winds drawn into the system continued to bring modified arctic air from Canada into the region.  The combination of temperatures in the teens and northeast winds between 15 and 25 mph resulted in blowing snow and large drifts across the Palouse closing sections of Highway 27 on each the 8th and 9th of February.  Road closures on the 8th were centered between mile posts 59 and the community of Latah.  On the 9th, Highway 27 was closed between mile posts 48 and 63.",82495669,LOWER GARFIELD & ASOTIN (ZONE), ,2/8/14,1900,19:00,2014-02-08  19:00:00 | Washington,Winter Weather, , ,0,0,0,0,Washington,PST-8, ,82179,Z,32,OTX,0,0,CoCoRaHS, , , , , , , , , , , , ,Snowfall amounts ranged between two and four inches.,"A strong Pacific jet with ties to subtropical moisture setup across central Oregon allowing an active storm track along the Washington, Oregon border.  The second low pressure system in as many days took aim on southeastern Washington during the overnight and morning hours of the 8th of February.  A band of light to moderate snow on the northeastern periphery brought one to three inches of snow across the Washington Palouse.  A third low pressure system during the evening of the 8th into the morning of the 9th dropped another three to four inches.  Meanwhile, northeast winds drawn into the system continued to bring modified arctic air from Canada into the region.  The combination of temperatures in the teens and northeast winds between 15 and 25 mph resulted in blowing snow and large drifts across the Palouse closing sections of Highway 27 on each the 8th and 9th of February.  Road closures on the 8th were centered between mile posts 59 and the community of Latah.  On the 9th, Highway 27 was closed between mile posts 48 and 63.",83495612,WASHINGTON PALOUSE (ZONE), ,2/8/14,1900,19:00,2014-02-08  19:00:00 | Washington,Heavy Snow, , ,0,0,0,0,Washington,PST-8, ,82179,Z,33,OTX,0,0,COOP Observer, , , , , , , , , , , , ,Four to six inches of snow fell during the evening of the 8th into the morning hours of the ninth.  Blowing and drifting snow led to closures of highway 27.,"A strong Pacific jet with ties to subtropical moisture setup across central Oregon allowing an active storm track along the Washington, Oregon border.  The second low pressure system in as many days took aim on southeastern Washington during the overnight and morning hours of the 8th of February.  A band of light to moderate snow on the northeastern periphery brought one to three inches of snow across the Washington Palouse.  A third low pressure system during the evening of the 8th into the morning of the 9th dropped another three to four inches.  Meanwhile, northeast winds drawn into the system continued to bring modified arctic air from Canada into the region.  The combination of temperatures in the teens and northeast winds between 15 and 25 mph resulted in blowing snow and large drifts across the Palouse closing sections of Highway 27 on each the 8th and 9th of February.  Road closures on the 8th were centered between mile posts 59 and the community of Latah.  On the 9th, Highway 27 was closed between mile posts 48 and 63.",84495609,NORTHEAST BLUE MOUNTAINS (ZONE), ,2/8/14,1900,19:00,2014-02-08  19:00:00 | Washington,Winter Weather, , ,0,0,0,0,Washington,PST-8, ,82179,Z,31,OTX,0,0,COOP Observer, , , , , , , , , , , , ,Snowfall amounts ranged between three and four inches.,"A strong Pacific jet with ties to subtropical moisture setup across central Oregon allowing an active storm track along the Washington, Oregon border.  The second low pressure system in as many days took aim on southeastern Washington during the overnight and morning hours of the 8th of February.  A band of light to moderate snow on the northeastern periphery brought one to three inches of snow across the Washington Palouse.  A third low pressure system during the evening of the 8th into the morning of the 9th dropped another three to four inches.  Meanwhile, northeast winds drawn into the system continued to bring modified arctic air from Canada into the region.  The combination of temperatures in the teens and northeast winds between 15 and 25 mph resulted in blowing snow and large drifts across the Palouse closing sections of Highway 27 on each the 8th and 9th of February.  Road closures on the 8th were centered between mile posts 59 and the community of Latah.  On the 9th, Highway 27 was closed between mile posts 48 and 63.",85488262,KITTITAS VALLEY (ZONE), ,2/8/14,2000,20:00,2014-02-08  20:00:00 | Washington,Heavy Snow, , ,0,0,0,0,Washington,PST-8, ,81341,Z,26,PDT,0,0,Trained Spotter, , , , , , , , , , , , ,,"The next wave of precipitation would move in mid day on the 7th and bring widespread snow to the forecast area. While warning amounts fell across all cities of the warning zones the highest snowfall amounts in inches are as followed: (13) southwest of Bickleton, (13) northeast of Goldendale, (13) in Naches, (12.3) southeast of Cliffdell, (10) in Lyle, (10) in Snowden, (9.7) in Yakima, (7.5) in Walla Walla, (7) in Dayton, (6) in Ellensburg, and (6) north of Kennewick..",86495677,UPPER COLUMBIA BASIN (ZONE), ,2/8/14,2000,20:00,2014-02-08  20:00:00 | Washington,Winter Weather, , ,0,0,0,0,Washington,PST-8, ,82179,Z,35,OTX,0,0,COOP Observer, , , , , , , , , , , , ,Snowfall amounts ranged from two to four inches.,"A strong Pacific jet with ties to subtropical moisture setup across central Oregon allowing an active storm track along the Washington, Oregon border.  The second low pressure system in as many days took aim on southeastern Washington during the overnight and morning hours of the 8th of February.  A band of light to moderate snow on the northeastern periphery brought one to three inches of snow across the Washington Palouse.  A third low pressure system during the evening of the 8th into the morning of the 9th dropped another three to four inches.  Meanwhile, northeast winds drawn into the system continued to bring modified arctic air from Canada into the region.  The combination of temperatures in the teens and northeast winds between 15 and 25 mph resulted in blowing snow and large drifts across the Palouse closing sections of Highway 27 on each the 8th and 9th of February.  Road closures on the 8th were centered between mile posts 59 and the community of Latah.  On the 9th, Highway 27 was closed between mile posts 48 and 63.",87495672,MOSES LAKE AREA (ZONE), ,2/8/14,2000,20:00,2014-02-08  20:00:00 | Washington,Winter Weather, , ,0,0,0,0,Washington,PST-8, ,82179,Z,34,OTX,0,0,COOP Observer, , , , , , , , , , , , ,Snowfall amounts generally ranged between one and three inches.,"A strong Pacific jet with ties to subtropical moisture setup across central Oregon allowing an active storm track along the Washington, Oregon border.  The second low pressure system in as many days took aim on southeastern Washington during the overnight and morning hours of the 8th of February.  A band of light to moderate snow on the northeastern periphery brought one to three inches of snow across the Washington Palouse.  A third low pressure system during the evening of the 8th into the morning of the 9th dropped another three to four inches.  Meanwhile, northeast winds drawn into the system continued to bring modified arctic air from Canada into the region.  The combination of temperatures in the teens and northeast winds between 15 and 25 mph resulted in blowing snow and large drifts across the Palouse closing sections of Highway 27 on each the 8th and 9th of February.  Road closures on the 8th were centered between mile posts 59 and the community of Latah.  On the 9th, Highway 27 was closed between mile posts 48 and 63.",88495867,SPOKANE AREA (ZONE), ,2/10/14,0,0:00,2014-02-10  0:00:00 | Washington,Winter Weather, , ,0,0,0,0,Washington,PST-8, ,82223,Z,36,OTX,0,0,NWS Employee, , , , , , , , , , , , ,The heaviest snow started around 0800 PST with storm total amounts in the three to four inch range across the Spokane Area.,"A moist warm front overrunning an established pool of cold air over Eastern Washington resulted in several hours of light to moderate snowfall on the 10th of February.  The heaviest snow accumulations were found in the East Slopes of the Washington Cascades which received between seven to fourteen inches.  The remainder of the region saw snowfall amounts generally under two inches.  The exception was along a narrow corridor across Northeastern Washington, generally south of Pend Oreille River and north of the Palouse, extending east to west from Lincoln County to the Idaho Montana border.  A nearly stationary boundary coupled with the rising terrain resulted in several hours of moderate snow which accumulated between three and four inches over a span of just a few hours.",89496221,EAST SLOPES NORTHERN CASCADES (ZONE), ,2/10/14,500,5:00,2014-02-10  5:00:00 | Washington,Heavy Snow, , ,0,0,0,0,Washington,PST-8, ,82223,Z,42,OTX,0,0,COOP Observer, , , , , , , , , , , , ,"Light to moderate snow fell across the East Slopes during the morning hours of the 10th ahead of a strong cold front.  Behind the cold front, an unstable air mass and strong westerly flow resulted in numerous convective snow showers along and east of the Cascade Crest.  The morning snow brought between two and four inches then an additional four to eight inches fell at some locations with the post frontal showers.  Locations near the Cascade Crest including Mazama, Holden Village, and Stevens Pass received between nine and thirteen inches of snow from the event.  Further east away from the crest, snowfall amounts were generally in the six to nine inch range.","A moist warm front overrunning an established pool of cold air over Eastern Washington resulted in several hours of light to moderate snowfall on the 10th of February.  The heaviest snow accumulations were found in the East Slopes of the Washington Cascades which received between seven to fourteen inches.  The remainder of the region saw snowfall amounts generally under two inches.  The exception was along a narrow corridor across Northeastern Washington, generally south of Pend Oreille River and north of the Palouse, extending east to west from Lincoln County to the Idaho Montana border.  A nearly stationary boundary coupled with the rising terrain resulted in several hours of moderate snow which accumulated between three and four inches over a span of just a few hours.",90495866,OKANOGAN HIGHLANDS (ZONE), ,2/10/14,700,7:00,2014-02-10  7:00:00 | Washington,Winter Weather, , ,0,0,0,0,Washington,PST-8, ,82223,Z,38,OTX,0,0,Trained Spotter, , , , , , , , , , , , ,Snowfall amounts generally ranged from one to three inches.  An isolated report of four inches was received from the town of Wauconda.,"A moist warm front overrunning an established pool of cold air over Eastern Washington resulted in several hours of light to moderate snowfall on the 10th of February.  The heaviest snow accumulations were found in the East Slopes of the Washington Cascades which received between seven to fourteen inches.  The remainder of the region saw snowfall amounts generally under two inches.  The exception was along a narrow corridor across Northeastern Washington, generally south of Pend Oreille River and north of the Palouse, extending east to west from Lincoln County to the Idaho Montana border.  A nearly stationary boundary coupled with the rising terrain resulted in several hours of moderate snow which accumulated between three and four inches over a span of just a few hours.",91495870,WATERVILLE PLATEAU (ZONE), ,2/10/14,700,7:00,2014-02-10  7:00:00 | Washington,Winter Weather, , ,0,0,0,0,Washington,PST-8, ,82223,Z,44,OTX,0,0,Trained Spotter, , , , , , , , , , , , ,Snowfall amounts ranged between two and four inches.,"A moist warm front overrunning an established pool of cold air over Eastern Washington resulted in several hours of light to moderate snowfall on the 10th of February.  The heaviest snow accumulations were found in the East Slopes of the Washington Cascades which received between seven to fourteen inches.  The remainder of the region saw snowfall amounts generally under two inches.  The exception was along a narrow corridor across Northeastern Washington, generally south of Pend Oreille River and north of the Palouse, extending east to west from Lincoln County to the Idaho Montana border.  A nearly stationary boundary coupled with the rising terrain resulted in several hours of moderate snow which accumulated between three and four inches over a span of just a few hours.",92495869,OKANOGAN VALLEY (ZONE), ,2/10/14,700,7:00,2014-02-10  7:00:00 | Washington,Winter Weather, , ,0,0,0,0,Washington,PST-8, ,82223,Z,43,OTX,0,0,Trained Spotter, , , , , , , , , , , , ,Snowfall amounts range between one and three inches.,"A moist warm front overrunning an established pool of cold air over Eastern Washington resulted in several hours of light to moderate snowfall on the 10th of February.  The heaviest snow accumulations were found in the East Slopes of the Washington Cascades which received between seven to fourteen inches.  The remainder of the region saw snowfall amounts generally under two inches.  The exception was along a narrow corridor across Northeastern Washington, generally south of Pend Oreille River and north of the Palouse, extending east to west from Lincoln County to the Idaho Montana border.  A nearly stationary boundary coupled with the rising terrain resulted in several hours of moderate snow which accumulated between three and four inches over a span of just a few hours.",93495868,UPPER COLUMBIA BASIN (ZONE), ,2/10/14,800,8:00,2014-02-10  8:00:00 | Washington,Winter Weather, , ,0,0,0,0,Washington,PST-8, ,82223,Z,35,OTX,0,0,Trained Spotter, , , , , , , , , , , , ,Snowfall amounts of two to four inches were observed across Lincoln County leading to slick travel along the Highway 2 corridor.  Snowfall amounts were generally near an inch in Adams County.,"A moist warm front overrunning an established pool of cold air over Eastern Washington resulted in several hours of light to moderate snowfall on the 10th of February.  The heaviest snow accumulations were found in the East Slopes of the Washington Cascades which received between seven to fourteen inches.  The remainder of the region saw snowfall amounts generally under two inches.  The exception was along a narrow corridor across Northeastern Washington, generally south of Pend Oreille River and north of the Palouse, extending east to west from Lincoln County to the Idaho Montana border.  A nearly stationary boundary coupled with the rising terrain resulted in several hours of moderate snow which accumulated between three and four inches over a span of just a few hours.",94495864,NORTHEAST MOUNTAINS (ZONE), ,2/10/14,900,9:00,2014-02-10  9:00:00 | Washington,Winter Weather, , ,0,0,0,0,Washington,PST-8, ,82223,Z,37,OTX,0,0,CoCoRaHS, , , , , , , , , , , , ,Snowfall amounts greatly ranged across the zone.  The northern half of the zone picked up between one and two inches while three to locally four fell across the southern half.,"A moist warm front overrunning an established pool of cold air over Eastern Washington resulted in several hours of light to moderate snowfall on the 10th of February.  The heaviest snow accumulations were found in the East Slopes of the Washington Cascades which received between seven to fourteen inches.  The remainder of the region saw snowfall amounts generally under two inches.  The exception was along a narrow corridor across Northeastern Washington, generally south of Pend Oreille River and north of the Palouse, extending east to west from Lincoln County to the Idaho Montana border.  A nearly stationary boundary coupled with the rising terrain resulted in several hours of moderate snow which accumulated between three and four inches over a span of just a few hours.",95545750,WEST SLOPES CENTRAL CASCADES AND PASSES (ZONE), ,2/11/14,1000,10:00,2014-02-11  10:00:00 | Washington,Avalanche, , ,0,2,0,0,Washington,PST-8, ,84732,Z,519,SEW,0,0,Park/Forest Service, , , , , , , , , , , , ,"One skier, one snowboarder triggered and caught in slide, both partially buried. Skier was able to self-rescue himself and then other rider. Both sustained injuries.","A Pacific frontal system brought heavy snow to Mt Baker in the North Cascades. One skier, one snowboarder triggered and caught in slide, both partially buried. Skier was able to self-rescue himself and then other rider. Both sustained injuries.",96511814,WEST SLOPES NORTHERN CASCADES AND PASSES (ZONE), ,2/11/14,1400,14:00,2014-02-11  14:00:00 | Washington,Heavy Snow, , ,0,0,0,0,Washington,PST-8, ,84732,Z,518,SEW,0,0,Park/Forest Service, , , , , , , , , , , , ,USFS NWAC station at Mt Baker measured 13 inches snow in 12 hours ending 2 am Feb 12.,"A Pacific frontal system brought heavy snow to Mt Baker in the North Cascades. One skier, one snowboarder triggered and caught in slide, both partially buried. Skier was able to self-rescue himself and then other rider. Both sustained injuries.",97496199,EAST SLOPES NORTHERN CASCADES (ZONE), ,2/11/14,1800,18:00,2014-02-11  18:00:00 | Washington,Winter Weather, , ,0,0,0,0,Washington,PST-8, ,82225,Z,42,OTX,0,0,COOP Observer, , , , , , , , , , , , ,"Light to moderate snow fell across the East Slopes during the evening and overnight hours of the 11th resulting in four to six inches for most locations.  Post frontal convective snow showers slopping across the Cascade Crest brought an additional two to four inches of snow to locations near the Cascade Crest including Mazama, Holden Village, and Stevens Pass.  These locations received between seven and eleven inches of snow throughout the event leading to hazardous travel, especially across the mountain passes.","An atmospheric river overrunning a dome of cold air established over Eastern Washington resulted in an extended period of moderate to heavy precipitation across the region.  Precipitation mainly fell in the form of snow for the East Slopes of the Cascades and northern mountains resulting in snow accumulations of seven to fourteen inches.  In the northern valleys, snow gradually transitioned to rain after two to four inches of snow fell.  A few locations experienced a period of sleet and freezing rain as this transition occurred.",98496189,NORTHEAST MOUNTAINS (ZONE), ,2/11/14,2100,21:00,2014-02-11  21:00:00 | Washington,Heavy Snow, , ,0,0,0,0,Washington,PST-8, ,82225,Z,37,OTX,0,0,Trained Spotter, , , , , , , , , , , , ,"Two to four inches of snow fell in the valleys before snow levels climbed near 3000 feet.  In the mountains, seven to fourteen inches of snow was observed.","An atmospheric river overrunning a dome of cold air established over Eastern Washington resulted in an extended period of moderate to heavy precipitation across the region.  Precipitation mainly fell in the form of snow for the East Slopes of the Cascades and northern mountains resulting in snow accumulations of seven to fourteen inches.  In the northern valleys, snow gradually transitioned to rain after two to four inches of snow fell.  A few locations experienced a period of sleet and freezing rain as this transition occurred.",99498906,SOUTH COAST (ZONE), ,2/11/14,2200,22:00,2014-02-11  22:00:00 | Washington,High Wind,57, ,0,0,0,0,Washington,PST-8,MG,82779,Z,21,PQR,0,0,Official NWS Observations, , , , , , , , , , , , ,"Three weather stations along the South Washington Coast measured strong winds as a Pacific storm system moved onshore. Cape Disappointment (82SW1 measured a peak gust of 66 mph, Toke Point NOS (TOKW1) measured a gust of 59 mph, and Megler Bridge (ODT76) measured a peak gust of 82 mph.",A low pressure system resulted in strong winds for the Southwest Washington coast and coast range.,100489337,ADMIRALTY INLET AREA (ZONE), ,2/11/14,2247,22:47,2014-02-11  22:00:00 | Washington,High Wind,41, ,0,0,0,0,Washington,PST-8,MS,81525,Z,510,SEW,0,0,ASOS, , , , , , , , , , , , ,Whidbey Island NUW ASOS recorded 37 gust 58 mph.  Port Townsend had sustained 47 mph wind.,A strong storm brought marginal high wind to parts of the north interior.,101489333,WESTERN WHATCOM COUNTY (ZONE), ,2/12/14,0,0:00,2014-02-12  0:00:00 | Washington,High Wind,39, ,0,0,0,0,Washington,PST-8,MS,81525,Z,503,SEW,0,0,COOP Observer, , , , , , , , , , , , ,"A CWOP in Bellingham recorded wind as high as sustained 45 mph, gusting to 59 mph, for a few hours off and on early in the morning.  Sandy Point Shores recorded sustained 36 mph gusting to 60 mph winds around the same time.",A strong storm brought marginal high wind to parts of the north interior.,102498908,SOUTHWEST INTERIOR (ZONE), ,2/12/14,0,0:00,2014-02-12  0:00:00 | Washington,High Wind,56, ,0,0,0,0,Washington,PST-8,MG,82779,Z,20,PQR,0,0,Official NWS Observations, , , , , , , , , , , , ,"Two weather stations reported strong winds in the Southwest Washington Coast Range. The Abernathy RAWS (ABNW1) reported sustained winds of 44 mph with a peak gust of 65 mph, and Naselle Ridge (BPNAS) measures a maximum wind of 92 mph.",A low pressure system resulted in strong winds for the Southwest Washington coast and coast range.,103499250,WHITMAN CO.,LAMONT,2/12/14,1200,12:00,2014-02-12  12:00:00 | Washington,Flood, , ,0,0,600000,0,Washington,PST-8, ,82814,C,75,OTX,0,0,Law Enforcement,Heavy Rain / Snow Melt, , ,6,NW,14,WSW,REVERE,47.2626,-117.9987,46.9731,-118.1854,"Numerous areas of northern and central Whitman County experienced flooding between the 12th and 14th.  State route 23 was closed between Sprague and Saint John between mileposts 15 and 43 due to water over the roadway in several locations.    Colfax, WA experienced heavy flooding closing Mill Street from Canyon to Spring which also included mileposts 0 to 1 of SR 272.  Flood waters up to a foot were observed in portions of downtown Colfax.  Water undercut part of the roadway on SR27 five miles south of Oakesdale washing out part of the northbound lane.  Several homes in the community of Ewan were inundated with up to one foot of water.","Numerous areas across the Idaho Panhandle dealt with flooding during the second week of February. While minor flooding is a common occurrence during the late winter months when warmer temperatures, wind, and rain fall on valley snowpack, there was one ingredient of this event that made it unique and rather intense for many locations. This was the intrusion of two Arctic air masses; one in December and one in February. These bitterly cold air masses arrived in the absence of valley snow pack and froze the ground hard and deep. Shortly after the second Arctic air mass, snow began falling across the region with anywhere between six and twelve inches of valley snowfall. Then came an atmospheric river. This drove temperatures and dewpoints above freezing, led to windy conditions, and brought moderate to heavy rainfall. Nearly all the valley snowpack melted in a span of 24 hours.  Due to the rock hard ground, rain and snow melt could not percolate into the frozen ground equating to nearly 100 percent runoff.  This led to big problems in hilly terrain, low spots, and areas susceptible to poor drainage.  Some school districts were forced to delay school because buses were unable to navigate muddy or flooded back roads.",104499244,LINCOLN CO.,CRESCENT,2/12/14,1200,12:00,2014-02-12  12:00:00 | Washington,Flood, , ,0,0,600000,0,Washington,PST-8, ,82814,C,43,OTX,0,0,Law Enforcement,Heavy Rain / Snow Melt, , ,2,NE,15,NNW,ALMIRA,47.7967,-117.7954,47.9093,-119.0698,"Numerous areas across Lincoln County dealt with flooding between the 12th and 14th.  Some sections of highways that were flooded include SR 23 between mileposts 57 and 60 south of Harrington, SR 231 between mileposts 36 and 42 near Reardon, SR 231 between mileposts 18 and 19 near Edwall, SR 25 between Davenport and Lake Roosevelt, and SR 21 between mileposts 57 and 60 near Harrington.  A creek that runs through the middle of the Edwall flooded the Post Office and adjacent businesses with one to two feet of water.  Edwall-Reardon school district was forced to delay school openings because buses were struggling to navigate muddy dirt roads.  A tech company located on SR 231 reported 30 inches of water flooded its manufacturing facility.  Fortunately, the staff was able to get all valuable equipment off the floor before the flood waters entered.","Numerous areas across the Idaho Panhandle dealt with flooding during the second week of February. While minor flooding is a common occurrence during the late winter months when warmer temperatures, wind, and rain fall on valley snowpack, there was one ingredient of this event that made it unique and rather intense for many locations. This was the intrusion of two Arctic air masses; one in December and one in February. These bitterly cold air masses arrived in the absence of valley snow pack and froze the ground hard and deep. Shortly after the second Arctic air mass, snow began falling across the region with anywhere between six and twelve inches of valley snowfall. Then came an atmospheric river. This drove temperatures and dewpoints above freezing, led to windy conditions, and brought moderate to heavy rainfall. Nearly all the valley snowpack melted in a span of 24 hours.  Due to the rock hard ground, rain and snow melt could not percolate into the frozen ground equating to nearly 100 percent runoff.  This led to big problems in hilly terrain, low spots, and areas susceptible to poor drainage.  Some school districts were forced to delay school because buses were unable to navigate muddy or flooded back roads.",105499257,ADAMS CO.,LAUER,2/12/14,1200,12:00,2014-02-12  12:00:00 | Washington,Flood, , ,0,0,5000,0,Washington,PST-8, ,82814,C,1,OTX,0,0,Law Enforcement,Heavy Rain / Snow Melt, , ,3,SW,13,N,PALM LAKE,47.2952,-118.7787,47.4173,-118.0371,Areas of flooding were observed across portions of northern and eastern Adams County.  State route 21 nine miles south of Odessa was flooded for a period of time.,"Numerous areas across the Idaho Panhandle dealt with flooding during the second week of February. While minor flooding is a common occurrence during the late winter months when warmer temperatures, wind, and rain fall on valley snowpack, there was one ingredient of this event that made it unique and rather intense for many locations. This was the intrusion of two Arctic air masses; one in December and one in February. These bitterly cold air masses arrived in the absence of valley snow pack and froze the ground hard and deep. Shortly after the second Arctic air mass, snow began falling across the region with anywhere between six and twelve inches of valley snowfall. Then came an atmospheric river. This drove temperatures and dewpoints above freezing, led to windy conditions, and brought moderate to heavy rainfall. Nearly all the valley snowpack melted in a span of 24 hours.  Due to the rock hard ground, rain and snow melt could not percolate into the frozen ground equating to nearly 100 percent runoff.  This led to big problems in hilly terrain, low spots, and areas susceptible to poor drainage.  Some school districts were forced to delay school because buses were unable to navigate muddy or flooded back roads.",106499243,SPOKANE CO.,COEY,2/12/14,1200,12:00,2014-02-12  12:00:00 | Washington,Flood, , ,0,0,2000000,0,Washington,PST-8, ,82814,C,63,OTX,0,0,Law Enforcement,Heavy Rain / Snow Melt, , ,2,NE,11,NE,PEONE,47.5138,-117.0703,47.8949,-117.0483,"Numerous areas across Spokane County experienced flooding on the 12th of February.  Due to frozen grounds, the flood problems persisted through the 14th in some cases.  A small ice jam on Coulee Heights Creek caused the creek to become diverted and flow into a private residence.  Water was approximately five feet deep in the garage and surrounding home.  A NWS employee observed up to two inches of water with some mud and small  debris flowing down Rambo Road just north of the Forecast Office.  Water was over a foot deep along the shoulders.  The swift water washed out portions of the shoulder and foundation to the edges of the pavement.  A few blocks away from the Forecast Office, water flooded the West Prairie Village Mobile home park located on the corner of Craig and Haid Lane.  It was estimated that one to two feet of water filled sections of the park.  In southern sections of the county, many secondary roads were flooded in low crossings.  State route 27 just north of Latah near milepost 58 was impassible for a period of time due to water over the road.  Water was also over the roadway along SR 2 two miles west of Airway Heights.  Damage extended into the Spokane Valley with damage or flooding observed near the intersection of Sanson and MacDonald, Crown Street at Forker Draw, Ridgemont Estates on Shamrock Street, and Thorpe Road at Chester Creek.","Numerous areas across the Idaho Panhandle dealt with flooding during the second week of February. While minor flooding is a common occurrence during the late winter months when warmer temperatures, wind, and rain fall on valley snowpack, there was one ingredient of this event that made it unique and rather intense for many locations. This was the intrusion of two Arctic air masses; one in December and one in February. These bitterly cold air masses arrived in the absence of valley snow pack and froze the ground hard and deep. Shortly after the second Arctic air mass, snow began falling across the region with anywhere between six and twelve inches of valley snowfall. Then came an atmospheric river. This drove temperatures and dewpoints above freezing, led to windy conditions, and brought moderate to heavy rainfall. Nearly all the valley snowpack melted in a span of 24 hours.  Due to the rock hard ground, rain and snow melt could not percolate into the frozen ground equating to nearly 100 percent runoff.  This led to big problems in hilly terrain, low spots, and areas susceptible to poor drainage.  Some school districts were forced to delay school because buses were unable to navigate muddy or flooded back roads.",107499262,STEVENS CO.,LOON LAKE,2/12/14,1300,13:00,2014-02-12  13:00:00 | Washington,Flood, , ,0,0,0,0,Washington,PST-8, ,82814,C,65,OTX,0,0,Trained Spotter,Heavy Rain / Snow Melt, , ,8,NE,10,SE,TUMTUM,48.1414,-117.4892,47.8078,-117.5153,A trained spotter located three miles northeast of Loon Lake reported two to three inches of standing water on property and around the area.  There were no known road closures from flooding.,"Numerous areas across the Idaho Panhandle dealt with flooding during the second week of February. While minor flooding is a common occurrence during the late winter months when warmer temperatures, wind, and rain fall on valley snowpack, there was one ingredient of this event that made it unique and rather intense for many locations. This was the intrusion of two Arctic air masses; one in December and one in February. These bitterly cold air masses arrived in the absence of valley snow pack and froze the ground hard and deep. Shortly after the second Arctic air mass, snow began falling across the region with anywhere between six and twelve inches of valley snowfall. Then came an atmospheric river. This drove temperatures and dewpoints above freezing, led to windy conditions, and brought moderate to heavy rainfall. Nearly all the valley snowpack melted in a span of 24 hours.  Due to the rock hard ground, rain and snow melt could not percolate into the frozen ground equating to nearly 100 percent runoff.  This led to big problems in hilly terrain, low spots, and areas susceptible to poor drainage.  Some school districts were forced to delay school because buses were unable to navigate muddy or flooded back roads.",108499234,MOSES LAKE AREA (ZONE), ,2/13/14,400,4:00,2014-02-13  4:00:00 | Washington,Winter Weather, , ,0,0,0,0,Washington,PST-8, ,82812,Z,34,OTX,0,0,State Official, , , , , , , , , , , , ,Icy road conditions in the Ephrata area led to school closures on the 13th of February.,"Conditions on the 12th of February were generally mild for February standards with periods of light rain and temperatures in the forties.  By the evening and overnight hours, skies cleared and temperatures cooled into the thirties.  In addition, Arctic air mass intrusions during the last two months had led to a deep hard freeze of the subsurface. These conditions were thought to be responsible for patches of ice along sections of US 195, US 2, and Spokane Area during the morning commute of February 13th.  Numerous accidents, some containing injuries were reported across the area.  Between 1100 PST and 1400 PST, strong winds sustained between 20 and 30 miles per hour along with gusts estimated around 45 miles per hour impacted the Spokane Area snapping a thirty five foot section of a pine tree.  The tree limb fell into a Bengal tiger enclosure at Cat Tales Zoo in Mead, WA.",109499058,SPOKANE AREA (ZONE), ,2/13/14,500,5:00,2014-02-13  5:00:00 | Washington,Winter Weather, , ,0,0,0,0,Washington,PST-8, ,82812,Z,36,OTX,0,0,Department of Highways, , , , , , , , , , , , ,Icy roadways across the Spokane Area led to multiple accident during the morning commute.  The largest accidents occurred along Highway 2 near Spotted Road and State  Route 195 near Mullen Hill Road.,"Conditions on the 12th of February were generally mild for February standards with periods of light rain and temperatures in the forties.  By the evening and overnight hours, skies cleared and temperatures cooled into the thirties.  In addition, Arctic air mass intrusions during the last two months had led to a deep hard freeze of the subsurface. These conditions were thought to be responsible for patches of ice along sections of US 195, US 2, and Spokane Area during the morning commute of February 13th.  Numerous accidents, some containing injuries were reported across the area.  Between 1100 PST and 1400 PST, strong winds sustained between 20 and 30 miles per hour along with gusts estimated around 4