EVENT_ID,CZ_NAME_STR,BEGIN_LOCATION,BEGIN_DATE,BEGIN_TIME,Time,time_location,EVENT_TYPE,MAGNITUDE,TOR_F_SCALE,DEATHS_DIRECT,INJURIES_DIRECT,DAMAGE_PROPERTY_NUM,DAMAGE_CROPS_NUM,STATE,CZ_TIMEZONE,MAGNITUDE_TYPE,EPISODE_ID,CZ_TYPE,CZ_FIPS,WFO,INJURIES_INDIRECT,DEATHS_INDIRECT,SOURCE,FLOOD_CAUSE,TOR_LENGTH,TOR_WIDTH,BEGIN_RANGE,BEGIN_AZIMUTH,END_RANGE,END_AZIMUTH,END_LOCATION,BEGIN_LAT,BEGIN_LON,END_LAT,END_LON,EVENT_NARRATIVE,EPISODE_NARRATIVE,ABSOLUTE_ROWNUMBER489525,RUBY MOUNTAINS/E HUMBOLDT RANGE (ZONE), ,1/29/14,2330,23:30,2014-01-29  23:00:00 | Nevada,Heavy Snow, , ,0,0,0,0,Nevada,PST-8, ,81573,Z,34,LKN,0,0,SNOTEL, , , , , , , , , , , , ,Many SNOTEL sites reported between 8 and 13 inches of new snow.,"A winter storm brought 6 to 9 inches of snow to the valleys of White Pine, southern Lander and southern Eureka counties. In the mountains, 8 to 15 inches of snow fell. The Ruby Mountains and East Humboldt also received 8 to 13 inches of snow.",1498935,GREATER LAKE TAHOE AREA (ZONE), ,1/30/14,0,0:00,2014-01-30  0:00:00 | Nevada,Heavy Snow, , ,0,0,0,0,Nevada,PST-8, ,82785,Z,2,REV,0,0,Public, , , , , , , , , , , , ,"Between 12 and 18 inches of snow fell in the Carson Range from near Incline Village (Diamond Peak ski area) south to Marlette Lake on the 20th. At Lake Tahoe level, the Glenbrook CO-OP site reported 9 inches of snowfall.","Low pressure moved from the eastern Pacific into the West on the 30th, bringing heavy snow and rain to the Carson Range/Sierra and western Nevada.",2489518,S LANDER & S EUREKA (ZONE), ,1/30/14,30,0:30,2014-01-30  0:00:00 | Nevada,Heavy Snow, , ,0,0,0,0,Nevada,PST-8, ,81573,Z,37,LKN,0,0,COOP Observer, , , , , , , , , , , , ,The town of Eureka picked up 7 inches of snow and the Big Creek Summit SNOTEL reported 9 inches of snow.,"A winter storm brought 6 to 9 inches of snow to the valleys of White Pine, southern Lander and southern Eureka counties. In the mountains, 8 to 15 inches of snow fell. The Ruby Mountains and East Humboldt also received 8 to 13 inches of snow.",3489509,WHITE PINE (ZONE), ,1/30/14,200,2:00,2014-01-30  2:00:00 | Nevada,Heavy Snow, , ,0,0,0,0,Nevada,PST-8, ,81573,Z,35,LKN,0,0,COOP Observer, , , , , , , , , , , , ,"Valley locations received 6 to 9 inches of snow while the mountains picked up 8 to 15 inches of snow. Some amounts included: 9 inches in the Ely area, 7 inches at McGill and 6 inches at Lund. The Great Basin National Park Visitors Center reported 15 inches of new snow.","A winter storm brought 6 to 9 inches of snow to the valleys of White Pine, southern Lander and southern Eureka counties. In the mountains, 8 to 15 inches of snow fell. The Ruby Mountains and East Humboldt also received 8 to 13 inches of snow.",4498937,GREATER RENO/CARSON CITY/MINDEN AREA (ZONE), ,1/30/14,300,3:00,2014-01-30  3:00:00 | Nevada,Heavy Snow, , ,0,0,0,0,Nevada,PST-8, ,82785,Z,3,REV,0,0,Trained Spotter, , , , , , , , , , , , ,"Five to 10 inches of snow fell between Carson City and Minden-Gardnerville on the 30th, with 12 inches of snow in Double Springs (5 miles north of Topaz Lake). Power was knocked out per a report 3 miles NNE of Topaz Lake.","Low pressure moved from the eastern Pacific into the West on the 30th, bringing heavy snow and rain to the Carson Range/Sierra and western Nevada.",5493121,LAS VEGAS VALLEY (ZONE), ,1/30/14,1315,13:15,2014-01-30  13:00:00 | Nevada,Strong Wind,43, ,0,0,25000,0,Nevada,PST-8,MG,82009,Z,20,VEF,0,0,Broadcast Media, , , , , , , , , , , , ,"Strong winds in the Las Vegas Valley knocked down at least two trees and one set of power lines, and threw a covered horse corral over a fence. About 4000 customers lost power. The peak gust was measured at McCarran Airport.",Strong southwest winds ahead of an approaching cold front caused minor damage in the Las Vegas Valley.,6493123,SPRING MOUNTAINS (ZONE), ,1/30/14,1532,15:32,2014-01-30  15:00:00 | Nevada,High Wind,54, ,0,0,0,0,Nevada,PST-8,MG,82009,Z,19,VEF,0,0,Mesonet, , , , , , , , , , , , ,This gust occurred 3 miles NE of Mount Charleston at 8818 feet.,Strong southwest winds ahead of an approaching cold front caused minor damage in the Las Vegas Valley.,7504502,GREATER RENO/CARSON CITY/MINDEN AREA (ZONE), ,2/8/14,1300,13:00,2014-02-08  13:00:00 | Nevada,Strong Wind,43, ,0,0,10000,0,Nevada,PST-8,MG,83551,Z,3,REV,0,0,Mesonet, , , , , , , , , , , , ,"Most areas in the Reno-Carson City-Minden area recorded wind gusts of between 40 and 50 mph on the 8th. However, foothill areas along Interstate 580 south of Reno (very wind prone) reported wind gusts of 60 to 73 mph. The strong winds caused trees to be downed along with the spilling of large boulders onto a I-580 access road at the south end of Washoe Valley.","A warm, subtropical tap brought heavy, wet snow to the high Sierra on the 8th and 9th. In the lee of the Sierra into far western Nevada, heavy rain and strong gusty winds were reported.",8504501,GREATER LAKE TAHOE AREA (ZONE), ,2/8/14,1500,15:00,2014-02-08  15:00:00 | Nevada,Heavy Snow, , ,0,0,0,0,Nevada,PST-8, ,83551,Z,2,REV,0,0,Public, , , , , , , , , , , , ,"The Mount Rose and Diamond Peak ski areas reported between 2 and 3 feet of heavy, wet snow on the 8th and 9th. South of highway 50, 14 inches was reported at the Daggett Pass Fire Station. Below 7,000 feet, 10 inches of snow fell in Incline Village down to 6,700 feet. Near Lake Tahoe level, precipitation fell mostly as rain.","A warm, subtropical tap brought heavy, wet snow to the high Sierra on the 8th and 9th. In the lee of the Sierra into far western Nevada, heavy rain and strong gusty winds were reported.",9489936,ELKO CO.,LEE,2/10/14,1100,11:00,2014-02-10  11:00:00 | Nevada,Flood, , ,0,0,1000,0,Nevada,PST-8, ,81642,C,7,LKN,0,0,NWS Employee,Ice Jam, , ,7,WNW,7,WNW,LEE,40.6214,-115.7271,40.6239,-115.7267,Ice jam flooding was observed along Huntington Creek near Twin Bridges. Moderate rainfall over the past 48 hours caused a steady rise of water in Huntington Creek.  Large blocks of ice carried by the water created an ice jam that caused water to flow over Hamilton stage road and the Twin Bridges. Ice jams were reported along the creek for 2.5 miles upstream from Twin Bridges.,Moderate rainfall over the past 48 hours caused a steady rise on Huntington Creek. Large blocks of ice carried by the water created an ice jam that caused water to flow out of the banks of Huntington Creek and over the Hamilton Stage road and over the Twin Bridges.,10504518,GREATER RENO/CARSON CITY/MINDEN AREA (ZONE), ,2/15/14,1400,14:00,2014-02-15  14:00:00 | Nevada,High Wind,78, ,0,0,20000,0,Nevada,PST-8,MG,83554,Z,3,REV,0,0,Mesonet, , , , , , , , , , , , ,"Widespread wind gusts between 60 and 70 mph were noted on the north, west, and southwest sides of Reno as well as in portions of the Carson Valley. In the foothills along Interstate 580, wind gusts of 80 to 90 mph were recorded. The high winds brought a few fences down in Golden Valley and in Spanish Springs. In southwest Reno, small trees were uprooted along with some power outages.","A strong cold front moved through western Nevada early on the 16th. Ahead of the front on the 15th, strong winds occurred with the highest in the immediate lee of the Carson Range.",11496516,SPRING MOUNTAINS (ZONE), ,2/27/14,134,1:34,2014-02-27  1:00:00 | Nevada,High Wind,52, ,0,0,0,0,Nevada,PST-8,MG,82457,Z,19,VEF,0,0,Mesonet, , , , , , , , , , , , ,Downslope winds ahead of the oncoming storm system briefly gusted to 60 mph 1 mile ESE of Red Rock Canyon.,"A strong low pressure system brought high winds, heavy rain, and heavy mountain snow to portions of the Mojave Desert and southern Great Basin.",12496515,CLARK CO.,BRACKEN,2/28/14,1400,14:00,2014-02-28  14:00:00 | Nevada,Heavy Rain, , ,0,0,250000,0,Nevada,PST-8, ,82457,C,3,VEF,8,0,Broadcast Media, , , ,1,SE,1,SE,BRACKEN,36.1103,-115.182,36.1103,-115.182,"Heavy rain in the Las Vegas Valley caused a power outage to 1263 customers; shorted out a railroad crossing sensor, causing the gate to block a major thoroughfare; and contributed to at least 43 vehicle crashes, resulting in eight injuries (indirect).","A strong low pressure system brought high winds, heavy rain, and heavy mountain snow to portions of the Mojave Desert and southern Great Basin.",13496517,SPRING MOUNTAINS (ZONE), ,2/28/14,1532,15:32,2014-02-28  15:00:00 | Nevada,High Wind,67, ,0,0,0,0,Nevada,PST-8,MG,82457,Z,19,VEF,0,0,Mesonet, , , , , , , , , , , , ,These gusts occurred 3 miles NE of Mt. Charleston.,"A strong low pressure system brought high winds, heavy rain, and heavy mountain snow to portions of the Mojave Desert and southern Great Basin.",14496518,LINCOLN COUNTY EXCEPT THE SHEEP RANGE (ZONE), ,2/28/14,2130,21:30,2014-02-28  21:00:00 | Nevada,Strong Wind,48, ,0,0,5000,0,Nevada,PST-8,MG,82457,Z,15,VEF,0,0,Mesonet, , , , , , , , , , , , ,"A sensor near Rachel measured a gust to 55 mph, and a spotter reported minor damage.","A strong low pressure system brought high winds, heavy rain, and heavy mountain snow to portions of the Mojave Desert and southern Great Basin.",15506415,GREATER RENO/CARSON CITY/MINDEN AREA (ZONE), ,3/6/14,100,0.069444444,2014-03-06  1:00:00 | Nevada,Strong Wind,39, ,0,0,2500,0,Nevada,PST-8,EG,83888,Z,3,REV,0,0,Trained Spotter, , , , , , , , , , , , ,"Most areas in the Reno-Carson City area noted wind gusts between 40 and 50 mph early on the 6th. However, wind prone areas recorded wind gusts of 60 to 65 mph. Winds caused a 10 X 20 metal shed to come apart on the north side of Carson City and cause damage to a vehicle. An NDOT observation about 1/4 mile northwest of the damage recorded a wind gust to 63 mph at 545PST.","A cold front brought gusty winds to the Reno-Carson City area on the 6th, with some wind damage in Carson City.",16505810,GREATER RENO/CARSON CITY/MINDEN AREA (ZONE), ,3/10/14,800,8:00,2014-03-10  8:00:00 | Nevada,High Wind,74, ,0,0,25000,0,Nevada,PST-8,EG,83791,Z,3,REV,0,0,Broadcast Media, , , , , , , , , , , , ,"Two outbuildings were destroyed and around 15 trees were uprooted as a cold front moved through Hidden Valley. Also, a 2 X 4 from one of the outbuildings was driven into the side of a home. A wind gust to 52 mph was recorded at the UNR Ag Farm about a half-mile northeast of the damage site. However, based on wind studies for the enhanced Fujita scale regarding the uprooting of coniferous trees a much higher speed was estimated at the damage site.","A strong cold front moved through the Reno area on the morning of the 10th. Most areas experienced wind gusts of 35 to 45 mph, however winds were much stronger in localized areas.",17497593,N ELKO CNTY (ZONE), ,3/17/14,430,4:30,2014-03-17  4:00:00 | Nevada,High Wind,55, ,0,0,0,0,Nevada,PST-8,MG,82611,Z,31,LKN,0,0,RAWS, , , , , , , , , , , , ,"A wind gust of 63 mph was observed at the Stag Mountain RAWS, 62 mph at the Long Hollow RAWS, and 58 mph at the O'Neil NDOT mesonet site.",A strong cold front brought wind gusts up to 87 mph across northern Nevada.,18497595,SOUTH-CENTRAL ELKO (ZONE), ,3/17/14,430,4:30,2014-03-17  4:00:00 | Nevada,High Wind,76, ,0,0,0,0,Nevada,PST-8,MG,82611,Z,39,LKN,0,0,Mesonet, , , , , , , , , , , , ,"A wind gust of 87 mph was observed at the Ruby Valley NDOT mesonet site, 78 mph at the Pequop Summit NDOT mesonet site, 72 mph at the Warm Springs NDOT mesonet site, and 62 mph at the Wells/Moor Grade NDOT site.",A strong cold front brought wind gusts up to 87 mph across northern Nevada.,19497597,SOUTHEASTERN ELKO (ZONE), ,3/17/14,1200,12:00,2014-03-17  12:00:00 | Nevada,High Wind,56, ,0,0,0,0,Nevada,PST-8,MG,82611,Z,33,LKN,0,0,Mesonet, , , , , , , , , , , , ,"A wind gust to 64 mph was observed at the Pilot Peak NDOT mesonet site, and a gust to 63 mph at the Spring Gulch RAWS.",A strong cold front brought wind gusts up to 87 mph across northern Nevada.,20500185,SPRING MOUNTAINS (ZONE), ,3/26/14,546,5:46,2014-03-26  5:00:00 | Nevada,High Wind,53, ,0,0,0,0,Nevada,PST-8,MG,82960,Z,19,VEF,0,0,Mesonet, , , , , , , , , , , , ,This gust occurred near Red Rock Canyon.,"A Pacific storm system brought strong downslope winds in the lee of the Sierra Nevada and Spring Mountains, and also brought high winds to the western Mojave Desert.",21500188,SPRING MOUNTAINS (ZONE), ,3/29/14,2234,22:34,2014-03-29  22:00:00 | Nevada,High Wind,70, ,0,0,0,0,Nevada,PST-8,MG,82963,Z,19,VEF,0,0,Mesonet, , , , , , , , , , , , ,The peak gust was measured 3 miles NE of Mt. Charleston at 2234 PST on the 29th.,A storm system brought locally high winds to the Mojave Desert.,22498426,RUBY MOUNTAINS/E HUMBOLDT RANGE (ZONE), ,3/30/14,30,0:30,2014-03-30  0:00:00 | Nevada,Heavy Snow, , ,0,0,0,0,Nevada,PST-8, ,82720,Z,34,LKN,0,0,SNOTEL, , , , , , , , , , , , ,,A winter like storm brought heavy snow to the Ruby Mountains and East Humboldt Range. Most SNOTEL's reported 7 to 11 inches of snow.,23500189,ESMERALDA/CENTRAL NYE (ZONE), ,3/30/14,415,4:15,2014-03-30  4:00:00 | Nevada,High Wind,58, ,0,0,0,0,Nevada,PST-8,MG,82963,Z,14,VEF,0,0,Mesonet, , , , , , , , , , , , ,This gust occurred 40 miles E of Beatty.,A storm system brought locally high winds to the Mojave Desert.,24513694,GREATER RENO/CARSON CITY/MINDEN AREA (ZONE), ,4/22/14,15,0:15,2014-04-22  0:00:00 | Nevada,Strong Wind,39, ,0,0,2000,0,Nevada,PST-8,MG,85061,Z,3,REV,0,0,Mesonet, , , , , , , , , , , , ,"Most areas saw wind gusts to between 40 and 50 mph early on the 22nd. However, the Galena RAWS and Reno-Tahoe airport noted wind gusts between 60 and 66 mph, along with sustained winds over 40 mph for the airport from 0018PST to 0143PST. While wind speeds decreased later in the morning, erratic wind shifts near the front (around 0730PST) at the Reno airport led to low level wind shear and major concerns for the airport (although no incidents were noted). Finally, a large part of a tree was broken in Sparks early in the morning.","A strong cold front moved through western Nevada on the morning of the 22nd, bringing high winds followed by low level wind shear to the Reno-Tahoe airport as well as some damage in Sparks.",25502598,ESMERALDA/CENTRAL NYE (ZONE), ,4/22/14,1015,10:15,2014-04-22  10:00:00 | Nevada,High Wind,68, ,0,0,0,0,Nevada,PST-8,MG,83306,Z,14,VEF,0,0,Trained Spotter, , , , , , , , , , , , ,The peak gust was measured 5 miles NW of Dyer at 1200 PST. Visibility was briefly near zero in blowing dust.,A strong Pacific storm system brought a short period of high winds to portions of the Mojave Desert.,26504926,SOUTH-CENTRAL ELKO (ZONE), ,4/22/14,1030,10:30,2014-04-22  10:00:00 | Nevada,High Wind,61, ,0,0,0,0,Nevada,PST-8,MG,83635,Z,39,LKN,0,0,Mesonet, , , , , , , , , , , , ,"A strong cold front brought high winds to south-central Elko County. Observed wind gusts included 70 mph at the Ruby Valley NDOT mesonet site, 67 mph at the Warm Springs NDOT mesonet site, 64 mph at the Ruby Lake RAWS, and 58 mph at the Pequop Summit NDOT mesonet site.",A strong cold front produced high winds across portions of eastern Nevada. Wind gusts up to 70 mph were observed.,27504928,WHITE PINE (ZONE), ,4/22/14,1100,11:00,2014-04-22  11:00:00 | Nevada,High Wind,60, ,0,0,0,0,Nevada,PST-8,MG,83635,Z,35,LKN,0,0,Mesonet, , , , , , , , , , , , ,"A strong cold front produced high winds across White Pine county. Observed wind gusts included 69 mph at the Ely CEMP site, 63 mph at the North Spring Valley DRI site, and 58 mph at both the Ely ASOS site and the Baker NDOT mesonet site.",A strong cold front produced high winds across portions of eastern Nevada. Wind gusts up to 70 mph were observed.,28502599,SPRING MOUNTAINS (ZONE), ,4/22/14,1104,11:04,2014-04-22  11:00:00 | Nevada,High Wind,69, ,0,0,0,0,Nevada,PST-8,MG,83306,Z,19,VEF,0,0,Mesonet, , , , , , , , , , , , ,The peak gust was measured 3 miles NE of Mount Charleston at 1234 PST.,A strong Pacific storm system brought a short period of high winds to portions of the Mojave Desert.,29504927,SOUTHEASTERN ELKO (ZONE), ,4/22/14,1245,12:45,2014-04-22  12:00:00 | Nevada,High Wind,54, ,0,0,0,0,Nevada,PST-8,MG,83635,Z,33,LKN,0,0,RAWS, , , , , , , , , , , , ,A strong cold front produced high winds across southeastern Elko county. Wind gusts to 62 mph were reported at the Pilot Peak Junction NDOT mesonet site and at the Spring Gulch RAWS site.,A strong cold front produced high winds across portions of eastern Nevada. Wind gusts up to 70 mph were observed.,30507350,LAS VEGAS VALLEY (ZONE), ,4/23/14,130,1:30,2014-04-23  1:00:00 | Nevada,Wildfire, , ,0,0,50000,0,Nevada,PST-8, ,83306,Z,20,VEF,0,0,Newspaper, , , , , , , , , , , , ,"A fire which started outdoors spread to two houses due to strong winds. No one was injured, but both homes were damaged.",A strong Pacific storm system brought a short period of high winds to portions of the Mojave Desert.,31507336,ESMERALDA/CENTRAL NYE (ZONE), ,4/25/14,1300,13:00,2014-04-25  13:00:00 | Nevada,High Wind,58, ,0,0,0,0,Nevada,PST-8,MG,84032,Z,14,VEF,0,0,Mesonet, , , , , , , , , , , , ,The peak gust was measured 40 miles E of Beatty at 1315 PST.,A strong low pressure system brought a period of high winds to the Mojave Desert and nearby areas.,32504932,S LANDER & S EUREKA (ZONE), ,4/25/14,2100,21:00,2014-04-25  21:00:00 | Nevada,Heavy Snow, , ,0,0,0,0,Nevada,PST-8, ,83638,Z,37,LKN,0,0,SNOTEL, , , , , , , , , , , , ,"Heavy snow was reported across southern Lander and southern Eureka counties. Reports included 13 inches at the Big Creek Summit SNOTEL, 10 inches at both the Diamond Peak and Vacarro SNOTEL sites, and nearly 5 inches in Eureka.",A winter-like storm brought heavy snow to southern Lander and southern Eureka counties. SNOTEL sites reported between 10 and 13 inches of snow and a COOP observer in Eureka reported nearly 5 inches of snow.,33507337,LAS VEGAS VALLEY (ZONE), ,4/26/14,200,2:00,2014-04-26  2:00:00 | Nevada,Strong Wind,48, ,0,0,500,0,Nevada,PST-8,EG,84032,Z,20,VEF,0,0,NWS Employee, , , , , , , , , , , , ,A two foot diameter tree was snapped about 40 feet above the ground at Floyd Lamb State Park.,A strong low pressure system brought a period of high winds to the Mojave Desert and nearby areas.,34515600,ESMERALDA/CENTRAL NYE (ZONE), ,5/10/14,1610,16:10,2014-05-10  16:00:00 | Nevada,High Wind,52, ,0,0,0,0,Nevada,PST-8,MG,85315,Z,14,VEF,0,0,Mesonet, , , , , , , , , , , , ,The peak gust occurred 44 miles ENE of Beatty at 1800 PST. Dust storm conditions were also reported by a spotter in Dyer.,A strong cold front brought high winds to much of the Mojave Desert and southern Great Basin.,35515601,LINCOLN COUNTY EXCEPT THE SHEEP RANGE (ZONE), ,5/10/14,1930,19:30,2014-05-10  19:00:00 | Nevada,High Wind,50, ,0,0,1000,0,Nevada,PST-8,EG,85315,Z,15,VEF,0,0,COOP Observer, , , , , , , , , , , , ,High winds blew down several large tree limbs at Cathedral Gorge State Park. The event time is estimated.,A strong cold front brought high winds to much of the Mojave Desert and southern Great Basin.,36515602,WESTERN CLARK/SOUTHERN NYE (ZONE), ,5/10/14,2012,20:12,2014-05-10  20:00:00 | Nevada,High Wind,52, ,0,0,0,0,Nevada,PST-8,MG,85315,Z,17,VEF,0,0,Trained Spotter, , , , , , , , , , , , ,This gust was measured 5 miles NW of Pahrump.,A strong cold front brought high winds to much of the Mojave Desert and southern Great Basin.,37515603,SPRING MOUNTAINS (ZONE), ,5/10/14,2045,20:45,2014-05-10  20:00:00 | Nevada,High Wind,58, ,0,0,0,0,Nevada,PST-8,MG,85315,Z,19,VEF,0,0,Mesonet, , , , , , , , , , , , ,This gust occurred 1 mile ESE of Red Rock Canyon.,A strong cold front brought high winds to much of the Mojave Desert and southern Great Basin.,38515610,LAS VEGAS VALLEY (ZONE), ,5/10/14,2045,20:45,2014-05-10  20:00:00 | Nevada,High Wind,50, ,0,0,100000,0,Nevada,PST-8,EG,85315,Z,20,VEF,0,0,Public, , , , , , , , , , , , ,"Two trampolines became airborne, trees blew down into roads, seriously damaging at least one car, several canopies at Planet Hollywood blew into the street, a carport at an apartment complex tipped over, and about 18,000 customers lost power.",A strong cold front brought high winds to much of the Mojave Desert and southern Great Basin.,39523714,LAKE MEAD/LAKE MOHAVE NATIONAL RECREATION AREA (ZONE), ,5/10/14,2130,21:30,2014-05-10  21:00:00 | Nevada,High Wind,52, ,1,0,100000,0,Nevada,PST-8,EG,85315,Z,21,VEF,0,0,Park/Forest Service, , , , , , , , , , , , ,"In the Callville Bay area, damage included 17 house trailer skirts; nine trailer awnings; several trailer roofs; flying debris damage to some vehicles, one houseboat, and a dock; a 25 foot sailboat which was flipped off a trailer; and damage to NV Energy infrastructure. At the Las Vegas Boat Harbor, one dock was pushed 20 feet and the bridge leading to it was damaged. Two other docks and private boats were also damaged. One man was presumed drowned in Lake Mead after high winds blew away his boat and caused waves in the lake.",A strong cold front brought high winds to much of the Mojave Desert and southern Great Basin.,40510874,ELKO CO.,ELKO,5/21/14,1138,11:38,2014-05-21  11:00:00 | Nevada,Tornado, ,EF0,0,0,0,0,Nevada,PST-8, ,84591,C,7,LKN,0,0,Public, ,0.23,25,2,NE,2,NE,ELKO,40.8515,-115.7414,40.8485,-115.7431,A photo was taken of the tornado. A storm survey was completed and the only evidence of a tornado was some debris stuck in a fence along the path of the tornado.,A thunderstorm moving form east to west across Elko produced two EF0 tornadoes. The first tornado touched down on Manzanita Lane behind JC Penny's. A photo was taken of the tornado. No damage was reported besides some debris stuck in a fence along the tornado's path.  ||The second tornado touched down on Aspen Way near the Post Office. It uprooted a large tree. The tornado then moved into the Smith's parking lot where it tore some shingles off a car wash and tossed shopping carts into the air.,41510875,ELKO CO.,ELKO,5/21/14,1148,11:48,2014-05-21  11:00:00 | Nevada,Tornado, ,EF0,0,0,2000,0,Nevada,PST-8, ,84591,C,7,LKN,0,0,Public, ,0.26,125,1,WNW,1,WNW,ELKO,40.8362,-115.7832,40.8329,-115.7855,The tornado touched down along Aspen Way near the Post Office. It uprooted a large tree and snapped off multiple branches along Aspen Way. The tornado then moved into the Smith's parking lot where it torn off a five by twenty foot section of shingles from the car wash. It also lifted shopping carts into the air. One shopping car slammed into the back of a vehicle causing some damage.,A thunderstorm moving form east to west across Elko produced two EF0 tornadoes. The first tornado touched down on Manzanita Lane behind JC Penny's. A photo was taken of the tornado. No damage was reported besides some debris stuck in a fence along the tornado's path.  ||The second tornado touched down on Aspen Way near the Post Office. It uprooted a large tree. The tornado then moved into the Smith's parking lot where it tore some shingles off a car wash and tossed shopping carts into the air.,42510876,ELKO CO.,(EKO)HARRIS FLD ELKO,5/21/14,1200,12:00,2014-05-21  12:00:00 | Nevada,Hail,0.88, ,0,0,0,0,Nevada,PST-8, ,84592,C,7,LKN,0,0,NWS Employee, , , ,2,W,2,NNW,ELKO,40.82,-115.81,40.86,-115.79,,A thunderstorm produced penny to nickle size hail on the west side of Elko.,43510877,LANDER CO.,GOLD ACRES,5/21/14,1530,15:30,2014-05-21  15:00:00 | Nevada,Tornado, ,EF0,0,0,0,0,Nevada,PST-8, ,84593,C,15,LKN,0,0,Public, ,0.24,50,11,WSW,12,WSW,GOLD ACRES,40.21,-116.93,40.21,-116.9346,A tornado was photographed near Horse Mountain. A storm survey was conducted but no damage was found. However survey efforts were hampered by steep and rugged terrain.,A tornado was photographed near Horse Mountain. A storm survey was conducted but steep and rugged terrain hampered survey efforts. No damage was found.,44522039,CHURCHILL CO.,FRENCHMAN,5/22/14,1830,18:30,2014-05-22  18:00:00 | Nevada,Flash Flood, , ,0,0,0,0,Nevada,PST-8, ,86516,C,1,REV,0,0,Department of Highways,Heavy Rain, , ,7,NE,8,NE,FRENCHMAN,39.34,-118.17,39.3453,-118.1439,A significant amount of water over state road 121 was reported by NDOT. There was  also rock and dirt debris with the fast-flowing water which caused the closure of the road. The time of the flash flood was estimated based on radar as the reports were received after the actual event.,"Thunderstorms over central Nevada developed and moved west during the afternoon and evening of the 22nd. In addition to localized heavy rain, thunderstorm outflows pushed into western Nevada in the evening bringing a significant dust storm to some areas between Reno and Fernley.",45522054,WESTERN NEVADA BASIN AND RANGE (ZONE), ,5/22/14,1840,18:40,2014-05-22  18:00:00 | Nevada,Dust Storm, , ,0,0,0,0,Nevada,PST-8, ,86516,Z,4,REV,0,0,Public, , , , , , , , , , , , ,An image from highway 447 between Fernley and Nixon and a report of visibility less than 1/4 mile in Fernley confirmed a dust storm west of Lovelock and Fallon. The dust was carried by large-scale thunderstorm outflows which brought east to northeast winds of 15-25 mph with gusts to 40 mph.,"Thunderstorms over central Nevada developed and moved west during the afternoon and evening of the 22nd. In addition to localized heavy rain, thunderstorm outflows pushed into western Nevada in the evening bringing a significant dust storm to some areas between Reno and Fernley.",46522045,GREATER RENO/CARSON CITY/MINDEN AREA (ZONE), ,5/22/14,2000,20:00,2014-05-22  20:00:00 | Nevada,Dust Storm, , ,0,0,0,0,Nevada,PST-8, ,86516,Z,3,REV,0,0,Public, , , , , , , , , , , , ,Widespread visibility less than 1/4 mile were reported in the Reno area and east to around Fernley. The dust was carried by large-scale thunderstorm outflows bringing east to northeast winds of 15-25 mph with gusts to 40-50 mph.,"Thunderstorms over central Nevada developed and moved west during the afternoon and evening of the 22nd. In addition to localized heavy rain, thunderstorm outflows pushed into western Nevada in the evening bringing a significant dust storm to some areas between Reno and Fernley.",47530616,LYON CO.,SILVER SPGS,6/2/14,1415,14:15,2014-06-02  14:00:00 | Nevada,Thunderstorm Wind,52, ,0,0,0,0,Nevada,PST-8,MG,87910,C,19,REV,0,0,AWOS, , , ,0,N,0,N,SILVER SPGS,39.42,-119.22,39.42,-119.22,,"Very dry surface air brought exceptionally high-based (some above 12,000 ft AGL) showers and thunderstorms to western Nevada on the 2nd. Even apparently weak showers brought outflow winds over 50 mph to some areas.",48521420,LAS VEGAS VALLEY (ZONE), ,6/8/14,1200,12:00,2014-06-08  12:00:00 | Nevada,Heat, , ,2,0,0,0,Nevada,PST-8, ,86404,Z,20,VEF,0,0,County Official, , , , , , , , , , , , ,Two people died of heat related causes in the Las Vegas Valley.,Two people died of heat related causes in the Las Vegas Valley.,49519218,LANDER CO.,AUSTIN,6/9/14,1350,13:50,2014-06-09  13:00:00 | Nevada,Thunderstorm Wind,52, ,0,0,0,0,Nevada,PST-8,MG,85986,C,15,LKN,0,0,RAWS, , , ,1,NNW,2,N,AUSTIN,39.5,-117.08,39.5019,-117.0755,,A dry microburst produced a wind gust to 60 mph at the Austin RAWS site.,50519220,LANDER CO.,PETERSON STATION,6/9/14,1738,17:38,2014-06-09  17:00:00 | Nevada,Thunderstorm Wind,58, ,0,0,0,0,Nevada,PST-8,MG,85987,C,15,LKN,0,0,RAWS, , , ,6,NNW,6,NNW,PETERSON STATION,39.3,-117.58,39.3123,-117.561,,A dry microburst produced a wind gust to 67 mph at the Desatoya Mountain RAWS site.,51519221,EUREKA CO.,(P68)EUREKA,6/9/14,1826,18:26,2014-06-09  18:00:00 | Nevada,Thunderstorm Wind,52, ,0,0,0,0,Nevada,PST-8,MG,85988,C,11,LKN,0,0,ASOS, , , ,1,W,2,NNE,(P68)EUREKA,39.6,-116.01,39.6238,-115.9903,,A dry microburst produced a wind gust to 60 mph at the Eureka Airport ASOS.,52519222,EUREKA CO.,(P68)EUREKA,6/12/14,1700,17:00,2014-06-12  17:00:00 | Nevada,Thunderstorm Wind,56, ,0,0,0,0,Nevada,PST-8,EG,85989,C,11,LKN,0,0,Trained Spotter, , , ,1,E,3,ENE,(P68)EUREKA,39.6,-115.98,39.6245,-115.947,A dry microburst just east of the Eureka Airport destroyed a hay barn and uprooted a large tree. Winds were estimated at 65 mph.,A dry microburst just east of the Eureka Airport destroyed a hay barn and uprooted a large tree.,53515582,SPRING MOUNTAINS (ZONE), ,6/16/14,1500,15:00,2014-06-16  15:00:00 | Nevada,High Wind,50, ,0,0,2000,0,Nevada,PST-8,EG,85360,Z,19,VEF,0,0,Fire Department/Rescue, , , , , , , , , , , , ,High winds knocked a large tree down onto another tree in the old town area of Mount Charleston.,A late season storm system brought isolated high winds to the mountains of southern Nevada.,54536150,WESTERN CLARK/SOUTHERN NYE (ZONE), ,7/1/14,1200,12:00,2014-07-01  12:00:00 | Nevada,Wildfire, , ,0,2,100000,0,Nevada,PST-8, ,88962,Z,17,VEF,0,0,Broadcast Media, , , , , , , , , , , , ,"A wildfire in Pahrump burned two sheds, a mobile home, and two motor homes, displacing four families. Two volunteer firefighters also suffered heat exhaustion in the 109 degree temperature.","Three wildfires broke out in southern Nevada, destroying several structures and vehicles before being contained.",55536160,LAS VEGAS VALLEY (ZONE), ,7/1/14,1200,12:00,2014-07-01  12:00:00 | Nevada,Excessive Heat, , ,3,0,0,0,Nevada,PST-8, ,88970,Z,20,VEF,0,0,ASOS, , , , , , , , , , , , ,The high temperature reached 112F at McCarran Airport in Las Vegas.,"Excessive Heat Warning criteria were reached in Las Vegas on July 1st, and nearly reached on the 2nd and 3rd. Four people died of heat related causes during this period - three in Las Vegas and one in Death Valley.",56531787,WASHOE CO.,GALENA CREEK,7/1/14,1520,15:20,2014-07-01  15:00:00 | Nevada,Thunderstorm Wind,68, ,0,0,0,0,Nevada,PST-8,MG,88095,C,31,REV,0,0,RAWS, , , ,3,SSW,3,SSW,GALENA CREEK,39.24,-119.88,39.24,-119.88,Wind gust measured at Little Valley RAWS. Gust between 1438 and 1538PST...exact time of gust estimated from radar.,"Hot temperatures and a very dry sub-cloud layer led to isolated, high-based showers and thunderstorms with very strong outflow winds on the 1st.",57531789,STOREY CO.,VIRGINIA CITY,7/1/14,1654,16:54,2014-07-01  16:00:00 | Nevada,Thunderstorm Wind,50, ,0,0,0,0,Nevada,PST-8,MG,88095,C,29,REV,0,0,Department of Highways, , , ,4,NNW,4,NNW,VIRGINIA CITY,39.37,-119.67,39.37,-119.67,Wind gust at the Five Mile Flat NDOT sensor. The gust was caused by an outflow from earlier thunderstorms to the south of the sensor.,"Hot temperatures and a very dry sub-cloud layer led to isolated, high-based showers and thunderstorms with very strong outflow winds on the 1st.",58531790,WASHOE CO.,(RNO)CANNON ARPT REN,7/1/14,1655,16:55,2014-07-01  16:00:00 | Nevada,Thunderstorm Wind,59, ,0,0,0,0,Nevada,PST-8,MG,88095,C,31,REV,0,0,ASOS, , , ,0,N,0,N,(RNO)CANNON ARPT REN,39.5,-119.77,39.5,-119.77,Outflow from earlier thunderstorms to the south of the Reno-Tahoe International airport brought this gust.,"Hot temperatures and a very dry sub-cloud layer led to isolated, high-based showers and thunderstorms with very strong outflow winds on the 1st.",59531792,WASHOE CO.,VISTA,7/1/14,1708,17:08,2014-07-01  17:00:00 | Nevada,Thunderstorm Wind,43, ,0,0,2000,0,Nevada,PST-8,EG,88095,C,31,REV,0,0,Public, , , ,3,WNW,3,WNW,VISTA,39.54,-119.72,39.54,-119.72,Multiple reports of large tree limbs downed along Sparks Blvd. and at the Sparks Marina.,"Hot temperatures and a very dry sub-cloud layer led to isolated, high-based showers and thunderstorms with very strong outflow winds on the 1st.",60531793,WASHOE CO.,LEMMON VLY,7/1/14,1713,17:13,2014-07-01  17:00:00 | Nevada,Thunderstorm Wind,62, ,0,0,0,0,Nevada,PST-8,MG,88095,C,31,REV,0,0,Official NWS Observations, , , ,1,E,1,E,LEMMON VLY,39.5685,-119.7963,39.5685,-119.7963,Wind gust at NWS Reno office. Gust caused by large outflow from earlier thunderstorms well south of office.,"Hot temperatures and a very dry sub-cloud layer led to isolated, high-based showers and thunderstorms with very strong outflow winds on the 1st.",61536151,LINCOLN COUNTY EXCEPT THE SHEEP RANGE (ZONE), ,7/2/14,1725,17:25,2014-07-02  17:00:00 | Nevada,Wildfire, , ,0,0,75000,0,Nevada,PST-8, ,88962,Z,15,VEF,0,0,Other Federal Agency, , , , , , , , , , , , ,The Cottonwood Fire and Middle Ridge Fire were started by lightning near the Utah state line. The fires destroyed two cabins and a trailer home and damaged a cemetery. Beaver Dam State Park was also closed for a time due to the fires.,"Three wildfires broke out in southern Nevada, destroying several structures and vehicles before being contained.",62519225,ELKO CO.,SHANTY TOWN,7/2/14,1832,18:32,2014-07-02  18:00:00 | Nevada,Thunderstorm Wind,51, ,0,0,0,0,Nevada,PST-8,MG,85992,C,7,LKN,0,0,RAWS, , , ,1,E,1,ENE,SHANTY TOWN,40.17,-115.49,40.1792,-115.4791,,A dry microburst produced a wind gust to 59 mph at the Ruby Lake RAWS site.,63519226,WHITE PINE CO.,STEPTOE,7/2/14,1941,19:41,2014-07-02  19:00:00 | Nevada,Thunderstorm Wind,50, ,0,0,0,0,Nevada,PST-8,MG,85993,C,33,LKN,0,0,RAWS, , , ,35,WNW,35,WNW,STEPTOE,39.74,-115.52,39.7437,-115.5166,,A dry microburst produced a wind gust to 58 mph at the Alligator Ridge RAWS site.,64519223,EUREKA CO.,EUREKA,7/3/14,1539,15:39,2014-07-03  15:00:00 | Nevada,Thunderstorm Wind,51, ,0,0,0,0,Nevada,PST-8,MG,85990,C,11,LKN,0,0,RAWS, , , ,14,WSW,14,WSW,EUREKA,39.39,-116.18,39.3909,-116.1688,,A dry microburst produced a wind gust to 59 mph at the Combs Canyon RAWS site.,65519224,WHITE PINE CO.,STEPTOE,7/3/14,1741,17:41,2014-07-03  17:00:00 | Nevada,Thunderstorm Wind,59, ,0,0,0,0,Nevada,PST-8,MG,85991,C,33,LKN,0,0,RAWS, , , ,35,WNW,35,WNW,STEPTOE,39.74,-115.52,39.744,-115.5144,,A dry microburst produced a wind gust to 68 mph at the Alligator Ridge RAWS site.,66536256,CLARK CO.,CALLVILLE BAY,7/4/14,100,0.069444444,2014-07-04  1:00:00 | Nevada,Thunderstorm Wind,45, ,0,0,1000,0,Nevada,PST-8,EG,88977,C,3,VEF,0,0,Park/Forest Service, , , ,10,ENE,10,ENE,CALLVILLE BAY,36.1645,-114.5483,36.1645,-114.5483,"Outflow winds from distant thunderstorms beached two boats, including one house boat.",The first seasonal push of monsoon moisture fueled an outbreak of thunderstorms across the Mojave Desert and southern Great Basin. Many storms produced severe weather and flash flooding.,67536277,LAS VEGAS VALLEY (ZONE), ,7/5/14,1300,13:00,2014-07-05  13:00:00 | Nevada,Heat, , ,1,0,0,0,Nevada,PST-8, ,88998,Z,20,VEF,0,0,County Official, , , , , , , , , , , , ,One man died in Las Vegas of heat related causes.,One man died in Las Vegas of heat related causes.,68536259,NYE CO.,BEATTY,7/5/14,1630,16:30,2014-07-05  16:00:00 | Nevada,Flash Flood, , ,0,0,2000,0,Nevada,PST-8, ,88977,C,23,VEF,0,0,Law Enforcement,Heavy Rain, , ,2,NNE,1,SSE,BEATTY,36.9228,-116.7558,36.8931,-116.7658,Highway 95 was flooded and impassable near Beatty.,The first seasonal push of monsoon moisture fueled an outbreak of thunderstorms across the Mojave Desert and southern Great Basin. Many storms produced severe weather and flash flooding.,69536258,CLARK CO.,BRACKEN,7/5/14,2138,21:38,2014-07-05  21:00:00 | Nevada,Flash Flood, , ,0,0,10000,0,Nevada,PST-8, ,88977,C,3,VEF,0,0,Fire Department/Rescue,Heavy Rain, , ,2,NNW,2,NNW,BRACKEN,36.1503,-115.21,36.1527,-115.209,A swift water rescue was performed at the intersection of Decatur and Oakey when a car drove into deep water in the intersection.,The first seasonal push of monsoon moisture fueled an outbreak of thunderstorms across the Mojave Desert and southern Great Basin. Many storms produced severe weather and flash flooding.,70536260,CLARK CO.,MOUNT CHARLESTON,7/6/14,0,0:00,2014-07-06  0:00:00 | Nevada,Flash Flood, , ,0,0,5000,0,Nevada,PST-8, ,88977,C,3,VEF,0,0,County Official,Heavy Rain / Burn Area, , ,5,ESE,5,ESE,MOUNT CHARLESTON,36.24,-115.5436,36.2396,-115.5421,Flash flooding knocked the gate to the Griffith Peak trailhead off its hinges and blocked Harris Springs Road with debris.,The first seasonal push of monsoon moisture fueled an outbreak of thunderstorms across the Mojave Desert and southern Great Basin. Many storms produced severe weather and flash flooding.,71536261,CLARK CO.,BLUE DIAMOND,7/6/14,1451,14:51,2014-07-06  14:00:00 | Nevada,Flash Flood, , ,0,0,1000,0,Nevada,PST-8, ,88977,C,3,VEF,0,0,Public,Heavy Rain, , ,3,WNW,2,WNW,BLUE DIAMOND,36.0658,-115.4408,36.0664,-115.4379,Four to six inches of water and mud flowed across a side road.,The first seasonal push of monsoon moisture fueled an outbreak of thunderstorms across the Mojave Desert and southern Great Basin. Many storms produced severe weather and flash flooding.,72536262,CLARK CO.,LAUGHLIN,7/6/14,1500,15:00,2014-07-06  15:00:00 | Nevada,Flash Flood, , ,0,0,5000,0,Nevada,PST-8, ,88977,C,3,VEF,0,0,Emergency Manager,Heavy Rain, , ,10,SW,7,SW,LAUGHLIN,35.0493,-114.6899,35.0919,-114.6602,Parts of Needles Highway washed out just north of the NV/CA border.,The first seasonal push of monsoon moisture fueled an outbreak of thunderstorms across the Mojave Desert and southern Great Basin. Many storms produced severe weather and flash flooding.,73536263,LINCOLN CO.,ELGIN,7/6/14,1641,16:41,2014-07-06  16:00:00 | Nevada,Thunderstorm Wind,51, ,0,0,0,0,Nevada,PST-8,MG,88977,C,17,VEF,0,0,Mesonet, , , ,11,SW,11,SW,ELGIN,37.2501,-114.7067,37.2501,-114.7067,This gust occurred at the Kane Springs RAWS.,The first seasonal push of monsoon moisture fueled an outbreak of thunderstorms across the Mojave Desert and southern Great Basin. Many storms produced severe weather and flash flooding.,74536264,NYE CO.,(UCC)YUCCA FLATS,7/6/14,1845,18:45,2014-07-06  18:00:00 | Nevada,Thunderstorm Wind,52, ,0,0,0,0,Nevada,PST-8,MG,88977,C,23,VEF,0,0,Mesonet, , , ,5,SSW,5,SSW,(UCC)YUCCA FLATS,36.9375,-116.0378,36.9375,-116.0378,,The first seasonal push of monsoon moisture fueled an outbreak of thunderstorms across the Mojave Desert and southern Great Basin. Many storms produced severe weather and flash flooding.,75536265,NYE CO.,MERCURY ARPT,7/6/14,1915,19:15,2014-07-06  19:00:00 | Nevada,Thunderstorm Wind,52, ,0,0,0,0,Nevada,PST-8,MG,88977,C,23,VEF,0,0,Mesonet, , , ,0,N,1,S,MERCURY,36.62,-116.03,36.66,-116,Three stations recorded gusts of 58 to 60 mph.,The first seasonal push of monsoon moisture fueled an outbreak of thunderstorms across the Mojave Desert and southern Great Basin. Many storms produced severe weather and flash flooding.,76536266,WESTERN CLARK/SOUTHERN NYE (ZONE), ,7/6/14,2100,21:00,2014-07-06  21:00:00 | Nevada,Dust Storm, , ,0,0,0,0,Nevada,PST-8, ,88977,Z,17,VEF,0,0,Public, , , , , , , , , , , , ,Dust storm conditions reduced visibility to near zero in Pahrump.,The first seasonal push of monsoon moisture fueled an outbreak of thunderstorms across the Mojave Desert and southern Great Basin. Many storms produced severe weather and flash flooding.,77536267,NYE CO.,MERCURY,7/6/14,2200,22:00,2014-07-06  22:00:00 | Nevada,Thunderstorm Wind,54, ,0,0,0,0,Nevada,PST-8,MG,88977,C,23,VEF,0,0,Mesonet, , , ,9,NW,9,NW,MERCURY,36.7702,-116.1046,36.7702,-116.1046,,The first seasonal push of monsoon moisture fueled an outbreak of thunderstorms across the Mojave Desert and southern Great Basin. Many storms produced severe weather and flash flooding.,78536268,CLARK CO.,CHARLESTON PARK,7/7/14,1150,11:50,2014-07-07  11:00:00 | Nevada,Flash Flood, , ,0,0,2000,0,Nevada,PST-8, ,88977,C,3,VEF,0,0,Fire Department/Rescue,Heavy Rain / Burn Area, , ,1,SSW,1,SSW,CHARLESTON PARK,36.2628,-115.655,36.2555,-115.6547,"Water, mud, and rocks flowed over Kyle Canyon Road.",The first seasonal push of monsoon moisture fueled an outbreak of thunderstorms across the Mojave Desert and southern Great Basin. Many storms produced severe weather and flash flooding.,79536274,CLARK CO.,HENDERSON,7/7/14,1439,14:39,2014-07-07  14:00:00 | Nevada,Thunderstorm Wind,50, ,0,0,0,0,Nevada,PST-8,MG,88977,C,3,VEF,0,0,Mesonet, , , ,2,SSE,2,SSE,HENDERSON,36.0033,-114.9653,36.0033,-114.9653,,The first seasonal push of monsoon moisture fueled an outbreak of thunderstorms across the Mojave Desert and southern Great Basin. Many storms produced severe weather and flash flooding.,80536270,CLARK CO.,ARDEN,7/7/14,2010,20:10,2014-07-07  20:00:00 | Nevada,Thunderstorm Wind,50, ,0,0,0,0,Nevada,PST-8,MG,88977,C,3,VEF,0,0,Mariner, , , ,3,NW,3,NW,ARDEN,36.0502,-115.2678,36.0502,-115.2678,This gust occurred at Sierra Vista High School.,The first seasonal push of monsoon moisture fueled an outbreak of thunderstorms across the Mojave Desert and southern Great Basin. Many storms produced severe weather and flash flooding.,81536272,CLARK CO.,ARDEN,7/7/14,2035,20:35,2014-07-07  20:00:00 | Nevada,Flash Flood, , ,0,0,1000,0,Nevada,PST-8, ,88977,C,3,VEF,0,0,NWS Employee,Heavy Rain, , ,3,W,3,WNW,ARDEN,36.0193,-115.2809,36.0286,-115.2804,Six to 12 inches of water flowed over Durango Drive at and north of Blue Diamond Road. The Blue Diamond Channel ALERT recorded 1.10 inches of rain in 30 minutes.,The first seasonal push of monsoon moisture fueled an outbreak of thunderstorms across the Mojave Desert and southern Great Basin. Many storms produced severe weather and flash flooding.,82536273,CLARK CO.,JEAN ARPT,7/8/14,1410,14:10,2014-07-08  14:00:00 | Nevada,Thunderstorm Wind,57, ,0,0,0,0,Nevada,PST-8,MG,88977,C,3,VEF,0,0,Mesonet, , , ,4,WSW,4,WSW,JEAN ARPT,35.74,-115.4,35.74,-115.4,This gust occurred 5 miles SW of Jean.,The first seasonal push of monsoon moisture fueled an outbreak of thunderstorms across the Mojave Desert and southern Great Basin. Many storms produced severe weather and flash flooding.,83536275,CLARK CO.,BOULDER CITY,7/8/14,1440,14:40,2014-07-08  14:00:00 | Nevada,Thunderstorm Wind,50, ,0,0,50000,0,Nevada,PST-8,EG,88977,C,3,VEF,0,0,Broadcast Media, , , ,6,NE,4,SW,CALLVILLE BAY,36.0414,-114.7941,36.0774,-114.7755,Thunderstorm winds over Lake Mead triggered swells up to eight feet that sank at least one vessel. 11 people had to be rescued.,The first seasonal push of monsoon moisture fueled an outbreak of thunderstorms across the Mojave Desert and southern Great Basin. Many storms produced severe weather and flash flooding.,84536278,LAS VEGAS VALLEY (ZONE), ,7/9/14,1300,13:00,2014-07-09  13:00:00 | Nevada,Heat, , ,1,0,0,0,Nevada,PST-8, ,88999,Z,20,VEF,0,0,County Official, , , , , , , , , , , , ,One woman died in Las Vegas of heat related causes.,One woman died in Las Vegas of heat related causes.,85536747,LAS VEGAS VALLEY (ZONE), ,7/13/14,1200,12:00,2014-07-13  12:00:00 | Nevada,Excessive Heat, , ,0,0,0,0,Nevada,PST-8, ,89065,Z,20,VEF,0,0,ASOS, , , , , , , , , , , , ,Excessive Heat Warning criteria were reached in Las Vegas as the high temperature reached 112F.,Excessive Heat Warning criteria were reached in Las Vegas.,86536757,LINCOLN CO.,ELGIN,7/13/14,1841,18:41,2014-07-13  18:00:00 | Nevada,Thunderstorm Wind,54, ,0,0,0,0,Nevada,PST-8,MG,89067,C,17,VEF,0,0,Mesonet, , , ,11,SW,11,SW,ELGIN,37.2501,-114.7067,37.2501,-114.7067,This gust was measured at the Kane Springs RAWS.,Lingering monsoon moisture brought isolated severe weather and flash flooding to the eastern Mojave Desert and southern Great Basin.,87531811,WASHOE CO.,LEMMON VLY,7/14/14,1658,16:58,2014-07-14  16:00:00 | Nevada,Thunderstorm Wind,56, ,0,0,0,0,Nevada,PST-8,MG,88116,C,31,REV,0,0,Official NWS Observations, , , ,1,E,1,E,LEMMON VLY,39.5686,-119.7961,39.5686,-119.7961,Measured at the NWS office in Reno.,Hot temperatures bring very high-based thunderstorms with strong outflow winds on the 14th.,88536758,CLARK CO.,LAS VEGAS,7/15/14,300,3:00,2014-07-15  3:00:00 | Nevada,Lightning, , ,0,0,100,0,Nevada,PST-8, ,89067,C,3,VEF,0,0,Fire Department/Rescue, , , ,2,SW,2,SW,LAS VEGAS,36.1495,-115.1754,36.1495,-115.1754,Lightning struck and set fire to two palm trees.,Lingering monsoon moisture brought isolated severe weather and flash flooding to the eastern Mojave Desert and southern Great Basin.,89531828,MINERAL CO.,HAWTHORNE,7/15/14,1400,14:00,2014-07-15  14:00:00 | Nevada,Flash Flood, , ,0,0,0,0,Nevada,PST-8, ,88118,C,21,REV,0,0,Trained Spotter,Heavy Rain, , ,6,S,6,S,BABBITT,38.44,-118.63,38.4394,-118.6386,A spotter reported that highway 359 south of Hawthorne and Lucky Boy Pass Road were closed due to flash flooding/debris flows. At least one vehicle was stranded in mud. A video was shared on Facebook showing fast-flowing water over highway 359.,Slow-moving thunderstorms brought heavy rain and localized flash flooding to Mineral County on the 15th.,90535165,NYE CO.,ROUND MTN ARPT,7/15/14,1550,15:50,2014-07-15  15:00:00 | Nevada,Flash Flood, , ,0,0,2000,0,Nevada,PST-8, ,88451,C,23,LKN,0,0,Department of Highways,Heavy Rain, , ,0,SW,2,WNW,ROUND MTN,38.7144,-117.1755,38.7273,-117.1123,Water and debris flowed onto state highway 376 and the Department of Highways had to clear the debris from the roadway. Damages are estimated.,Thunderstorms with heavy rain caused flash flooding across portions of northern Nye county. In the town of Tonopah 1 to 1.5 feet of water flowed through main street. Water and debris were reported flowing across the road on State Route 376 north of Tonopah. Water and debris was also reported flowing across the road 3 miles south of Hadley.,91535166,NYE CO.,MANHATTAN,7/15/14,1715,17:15,2014-07-15  17:00:00 | Nevada,Flash Flood, , ,0,0,5000,0,Nevada,PST-8, ,88451,C,23,LKN,0,0,Department of Highways,Heavy Rain, , ,12,SSE,11,NNE,(TPH)TONOPAH ARPT,38.3286,-117.0513,38.2198,-117.0252,Heavy rain caused water and debris to flow across State Highway 376 from mile marker 7 to 14. Shoulders were damaged. Damages are estimated.,Thunderstorms with heavy rain caused flash flooding across portions of northern Nye county. In the town of Tonopah 1 to 1.5 feet of water flowed through main street. Water and debris were reported flowing across the road on State Route 376 north of Tonopah. Water and debris was also reported flowing across the road 3 miles south of Hadley.,92535161,NYE CO.,TONOPAH,7/15/14,1740,17:40,2014-07-15  17:00:00 | Nevada,Flash Flood, , ,0,0,3000,0,Nevada,PST-8, ,88451,C,23,LKN,0,0,Trained Spotter,Heavy Rain, , ,5,S,5,S,TONOPAH,38.0732,-117.2348,38.0713,-117.2183,Heavy rain from a thunderstorm caused flash flooding in the town of Tonopah. Water 1 to 1.5 feet deep flowed down main street. Water seeped into one business in downtown. Some asphalt was lifted at a Shell gas station. Damages are estimated.,Thunderstorms with heavy rain caused flash flooding across portions of northern Nye county. In the town of Tonopah 1 to 1.5 feet of water flowed through main street. Water and debris were reported flowing across the road on State Route 376 north of Tonopah. Water and debris was also reported flowing across the road 3 miles south of Hadley.,93536760,CLARK CO.,CHARLESTON PARK,7/16/14,1258,12:58,2014-07-16  12:00:00 | Nevada,Flash Flood, , ,0,0,1000,0,Nevada,PST-8, ,89067,C,3,VEF,0,0,Post Office,Heavy Rain / Burn Area, , ,2,SE,1,SE,CHARLESTON PARK,36.2563,-115.6271,36.2569,-115.6315,Water up to six inches deep flowed through the Rainbow Canyon subdivision.,Lingering monsoon moisture brought isolated severe weather and flash flooding to the eastern Mojave Desert and southern Great Basin.,94536764,LAS VEGAS VALLEY (ZONE), ,7/17/14,1300,13:00,2014-07-17  13:00:00 | Nevada,Heat, , ,1,0,0,0,Nevada,PST-8, ,89072,Z,20,VEF,0,0,County Official, , , , , , , , , , , , ,One man died in Las Vegas of heat related causes.,One person died in Las Vegas of heat related causes.,95531994,CARSON CITY (C) CO.,NEW EMPIRE,7/19/14,1600,16:00,2014-07-19  16:00:00 | Nevada,Hail,1, ,0,0,0,0,Nevada,PST-8, ,88149,C,510,REV,0,0,Public, , , ,0,N,0,N,NEW EMPIRE,39.18,-119.75,39.18,-119.75,Hail report near Carson City High School.,"Moderately high atmospheric moisture with slow-moving thunderstorms brought heavy rain and isolated severe thunderstorms from the 19th through the 21st. Extensive damage from flash floods and debris flows was reported in Douglas County and Carson City on the 20th. In addition, a large dust storm occurred on the 20th.",96532356,DOUGLAS CO.,GARDNERVILLE,7/20/14,1245,12:45,2014-07-20  12:00:00 | Nevada,Thunderstorm Wind,53, ,0,0,0,0,Nevada,PST-8,MG,88149,C,5,REV,0,0,Trained Spotter, , , ,4,E,4,E,GARDNERVILLE,38.94,-119.65,38.94,-119.65,,"Moderately high atmospheric moisture with slow-moving thunderstorms brought heavy rain and isolated severe thunderstorms from the 19th through the 21st. Extensive damage from flash floods and debris flows was reported in Douglas County and Carson City on the 20th. In addition, a large dust storm occurred on the 20th.",97536780,DOUGLAS CO.,DOUGLAS CO ARPT,7/20/14,1319,13:19,2014-07-20  13:00:00 | Nevada,Flash Flood, , ,0,0,30000,0,Nevada,PST-8, ,88149,C,5,REV,0,0,911 Call Center,Heavy Rain, , ,4,NNE,5,NE,DOUGLAS CO ARPT,39.054,-119.731,39.0529,-119.7203,"Homeowner called 911 to report water flowing into his home at 1319PST. At least 5 other homes indicated mud (up to 3 to 5 feet) and water flows, with a video showing fast-flowing water down a street.","Moderately high atmospheric moisture with slow-moving thunderstorms brought heavy rain and isolated severe thunderstorms from the 19th through the 21st. Extensive damage from flash floods and debris flows was reported in Douglas County and Carson City on the 20th. In addition, a large dust storm occurred on the 20th.",98536783,CARSON CITY (C) CO.,STEWART,7/20/14,1345,13:45,2014-07-20  13:00:00 | Nevada,Flash Flood, , ,0,0,10000,0,Nevada,PST-8, ,88149,C,510,REV,0,0,Trained Spotter,Heavy Rain, , ,14,SSE,14,SSE,STEWART,38.9449,-119.6402,38.9403,-119.6474,A spotter reported debris and rocks in roadways near Windmill and Fish Springs Road around 1400PST. A short time later the spotter noted that Windmill Road was washed out and Calle Del Sol was impassable. The spotter's rain gauge recorded 1.10 of rain between 1300PST and 1325PST.,"Moderately high atmospheric moisture with slow-moving thunderstorms brought heavy rain and isolated severe thunderstorms from the 19th through the 21st. Extensive damage from flash floods and debris flows was reported in Douglas County and Carson City on the 20th. In addition, a large dust storm occurred on the 20th.",99532402,CHURCHILL CO.,(NFL)NAS FALLON,7/20/14,1350,13:50,2014-07-20  13:00:00 | Nevada,Thunderstorm Wind,59, ,0,0,0,0,Nevada,PST-8,MG,88149,C,1,REV,0,0,RAWS, , , ,13,WSW,13,WSW,(NFL)NAS FALLON,39.26,-118.94,39.26,-118.94,Maximum wind gust measured at the Dead Camel RAWS between 1347PST and 1447PST. Time of gust estimated from radar.,"Moderately high atmospheric moisture with slow-moving thunderstorms brought heavy rain and isolated severe thunderstorms from the 19th through the 21st. Extensive damage from flash floods and debris flows was reported in Douglas County and Carson City on the 20th. In addition, a large dust storm occurred on the 20th.",100532455,LYON CO.,SILVER SPGS ARPT,7/20/14,1355,13:55,2014-07-20  13:00:00 | Nevada,Thunderstorm Wind,52, ,0,0,0,0,Nevada,PST-8,MG,88149,C,19,REV,0,0,AWOS, , , ,0,N,0,N,SILVER SPGS ARPT,39.4,-119.25,39.4,-119.25,The Silver Springs airport measured sustained winds of 40 mph with a gust to 60 mph.,"Moderately high atmospheric moisture with slow-moving thunderstorms brought heavy rain and isolated severe thunderstorms from the 19th through the 21st. Extensive damage from flash floods and debris flows was reported in Douglas County and Carson City on the 20th. In addition, a large dust storm occurred on the 20th.",101536584,CARSON CITY (C) CO.,STEWART,7/20/14,1400,14:00,2014-07-20  14:00:00 | Nevada,Flash Flood, , ,0,0,50000,0,Nevada,PST-8, ,88149,C,510,REV,0,0,Fire Department/Rescue,Heavy Rain, , ,1,ESE,1,SE,STEWART,39.116,-119.7615,39.108,-119.7577,Water over roads and mud debris along and near Center Drive were reported (including pictures and videos) by a fire department official. Extensive damage to streets due to undermining was noted along with minor water and mud intrusions into several homes. One home had up to a foot of water and mud in the garage along with damage to the garage door. The time of the event is estimated.,"Moderately high atmospheric moisture with slow-moving thunderstorms brought heavy rain and isolated severe thunderstorms from the 19th through the 21st. Extensive damage from flash floods and debris flows was reported in Douglas County and Carson City on the 20th. In addition, a large dust storm occurred on the 20th.",102532448,WESTERN NEVADA BASIN AND RANGE (ZONE), ,7/20/14,1400,14:00,2014-07-20  14:00:00 | Nevada,Dust Storm, , ,0,0,0,0,Nevada,PST-8, ,88149,Z,4,REV,0,0,Law Enforcement, , , , , , , , , , , , ,"A line of thunderstorms initiated an extensive gust front, which moved north bringing winds 25 to 40 mph with gusts to around 60 mph. The Pershing County Sheriff's office (as well as photographic evidence) indicated a large dust storm with near zero visibility along highway 95 north of Fallon and on Interstate 80 between Fernley and Winnemucca.","Moderately high atmospheric moisture with slow-moving thunderstorms brought heavy rain and isolated severe thunderstorms from the 19th through the 21st. Extensive damage from flash floods and debris flows was reported in Douglas County and Carson City on the 20th. In addition, a large dust storm occurred on the 20th.",103536594,DOUGLAS CO.,JACKS VLY,7/20/14,1400,14:00,2014-07-20  14:00:00 | Nevada,Debris Flow, , ,0,0,20000,0,Nevada,PST-8, ,88149,C,5,REV,0,0,Public,Heavy Rain, , ,3,ENE,3,ENE,JACKS VLY,39.0912,-119.7638,39.0938,-119.7617,A Facebook photo and a report from Douglas County Emergency Management indicated a large mud flow across Long Dr. The time of the event is estimated but was likely between 1330PST and 1430PST.,"Moderately high atmospheric moisture with slow-moving thunderstorms brought heavy rain and isolated severe thunderstorms from the 19th through the 21st. Extensive damage from flash floods and debris flows was reported in Douglas County and Carson City on the 20th. In addition, a large dust storm occurred on the 20th.",104535167,ELKO CO.,ELKO,7/20/14,1410,14:10,2014-07-20  14:00:00 | Nevada,Thunderstorm Wind,52, ,0,0,3000,0,Nevada,PST-8,EG,88745,C,7,LKN,0,0,Fire Department/Rescue, , , ,1,E,3,NE,ELKO,40.83,-115.75,40.86,-115.73,Thunderstorm winds blew a one foot diameter tree branch onto a house and blew some shingles off the roof of the Senior Center. Damages are estimated.,Thunderstorm winds blew a one foot diameter tree branch onto a house and blew some shingles off the Senior Center. Heavy rain caused some street flooding in and around downtown Elko.,105532391,WASHOE CO.,LEMMON VLY,7/20/14,1416,14:16,2014-07-20  14:00:00 | Nevada,Thunderstorm Wind,50, ,0,0,0,0,Nevada,PST-8,MG,88149,C,31,REV,0,0,Official NWS Observations, , , ,1,E,1,E,LEMMON VLY,39.5687,-119.7963,39.5687,-119.7963,Measured at the NWS Reno office.,"Moderately high atmospheric moisture with slow-moving thunderstorms brought heavy rain and isolated severe thunderstorms from the 19th through the 21st. Extensive damage from flash floods and debris flows was reported in Douglas County and Carson City on the 20th. In addition, a large dust storm occurred on the 20th.",106535168,ELKO CO.,ELKO,7/20/14,1420,14:20,2014-07-20  14:00:00 | Nevada,Flash Flood, , ,0,0,1000,0,Nevada,PST-8, ,88745,C,7,LKN,0,0,Public,Heavy Rain, , ,1,NE,0,NNE,ELKO,40.84,-115.76,40.835,-115.7668,Street flooding was reported on various streets in and around downtown Elko. Damages are estimated.,Thunderstorm winds blew a one foot diameter tree branch onto a house and blew some shingles off the Senior Center. Heavy rain caused some street flooding in and around downtown Elko.,107535458,WASHOE CO.,(RNO)CANNON ARPT REN,7/20/14,1450,14:50,2014-07-20  14:00:00 | Nevada,Flash Flood, , ,0,0,0,0,Nevada,PST-8, ,88149,C,31,REV,0,0,Public,Heavy Rain, , ,2,SSW,2,SSW,(RNO)CANNON ARPT REN,39.4754,-119.7846,39.4733,-119.7864,Pictures and videos corroborated a rapid increase in water levels which threatened building damage and caused some vehicles to stall near Meadowood Mall.,"Moderately high atmospheric moisture with slow-moving thunderstorms brought heavy rain and isolated severe thunderstorms from the 19th through the 21st. Extensive damage from flash floods and debris flows was reported in Douglas County and Carson City on the 20th. In addition, a large dust storm occurred on the 20th.",108532461,CHURCHILL CO.,OCALA,7/20/14,1453,14:53,2014-07-20  14:00:00 | Nevada,Thunderstorm Wind,53, ,0,0,0,0,Nevada,PST-8,MG,88149,C,1,REV,0,0,ASOS, , , ,15,NE,15,NE,OCALA,40.07,-118.57,40.07,-118.57,The Lovelock airport measured sustained winds of 44 mph with gusts to 61 mph.,"Moderately high atmospheric moisture with slow-moving thunderstorms brought heavy rain and isolated severe thunderstorms from the 19th through the 21st. Extensive damage from flash floods and debris flows was reported in Douglas County and Carson City on the 20th. In addition, a large dust storm occurred on the 20th.",109535169,ELKO CO.,MIDAS,7/20/14,1800,18:00,2014-07-20  18:00:00 | Nevada,Thunderstorm Wind,56, ,0,0,5000,0,Nevada,PST-8,EG,88746,C,7,LKN,0,0,COOP Observer, , , ,69,NW,69,NW,MIDAS,41.99,-117.71,41.997,-117.7197,Thunderstorm winds blew down some trees in town and one fell on a house. Damages are estimated.,Thunderstorm winds blew down some trees in McDermitt including one that fell on a home.,110537168,WASHOE CO.,HAROLDS TRAPSHOOT SP,7/21/14,1807,18:07,2014-07-21  18:00:00 | Nevada,Hail,1.25, ,0,0,0,0,Nevada,PST-8, ,88149,C,31,REV,0,0,Trained Spotter, , , ,11,NNE,11,NNE,HAROLDS TRAPSHOOT SP,39.7675,-119.6013,39.7675,-119.6013,Half-dollar sized hail was reported in the Palomino Valley.,"Moderately high atmospheric moisture with slow-moving thunderstorms brought heavy rain and isolated severe thunderstorms from the 19th through the 21st. Extensive damage from flash floods and debris flows was reported in Douglas County and Carson City on the 20th. In addition, a large dust storm occurred on the 20th.",111535171,EUREKA CO.,TONKIN,7/21/14,2100,21:00,2014-07-21  21:00:00 | Nevada,Hail,1, ,0,0,0,0,Nevada,PST-8, ,88747,C,11,LKN,0,0,COOP Observer, , , ,6,SSW,6,SSW,TONKIN,39.87,-116.47,39.87,-116.47,"Quarter size hail was reported from the University of Nevada Reno Gund Ranch, 49 miles south of Beowawe. Time is approximate.","Quarter size hail was reported at the Gund Ranch, 49 miles south of Beowawe.",112536766,LAS VEGAS VALLEY (ZONE), ,7/22/14,1300,13:00,2014-07-22  13:00:00 | Nevada,Heat, , ,1,0,0,0,Nevada,PST-8, ,89073,Z,20,VEF,0,0,County Official, , , , , , , , , , , , ,One man died in Las Vegas of heat related causes.,"One person died of heat related causes on July 22nd, and Las Vegas reached Excessive Heat Warning criteria on July 23rd.",113536767,LAS VEGAS VALLEY (ZONE), ,7/23/14,1300,13:00,2014-07-23  13:00:00 | Nevada,Excessive Heat, , ,0,0,0,0,Nevada,PST-8, ,89073,Z,20,VEF,0,0,ASOS, , , , , , , , , , , , ,Las Vegas reached Excessive Heat Warning criteria with a high temperature of 112F.,"One person died of heat related causes on July 22nd, and Las Vegas reached Excessive Heat Warning criteria on July 23rd.",114535452,NYE CO.,WARM SPGS,7/27/14,1340,13:40,2014-07-27  13:00:00 | Nevada,Thunderstorm Wind,69, ,0,0,0,0,Nevada,PST-8,MG,88811,C,23,LKN,0,0,Mesonet, , , ,3,WNW,3,WNW,WARM SPGS,38.19,-116.42,38.1934,-116.4177,,A thunderstorm produced a wind gust to 79 mph near Warm Springs.,115536789,CLARK CO.,JEAN,7/27/14,1430,14:30,2014-07-27  14:00:00 | Nevada,Flash Flood, , ,0,0,5000,0,Nevada,PST-8, ,89076,C,3,VEF,0,0,Public,Heavy Rain, , ,5,NW,5,WNW,JEAN,35.8284,-115.3959,35.7984,-115.4134,"Flash flooding covered several lanes of Interstate 15 near Jean, forcing traffic into the median. Highway 161 from Jean to Goodsprings was closed, and rocks and mud also washed onto secondary roads.","After a short dry spell, another push of monsoon moisture fueled more thunderstorms over the Mojave Desert, some of which produced flash flooding.",116536790,CLARK CO.,LAS VEGAS N AIR TERM,7/27/14,1948,19:48,2014-07-27  19:00:00 | Nevada,Lightning, , ,0,0,100,0,Nevada,PST-8, ,89076,C,3,VEF,0,0,Trained Spotter, , , ,7,W,7,W,LAS VEGAS N AIR TERM,36.2045,-115.3199,36.2045,-115.3199,Lightning set fire to a tree.,"After a short dry spell, another push of monsoon moisture fueled more thunderstorms over the Mojave Desert, some of which produced flash flooding.",117536791,CLARK CO.,CHARLESTON PARK,7/28/14,1110,11:10,2014-07-28  11:00:00 | Nevada,Flash Flood, , ,0,0,1000000,0,Nevada,PST-8, ,89076,C,3,VEF,0,0,Emergency Manager,Heavy Rain / Burn Area, , ,1,SE,1,S,MOUNT CHARLESTON,36.2602,-115.6358,36.2644,-115.6222,"Major flash flooding occurred downstream of the Carpenter One burn area. Water and debris five feet deep came down Rainbow Canyon. Six homes were damaged, including two with major damage. Rainbow Canyon Road was damaged, as were utility lines and a water pipe.","After a short dry spell, another push of monsoon moisture fueled more thunderstorms over the Mojave Desert, some of which produced flash flooding.",118535453,ELKO CO.,ELBURZ,7/30/14,1435,14:35,2014-07-30  14:00:00 | Nevada,Flash Flood, , ,0,0,3000,0,Nevada,PST-8, ,88812,C,7,LKN,0,0,Newspaper,Heavy Rain, , ,2,WNW,2,WSW,ELBURZ,40.9387,-115.5275,40.921,-115.5264,The Elko Daily Free Press relayed report of flash flooding on Elburz road. Called and spoke with spotter who said  3 feet of  water and debris flowed across the road. Road was damaged  and fence destroyed. Damages estimated.,Heavy rain caused 3 feet of water and debris to flow across Elburz Road.,119535454,ELKO CO.,NORTH FORK STVNS ARP,7/30/14,1815,18:15,2014-07-30  18:00:00 | Nevada,Hail,1, ,0,0,0,0,Nevada,PST-8, ,88813,C,7,LKN,0,0,Department of Highways, , , ,14,W,14,W,NORTH FORK STVNS ARP,41.5272,-116.1183,41.5272,-116.1183,Hail covered the ground and was found 1 to 1.5 hours later.,A Thunderstorm produced 1 inch hail and a flash flood at Chicken Creek Summit on State Highway 226.,120535456,ELKO CO.,NORTH FORK STVNS ARP,7/30/14,1830,18:30,2014-07-30  18:00:00 | Nevada,Flash Flood, , ,0,0,1000,0,Nevada,PST-8, ,88813,C,7,LKN,0,0,Department of Highways,Heavy Rain, , ,14,W,13,W,NORTH FORK STVNS ARP,41.52,-116.12,41.5228,-116.1097,The Department of Transportation reported a mud slide across the road at Chicken Creek Summit. Damages estimated.,A Thunderstorm produced 1 inch hail and a flash flood at Chicken Creek Summit on State Highway 226.,121536792,CLARK CO.,BRACKEN,7/30/14,1945,19:45,2014-07-30  19:00:00 | Nevada,Lightning, , ,0,0,100,0,Nevada,PST-8, ,89083,C,3,VEF,0,0,Fire Department/Rescue, , , ,2,NNW,2,NNW,BRACKEN,36.1529,-115.2095,36.1529,-115.2095,Lightning set fire to a palm tree.,Lingering monsoon moisture fueled isolated thunderstorms over southeast Nevada.,122535457,ELKO CO.,ARTHUR,7/31/14,1130,11:30,2014-07-31  11:00:00 | Nevada,Flash Flood, , ,0,0,1000,0,Nevada,PST-8, ,88814,C,7,LKN,0,0,NWS Employee,Heavy Rain, , ,11,SSE,12,SSE,ARTHUR,40.642,-115.0202,40.6165,-115.0139,Water and mud several feet deep along the shoulder of Highway 93 about 35 miles south of Wells. Time and damages estimated. NWS Storm Survey completed.,Heavy rain caused water and debris several feet deep along Highway 93 about 35 miles south of Wells.,123535462,EUREKA CO.,DUNPHY,7/31/14,1210,12:10,2014-07-31  12:00:00 | Nevada,Tornado, ,EF0,0,0,0,0,Nevada,PST-8, ,88815,C,11,LKN,0,0,NWS Storm Survey, ,0.48,7,21,NNE,21,NNE,DUNPHY,40.9837,-116.3827,40.9838,-116.3734,The tornado was seen touching down just north of the Barrick Goldstrike Mine and then moved across a burn scar caused by a rangeland fire the previous day. The tornado moved mainly west to east with a path 1/2 mile long and 20 feet wide causing brush debris to rise up to 15 feet into the air. Winds were estimated up to 80 mph. The tornado was confirmed through a NWS and Barrick Goldstrike Mine survey.,An EF0 tornado touched down just north of the Barrick Goldstrike Mine. It stayed on the ground for around 1/2 mile and was about 20 feet wide. It traversed a rural area and the only damage was to native vegetation.,124536280,ELKO CO.,HENRY,7/31/14,1400,14:00,2014-07-31  14:00:00 | Nevada,Flash Flood, , ,0,0,1000,0,Nevada,PST-8, ,89001,C,7,LKN,0,0,NWS Storm Survey,Heavy Rain, , ,8,SW,9,SW,HENRY,41.61,-114.94,41.5972,-114.9424,Flash flooding occurred along rural roadways. Debris flows were observed. Damages estimated.,Thunderstorms with heavy rain caused flash flooding along rural roadways about 14 miles southwest of Contact.,125536793,LINCOLN CO.,DELMUES,7/31/14,1720,17:20,2014-07-31  17:00:00 | Nevada,Flash Flood, , ,0,0,5000,0,Nevada,PST-8, ,89083,C,17,VEF,0,0,Law Enforcement,Heavy Rain, , ,5,NW,4,NW,DELMUES,37.9512,-114.3578,37.9442,-114.356,Highway 322 was closed due to flooding from mile marker 5 to the Rose Valley turnoff. A portion of the road was washed out.,Lingering monsoon moisture fueled isolated thunderstorms over southeast Nevada.,126536276,ELKO CO.,WHITE ROCK,7/31/14,1730,17:30,2014-07-31  17:00:00 | Nevada,Flash Flood, , ,0,0,2000,0,Nevada,PST-8, ,88994,C,7,LKN,0,0,NWS Storm Survey,Heavy Rain, , ,10,SSW,10,SSW,WHITE ROCK,41.61,-116.22,41.6102,-116.2285,County road 728 had shoulder damage and debris over the road. Time and damage estimated.,Thunderstorms with heavy rain caused a flash flood on county road 728 about 20 miles southwest of Mountain City.,127536285,LANDER CO.,BATTLE MTN,8/1/14,1600,16:00,2014-08-01  16:00:00 | Nevada,Thunderstorm Wind,56, ,0,0,500,0,Nevada,PST-8,EG,89003,C,15,LKN,0,0,Trained Spotter, , , ,0,N,1,ENE,BATTLE MTN,40.65,-116.92,40.6551,-116.9022,A piece of metal roof was torn off a shed and damage to a satellite receiver was also noted. The metal shed doors were also blown in. Estimated winds of 60 to 70 mph from  a microburst. NWS storm survey conducted. Damages estimated.,Thunderstorm winds damaged a shed and satellite receiver.,128538835,LAS VEGAS VALLEY (ZONE), ,8/2/14,1300,13:00,2014-08-02  13:00:00 | Nevada,Heat, , ,1,0,0,0,Nevada,PST-8, ,89461,Z,20,VEF,0,0,County Official, , , , , , , , , , , , ,One man died in Las Vegas of heat related causes.,One man died in Las Vegas of heat related causes.,129536287,ELKO CO.,SHORES,8/2/14,1438,14:38,2014-08-02  14:00:00 | Nevada,Thunderstorm Wind,56, ,0,0,0,0,Nevada,PST-8,MG,89005,C,7,LKN,0,0,Mesonet, , , ,18,ENE,20,ENE,SHORES,41.64,-114.44,41.6575,-114.4151,The Rock Spring Creek RAWS site measured a wind gust to 65 mph.,Thunderstorms produced wind gusts to 65 mph and flash flooding along rural roadways in northeast Elko county.,130536288,ELKO CO.,HENRY,8/2/14,1600,16:00,2014-08-02  16:00:00 | Nevada,Flash Flood, , ,0,0,500,0,Nevada,PST-8, ,89005,C,7,LKN,0,0,NWS Storm Survey,Heavy Rain, , ,13,NW,12,WNW,HENRY,41.8077,-115.0288,41.74,-115.0613,Water was observed across rural roadways. Damages estimated.,Thunderstorms produced wind gusts to 65 mph and flash flooding along rural roadways in northeast Elko county.,131538814,CLARK CO.,NELSON,8/3/14,2100,21:00,2014-08-03  21:00:00 | Nevada,Flash Flood, , ,0,0,2000,0,Nevada,PST-8, ,89435,C,3,VEF,0,0,Park/Forest Service,Heavy Rain, , ,4,ENE,7,E,NELSON,35.717,-114.7591,35.7167,-114.7101,Highway 165 was closed due to water and debris.,"A major surge of monsoon moisture brought an outbreak of thunderstorms to the Mojave Desert and southern Great Basin, with the most activity on the 3rd and 4th. Widespread flash flooding and severe weather occurred.",132538815,CLARK CO.,BOULDER CITY,8/3/14,2200,22:00,2014-08-03  22:00:00 | Nevada,Flash Flood, , ,0,0,2000,0,Nevada,PST-8, ,89435,C,3,VEF,0,0,Park/Forest Service,Heavy Rain, , ,6,NNE,6,NNE,BOULDER CITY,36.0543,-114.8301,36.0566,-114.8085,Debris washed over Lakeshore Road.,"A major surge of monsoon moisture brought an outbreak of thunderstorms to the Mojave Desert and southern Great Basin, with the most activity on the 3rd and 4th. Widespread flash flooding and severe weather occurred.",133538816,CLARK CO.,MOAPA,8/3/14,2320,23:20,2014-08-03  23:00:00 | Nevada,Flash Flood, , ,0,0,5000,0,Nevada,PST-8, ,89435,C,3,VEF,0,0,Public,Heavy Rain, , ,2,NW,3,NNE,MOAPA,36.6902,-114.6514,36.7015,-114.6053,Several roads in Moapa were flooded and covered with mud.,"A major surge of monsoon moisture brought an outbreak of thunderstorms to the Mojave Desert and southern Great Basin, with the most activity on the 3rd and 4th. Widespread flash flooding and severe weather occurred.",134538818,CLARK CO.,MOUNT CHARLESTON,8/3/14,2330,23:30,2014-08-03  23:00:00 | Nevada,Flash Flood, , ,0,0,20000,0,Nevada,PST-8, ,89435,C,3,VEF,0,0,Fire Department/Rescue,Heavy Rain / Burn Area, , ,5,E,6,ESE,MOUNT CHARLESTON,36.2734,-115.5219,36.2554,-115.5219,Harris Springs Road and some secondary roads in lower Kyle Canyon were washed out.,"A major surge of monsoon moisture brought an outbreak of thunderstorms to the Mojave Desert and southern Great Basin, with the most activity on the 3rd and 4th. Widespread flash flooding and severe weather occurred.",135538819,CLARK CO.,BLUE DIAMOND,8/4/14,100,0.069444444,2014-08-04  1:00:00 | Nevada,Flash Flood, , ,0,0,5000,0,Nevada,PST-8, ,89435,C,3,VEF,0,0,NWS Employee,Heavy Rain, , ,3,WNW,0,WNW,RED ROCK CANYON,36.06,-115.4553,36.1413,-115.4553,Highway 159 was closed by flooding and debris. Spring Mountain Ranch State Park was also closed.,"A major surge of monsoon moisture brought an outbreak of thunderstorms to the Mojave Desert and southern Great Basin, with the most activity on the 3rd and 4th. Widespread flash flooding and severe weather occurred.",136538821,CLARK CO.,NELSON,8/4/14,1140,11:40,2014-08-04  11:00:00 | Nevada,Tornado, ,EF0,0,0,0,0,Nevada,PST-8, ,89435,C,3,VEF,0,0,Public, ,0.08,25,9,NNW,9,NNW,NELSON,35.83,-114.87,35.83,-114.87,A small tornado briefly touched down in open desert east of Highway 95 near the Nelsons Landing turn off.,"A major surge of monsoon moisture brought an outbreak of thunderstorms to the Mojave Desert and southern Great Basin, with the most activity on the 3rd and 4th. Widespread flash flooding and severe weather occurred.",137538822,NYE CO.,LATHROP WELLS,8/4/14,1253,12:53,2014-08-04  12:00:00 | Nevada,Flash Flood, , ,0,0,2000,0,Nevada,PST-8, ,89435,C,23,VEF,0,0,Law Enforcement,Heavy Rain, , ,9,E,5,WSW,MERCURY ARPT,36.6112,-116.2402,36.5825,-116.1152,Highway 95 was flooded near the intersection of Highway 160 as well as near Nye County mile markers 18 and 20.,"A major surge of monsoon moisture brought an outbreak of thunderstorms to the Mojave Desert and southern Great Basin, with the most activity on the 3rd and 4th. Widespread flash flooding and severe weather occurred.",138536293,EUREKA CO.,(P68)EUREKA,8/4/14,1300,13:00,2014-08-04  13:00:00 | Nevada,Flash Flood, , ,0,0,0,0,Nevada,PST-8, ,89006,C,11,LKN,0,0,Law Enforcement,Heavy Rain, , ,4,WSW,4,WSW,(P68)EUREKA,39.57,-116.07,39.5837,-116.0694,Flowing water was observed on highway 50 through Devils Gate.,Thunderstorms with heavy rain produced flash flooding on highway 278 north of Eureka and along highway 50 west of Eureka.,139538824,NYE CO.,(UCC)YUCCA FLATS,8/4/14,1300,13:00,2014-08-04  13:00:00 | Nevada,Flash Flood, , ,0,0,2000,0,Nevada,PST-8, ,89435,C,23,VEF,0,0,Other Federal Agency,Heavy Rain, , ,3,W,2,WNW,(UCC)YUCCA FLATS,37.005,-116.062,37.0061,-116.0376,Several inches of water and debris flooded roads on Area 6 of the Nevada National Security Site.,"A major surge of monsoon moisture brought an outbreak of thunderstorms to the Mojave Desert and southern Great Basin, with the most activity on the 3rd and 4th. Widespread flash flooding and severe weather occurred.",140536294,EUREKA CO.,TONKIN,8/4/14,1300,13:00,2014-08-04  13:00:00 | Nevada,Flash Flood, , ,0,0,0,0,Nevada,PST-8, ,89006,C,11,LKN,0,0,NWS Employee,Heavy Rain, , ,15,SE,18,NNW,(P68)EUREKA,39.8253,-116.193,39.8517,-116.0941,Water and mud was observed on highway 278 about 4 miles south of Garden Pass.,Thunderstorms with heavy rain produced flash flooding on highway 278 north of Eureka and along highway 50 west of Eureka.,141538825,CLARK CO.,LAS VEGAS N AIR TERM,8/4/14,1343,13:43,2014-08-04  13:00:00 | Nevada,Flash Flood, , ,0,0,25000,0,Nevada,PST-8, ,89435,C,3,VEF,0,0,Fire Department/Rescue,Heavy Rain, , ,11,NW,1,ESE,DIKE SIDING,36.3176,-115.3455,36.2954,-114.9857,Water was several inches deep at the intersection of Twain and Decatur. A swift water rescue occurred at Decatur and Oakey. A large section of concrete block wall was knocked down by floodwaters. A car stalled in the water at Rainbow and Hacienda. Water was several inches deep over the intersection of Koval and Winnick. 143 weather related accidents were reported.,"A major surge of monsoon moisture brought an outbreak of thunderstorms to the Mojave Desert and southern Great Basin, with the most activity on the 3rd and 4th. Widespread flash flooding and severe weather occurred.",142538826,CLARK CO.,BLUE DIAMOND,8/4/14,1405,14:05,2014-08-04  14:00:00 | Nevada,Flash Flood, , ,0,0,1000,0,Nevada,PST-8, ,89435,C,3,VEF,0,0,Broadcast Media,Heavy Rain, , ,0,S,0,SSE,BLUE DIAMOND,36.0479,-115.4,36.0485,-115.3994,Arroyo Road was flooded 8-12 inches deep.,"A major surge of monsoon moisture brought an outbreak of thunderstorms to the Mojave Desert and southern Great Basin, with the most activity on the 3rd and 4th. Widespread flash flooding and severe weather occurred.",143538827,CLARK CO.,INDIAN SPGS,8/4/14,1410,14:10,2014-08-04  14:00:00 | Nevada,Flash Flood, , ,0,0,1000,0,Nevada,PST-8, ,89435,C,3,VEF,0,0,Fire Department/Rescue,Heavy Rain, , ,10,ESE,10,ESE,INDIAN SPGS,36.51,-115.52,36.5032,-115.5223,Two lanes of Highway 95 were flooded with several inches of water.,"A major surge of monsoon moisture brought an outbreak of thunderstorms to the Mojave Desert and southern Great Basin, with the most activity on the 3rd and 4th. Widespread flash flooding and severe weather occurred.",144538828,CLARK CO.,LAS VEGAS N AIR TERM,8/4/14,1430,14:30,2014-08-04  14:00:00 | Nevada,Flash Flood, , ,0,0,100000,0,Nevada,PST-8, ,89435,C,3,VEF,0,0,Law Enforcement,Heavy Rain, , ,11,NW,9,NNW,LAS VEGAS N AIR TERM,36.3086,-115.3537,36.3285,-115.2795,"Part of Highway 157 was washed out. Highway 95 was closed at Clark County mile marker 99, with 30 cars stranded and some washed off the road. Everyone was rescued.","A major surge of monsoon moisture brought an outbreak of thunderstorms to the Mojave Desert and southern Great Basin, with the most activity on the 3rd and 4th. Widespread flash flooding and severe weather occurred.",145538830,LINCOLN CO.,ROX,8/4/14,1540,15:40,2014-08-04  15:00:00 | Nevada,Flash Flood, , ,0,0,1000,0,Nevada,PST-8, ,89435,C,17,VEF,0,0,Law Enforcement,Heavy Rain, , ,20,W,20,W,ROX,36.8469,-115.0296,36.9071,-115.031,Highway 93 was flooded and closed at Lincoln County mile marker 3.,"A major surge of monsoon moisture brought an outbreak of thunderstorms to the Mojave Desert and southern Great Basin, with the most activity on the 3rd and 4th. Widespread flash flooding and severe weather occurred.",146538831,CLARK CO.,LAS VEGAS N AIR TERM,8/4/14,1556,15:56,2014-08-04  15:00:00 | Nevada,Flash Flood, , ,0,0,1000,0,Nevada,PST-8, ,89435,C,3,VEF,0,0,Broadcast Media,Heavy Rain / Burn Area, , ,10,NW,10,NW,LAS VEGAS N AIR TERM,36.3075,-115.3348,36.3048,-115.335,Over a foot of water flowed rapidly down Grand Teton Drive.,"A major surge of monsoon moisture brought an outbreak of thunderstorms to the Mojave Desert and southern Great Basin, with the most activity on the 3rd and 4th. Widespread flash flooding and severe weather occurred.",147538832,NYE CO.,SPRINGDALE,8/4/14,1607,16:07,2014-08-04  16:00:00 | Nevada,Flash Flood, , ,0,0,5000,0,Nevada,PST-8, ,89435,C,23,VEF,0,0,Law Enforcement,Heavy Rain, , ,0,SSE,3,NW,SPRINGDALE,37.0275,-116.7682,37.064,-116.806,Highway 95 was damaged by flooding near Nye County mile marker 75.,"A major surge of monsoon moisture brought an outbreak of thunderstorms to the Mojave Desert and southern Great Basin, with the most activity on the 3rd and 4th. Widespread flash flooding and severe weather occurred.",148540739,ELKO CO.,LEE,8/5/14,1230,12:30,2014-08-05  12:00:00 | Nevada,Flash Flood, , ,0,0,1000,0,Nevada,PST-8, ,89064,C,7,LKN,0,0,Law Enforcement,Heavy Rain, , ,3,NW,3,NW,LEE,40.6,-115.66,40.6054,-115.6585,Law enforcement reported a 1/2 mile wide area of water and debris across Lee road just off State Highway 228. Debris was 1 to 3 feet deep. Shoulder and minor road damage occurred. Damages are estimated.,"Abundant monsoon moisture produced thunderstorms with heavy rain that produced numerous flash floods, primarily across Elko county.",149536748,ELKO CO.,LEE,8/5/14,1500,15:00,2014-08-05  15:00:00 | Nevada,Flash Flood, , ,0,0,0,0,Nevada,PST-8, ,89064,C,7,LKN,0,0,Public,Heavy Rain, , ,7,NW,7,NW,LEE,40.64,-115.72,40.6386,-115.7196,One foot of water was reported flowing across a road near South Fork Reservoir.,"Abundant monsoon moisture produced thunderstorms with heavy rain that produced numerous flash floods, primarily across Elko county.",150536756,ELKO CO.,DEETH,8/5/14,1545,15:45,2014-08-05  15:00:00 | Nevada,Flash Flood, , ,0,0,0,0,Nevada,PST-8, ,89064,C,7,LKN,0,0,NWS Storm Survey,Heavy Rain, , ,2,NNW,7,NNW,DEETH,41.094,-115.2926,41.1629,-115.3126,Multiple areas of flash flooding were reported along country roads north of Deeth with water 1 to 2 feet deep in places making roads impassable.,"Abundant monsoon moisture produced thunderstorms with heavy rain that produced numerous flash floods, primarily across Elko county.",151536761,ELKO CO.,DEETH,8/5/14,1700,17:00,2014-08-05  17:00:00 | Nevada,Flash Flood, , ,0,0,0,0,Nevada,PST-8, ,89064,C,7,LKN,0,0,Trained Spotter,Heavy Rain, , ,6,NW,5,WNW,DEETH,41.1259,-115.3675,41.0964,-115.3682,Heavy rain caused flooding in dry washes and across roadways.,"Abundant monsoon moisture produced thunderstorms with heavy rain that produced numerous flash floods, primarily across Elko county.",152536762,ELKO CO.,RYNDON,8/5/14,1722,17:22,2014-08-05  17:00:00 | Nevada,Flash Flood, , ,0,0,0,0,Nevada,PST-8, ,89064,C,7,LKN,0,0,Public,Heavy Rain, , ,1,WSW,0,NNW,ELBURZ,40.9431,-115.6215,40.9352,-115.5036,Flash flooding was reported in and around Ryndon.,"Abundant monsoon moisture produced thunderstorms with heavy rain that produced numerous flash floods, primarily across Elko county.",153536768,ELKO CO.,(EKO)HARRIS FLD ELKO,8/5/14,1723,17:23,2014-08-05  17:00:00 | Nevada,Flash Flood, , ,0,0,2000,0,Nevada,PST-8, ,89064,C,7,LKN,0,0,NWS Storm Survey,Heavy Rain, , ,1,WSW,2,ESE,ELKO,40.8116,-115.8061,40.8247,-115.7376,Flash flooding occurred in the Elko Hills southwest of downtown. Water was across roads and residential properties were flooded. Debris also on many roads including Bullion road and Errecart road. Damages estimated.,"Abundant monsoon moisture produced thunderstorms with heavy rain that produced numerous flash floods, primarily across Elko county.",154536769,NYE CO.,TONOPAH,8/5/14,1830,18:30,2014-08-05  18:00:00 | Nevada,Flash Flood, , ,0,0,1000,0,Nevada,PST-8, ,89064,C,23,LKN,0,0,Public,Heavy Rain, , ,4,SSW,5,SSE,TONOPAH,38.0916,-117.2468,38.0846,-117.1943,Six inches of water were reported flowing down the shoulders and side roads in Tonopah. Estimated three feet of flowing water in dry washes. Damages estimated.,"Abundant monsoon moisture produced thunderstorms with heavy rain that produced numerous flash floods, primarily across Elko county.",155538833,ESMERALDA CO.,BLAIR JCT,8/5/14,1858,18:58,2014-08-05  18:00:00 | Nevada,Flash Flood, , ,0,0,2000,0,Nevada,PST-8, ,89435,C,9,VEF,0,0,Law Enforcement,Heavy Rain, , ,8,SSE,8,SSE,BLAIR JCT,37.91,-117.72,37.9172,-117.6945,Mud and debris washed onto Highway 265.,"A major surge of monsoon moisture brought an outbreak of thunderstorms to the Mojave Desert and southern Great Basin, with the most activity on the 3rd and 4th. Widespread flash flooding and severe weather occurred.",156536771,EUREKA CO.,(P68)EUREKA,8/5/14,1900,19:00,2014-08-05  19:00:00 | Nevada,Flash Flood, , ,0,0,10000,0,Nevada,PST-8, ,89064,C,11,LKN,0,0,Department of Highways,Heavy Rain, , ,26,WSW,32,WSW,EUREKA,39.4361,-116.4457,39.2448,-116.4473,The Department of Transporation reported significant flash flooding in Willow Creek Canyon. Indian Creek and Snowball Creek also had reports of flash flooding. Damage to  roads were also noted around ranches in the valley. Damages are estimated.,"Abundant monsoon moisture produced thunderstorms with heavy rain that produced numerous flash floods, primarily across Elko county.",157536772,WHITE PINE CO.,KIMBERLY,8/5/14,2025,20:25,2014-08-05  20:00:00 | Nevada,Flash Flood, , ,0,0,1000,0,Nevada,PST-8, ,89064,C,33,LKN,0,0,Department of Highways,Heavy Rain, , ,44,W,44,W,KIMBERLY,39.1713,-115.8399,39.1897,-115.8394,Flash flooding was reported on Duckwater Road in White  Pine county near Pogues station.|Damages estimated.,"Abundant monsoon moisture produced thunderstorms with heavy rain that produced numerous flash floods, primarily across Elko county.",158536773,ELKO CO.,JARBIDGE,8/5/14,2141,21:41,2014-08-05  21:00:00 | Nevada,Flood, , ,0,0,2000,0,Nevada,PST-8, ,89064,C,7,LKN,0,0,Public,Heavy Rain, , ,2,SSE,1,NE,JARBIDGE,41.8521,-115.4074,41.892,-115.4042,Public reported 18 inches of mud and water flowing onto a road and rocks falling into roads from cliffs and steep slopes. Damages estimated.,"Abundant monsoon moisture produced thunderstorms with heavy rain that produced numerous flash floods, primarily across Elko county.",159540742,EUREKA CO.,(P68)EUREKA,8/6/14,1420,14:20,2014-08-06  14:00:00 | Nevada,Hail,1, ,0,0,0,0,Nevada,PST-8, ,89928,C,11,LKN,0,0,Trained Spotter, , , ,4,N,4,N,(P68)EUREKA,39.65,-116.01,39.65,-116.01,Quarter size hail damaged alfalfa crops in Diamond Valley.,"Monsoon moisture generated thunderstorms that produced hail up to 1 inch in diameter, strong winds, and flash flooding in portions of central and northeast Nevada.",160540744,WHITE PINE CO.,CHERRY CREEK,8/6/14,1455,14:55,2014-08-06  14:00:00 | Nevada,Hail,1, ,0,0,0,0,Nevada,PST-8, ,89928,C,33,LKN,0,0,Public, , , ,42,W,42,W,CHERRY CREEK,39.99,-115.66,39.99,-115.66,,"Monsoon moisture generated thunderstorms that produced hail up to 1 inch in diameter, strong winds, and flash flooding in portions of central and northeast Nevada.",161540741,ELKO CO.,PILOT,8/6/14,1757,17:57,2014-08-06  17:00:00 | Nevada,Thunderstorm Wind,51, ,0,0,0,0,Nevada,PST-8,MG,89928,C,7,LKN,0,0,Mesonet, , , ,1,NE,3,NNE,PILOT,40.84,-114.21,40.8694,-114.1934,The Pilot Peak Junction NDOT mesonet station reported a wind gust to 59 mph.,"Monsoon moisture generated thunderstorms that produced hail up to 1 inch in diameter, strong winds, and flash flooding in portions of central and northeast Nevada.",162540740,ELKO CO.,MIZPAH,8/6/14,1805,18:05,2014-08-06  18:00:00 | Nevada,Flash Flood, , ,0,0,1000,0,Nevada,PST-8, ,89928,C,7,LKN,0,0,NWS Storm Survey,Heavy Rain, , ,22,SE,24,SE,MIZPAH,40.2641,-114.262,40.2572,-114.2383,Numerous roads showed evidence of flash flooding with damage to some of the roads along the Goshute mountains.  Rocks and mud were also washed onto  some of the roads. Damages are estimated.,"Monsoon moisture generated thunderstorms that produced hail up to 1 inch in diameter, strong winds, and flash flooding in portions of central and northeast Nevada.",163541516,DOUGLAS CO.,DRESSLERVILLE,8/6/14,2034,20:34,2014-08-06  20:00:00 | Nevada,Flash Flood, , ,0,0,10000,5000,Nevada,PST-8, ,90134,C,5,REV,0,0,Trained Spotter,Heavy Rain, , ,7,E,7,E,DRESSLERVILLE,38.9013,-119.5872,38.9008,-119.5897,A spotter reported that Pine Nut Creek was flooding near Lena Lane. The Minden-Gardnerville Record Courier received a report from the owner of City of Refuge (just downstream from Lena Ln) indicating flooding of the property's orchards. One home was flooded on Blue Sage Rd.,Heavy rain in the Pine Nut Range near the headwaters of Pine Nut Creek caused substantial flash flooding east of the Allerman Canal (in Gardnerville) along Pine Nut Creek.,164541517,DOUGLAS CO.,GARDNERVILLE,8/6/14,2145,21:45,2014-08-06  21:00:00 | Nevada,Flash Flood, , ,0,0,50000,0,Nevada,PST-8, ,90134,C,5,REV,0,0,Newspaper,Heavy Rain, , ,4,E,5,ENE,DRESSLERVILLE,38.9341,-119.6602,38.9274,-119.6307,"The Minden-Gardnerville Record Courier noted that a Douglas County fire marshal stated that 9 houses had interior damage due to flooding. Also, emergency officials indicated that 2 feet of water had flowed over Fish Springs Rd. A power pole was broken near Jacobsen Ln due to the flash flood.",Heavy rain in the Pine Nut Range near the headwaters of Pine Nut Creek caused substantial flash flooding east of the Allerman Canal (in Gardnerville) along Pine Nut Creek.,165541518,DOUGLAS CO.,GARDNERVILLE,8/6/14,2200,22:00,2014-08-06  22:00:00 | Nevada,Flash Flood, , ,0,0,0,0,Nevada,PST-8, ,90134,C,5,REV,0,0,Newspaper,Heavy Rain, , ,1,E,1,ENE,GARDNERVILLE,38.9332,-119.709,38.9379,-119.7086,Flood waters from Pine Nut Creek moved over East Valley Rd (and several non-paved roads) per photographic evidence.  The Allerman Canal (eastern side of Gardnerville) helped to stop the advance of flood waters. The time of the flash flood is estimated.,Heavy rain in the Pine Nut Range near the headwaters of Pine Nut Creek caused substantial flash flooding east of the Allerman Canal (in Gardnerville) along Pine Nut Creek.,166538836,LAS VEGAS VALLEY (ZONE), ,8/10/14,1300,13:00,2014-08-10  13:00:00 | Nevada,Heat, , ,1,0,0,0,Nevada,PST-8, ,89462,Z,20,VEF,0,0,County Official, , , , , , , , , , , , ,One man died in Las Vegas of heat related causes.,One man died in Las Vegas of heat related causes.,167540867,WHITE PINE CO.,LAGES STATION,8/10/14,1445,14:45,2014-08-10  14:00:00 | Nevada,Flash Flood, , ,0,0,2000,0,Nevada,PST-8, ,89956,C,33,LKN,0,0,NWS Storm Survey,Heavy Rain, , ,4,E,8,ENE,LAGES STATION,40.06,-114.52,40.1011,-114.4462,Thunderstorms with heavy rain caused flash flooding on alternate State Route 93 near Lages Station.  A 2 mile section of the highway was flooded and a car was washed off the road. Partial washouts on dirt roads in the area were observed. Damages are estimated.,Thunderstorms with heavy rain caused flash flooding and debris flows across alternate State  Route 93 near Lages Station.,168541641,CARSON CITY (C) CO.,EMPIRE,8/11/14,1300,13:00,2014-08-11  13:00:00 | Nevada,Thunderstorm Wind,53, ,0,0,0,0,Nevada,PST-8,MG,90160,C,510,REV,0,0,Mesonet, , , ,2,S,2,S,EMPIRE,39.158,-119.718,39.158,-119.718,This wind gust was measured at a Citizen Weather Observer Program (CWOP) site.,"Low pressure moved into northern California on the 11th and 12th, aiding in the development of strong to severe thunderstorms. Some storms dropped very heavy rain (for western NV) with between 0.75 and 1.50 inches of rain in 20 to 30 minutes. The Nevada Department of Emergency Management estimated 2.43M in total damage in Douglas County from several flash flooding events in July and August (through the 11th), with damages split between public infrastructure (around 927K) and private residences (1.5M).",169541643,WASHOE CO.,WASHOE CITY,8/11/14,1320,13:20,2014-08-11  13:00:00 | Nevada,Hail,1, ,0,0,0,0,Nevada,PST-8, ,90160,C,31,REV,0,0,Trained Spotter, , , ,3,ESE,3,ESE,WASHOE CITY,39.3,-119.77,39.3,-119.77,The hail was measured by a ranger at Washoe Lake State Park and relayed by a spotter.,"Low pressure moved into northern California on the 11th and 12th, aiding in the development of strong to severe thunderstorms. Some storms dropped very heavy rain (for western NV) with between 0.75 and 1.50 inches of rain in 20 to 30 minutes. The Nevada Department of Emergency Management estimated 2.43M in total damage in Douglas County from several flash flooding events in July and August (through the 11th), with damages split between public infrastructure (around 927K) and private residences (1.5M).",170541644,WASHOE CO.,WASHOE CITY,8/11/14,1325,13:25,2014-08-11  13:00:00 | Nevada,Thunderstorm Wind,52, ,0,0,0,0,Nevada,PST-8,EG,90160,C,31,REV,0,0,Trained Spotter, , , ,3,ESE,3,ESE,WASHOE CITY,39.3,-119.77,39.3,-119.77,Small tree branches were reported down near New Washoe City.,"Low pressure moved into northern California on the 11th and 12th, aiding in the development of strong to severe thunderstorms. Some storms dropped very heavy rain (for western NV) with between 0.75 and 1.50 inches of rain in 20 to 30 minutes. The Nevada Department of Emergency Management estimated 2.43M in total damage in Douglas County from several flash flooding events in July and August (through the 11th), with damages split between public infrastructure (around 927K) and private residences (1.5M).",171541645,WASHOE CO.,WEST RENO,8/11/14,1340,13:40,2014-08-11  13:00:00 | Nevada,Hail,0.88, ,0,0,0,0,Nevada,PST-8, ,90160,C,31,REV,0,0,Trained Spotter, , , ,2,W,2,W,WEST RENO,39.535,-119.8828,39.535,-119.8828,The hail occurred at McQueen High School.,"Low pressure moved into northern California on the 11th and 12th, aiding in the development of strong to severe thunderstorms. Some storms dropped very heavy rain (for western NV) with between 0.75 and 1.50 inches of rain in 20 to 30 minutes. The Nevada Department of Emergency Management estimated 2.43M in total damage in Douglas County from several flash flooding events in July and August (through the 11th), with damages split between public infrastructure (around 927K) and private residences (1.5M).",172562236,DOUGLAS CO.,DOUGLAS CO ARPT,8/11/14,1355,13:55,2014-08-11  13:00:00 | Nevada,Flash Flood, , ,0,0,5000,0,Nevada,PST-8, ,90160,C,5,REV,0,0,Law Enforcement,Heavy Rain, , ,4,ENE,4,ENE,DOUGLAS CO ARPT,39.0259,-119.7043,39.0274,-119.7047,Up to a foot of water over low spots in Johnson Lane. Water reported in two homes.,"Low pressure moved into northern California on the 11th and 12th, aiding in the development of strong to severe thunderstorms. Some storms dropped very heavy rain (for western NV) with between 0.75 and 1.50 inches of rain in 20 to 30 minutes. The Nevada Department of Emergency Management estimated 2.43M in total damage in Douglas County from several flash flooding events in July and August (through the 11th), with damages split between public infrastructure (around 927K) and private residences (1.5M).",173541647,WASHOE CO.,SUN VLY,8/11/14,1413,14:13,2014-08-11  14:00:00 | Nevada,Hail,0.88, ,0,0,0,0,Nevada,PST-8, ,90160,C,31,REV,0,0,Trained Spotter, , , ,2,WNW,2,WNW,SUN VLY,39.61,-119.81,39.61,-119.81,,"Low pressure moved into northern California on the 11th and 12th, aiding in the development of strong to severe thunderstorms. Some storms dropped very heavy rain (for western NV) with between 0.75 and 1.50 inches of rain in 20 to 30 minutes. The Nevada Department of Emergency Management estimated 2.43M in total damage in Douglas County from several flash flooding events in July and August (through the 11th), with damages split between public infrastructure (around 927K) and private residences (1.5M).",174538856,CLARK CO.,LAS VEGAS N AIR TERM,8/11/14,1940,19:40,2014-08-11  19:00:00 | Nevada,Lightning, , ,0,0,10000,0,Nevada,PST-8, ,89469,C,3,VEF,1,0,Fire Department/Rescue, , , ,3,SW,2,WNW,LAS VEGAS,36.1884,-115.2301,36.1806,-115.1765,"Lightning caused a tree fire and also struck a power pole, causing a power outage which, along with the rain, contributed to a multi-vehicle accident which injured one person (indirect).",A push of monsoon moisture fueled thunderstorms over the Mojave Desert. Some storms produced severe weather and flash flooding.,175541649,WASHOE CO.,GERLACH,8/12/14,1152,11:52,2014-08-12  11:00:00 | Nevada,Hail,0.88, ,0,0,0,0,Nevada,PST-8, ,90160,C,31,REV,0,0,Public, , , ,0,N,0,N,GERLACH,40.65,-119.35,40.65,-119.35,Dime to nickel-sized hail was reported in Gerlach.,"Low pressure moved into northern California on the 11th and 12th, aiding in the development of strong to severe thunderstorms. Some storms dropped very heavy rain (for western NV) with between 0.75 and 1.50 inches of rain in 20 to 30 minutes. The Nevada Department of Emergency Management estimated 2.43M in total damage in Douglas County from several flash flooding events in July and August (through the 11th), with damages split between public infrastructure (around 927K) and private residences (1.5M).",176540868,WHITE PINE CO.,LAGES STATION,8/12/14,1300,13:00,2014-08-12  13:00:00 | Nevada,Flash Flood, , ,0,0,1000,0,Nevada,PST-8, ,89957,C,33,LKN,0,0,NWS Storm Survey,Heavy Rain, , ,2,SW,1,SSW,LAGES STATION,40.05,-114.63,40.0572,-114.6087,Water ran across State Highway 93 near Lages Station. Debris  was observed in the middle of the roadway. Multiple areas of flooding was also observed near the Station as well  as the slopes of the burn scar. Damages estimated.,"Abundant monsoon moisture generated thunderstorms that produced flash flooding, large hail, and strong winds across portions of central and northeast Nevada.",177540875,ELKO CO.,ELKO,8/12/14,1330,13:30,2014-08-12  13:00:00 | Nevada,Hail,1.25, ,0,0,1000,0,Nevada,PST-8, ,89957,C,7,LKN,0,0,Public, , , ,0,N,0,N,ELKO,40.83,-115.77,40.83,-115.77,Several reports were received of 1 to 1.25 inch hail in Elko. Pictures  were sent that verified the size of the hail. NWS  employee also reported tree damage and dents to vehicles  along Mountain City Highway. Damages estimated.,"Abundant monsoon moisture generated thunderstorms that produced flash flooding, large hail, and strong winds across portions of central and northeast Nevada.",178541650,WASHOE CO.,WADSWORTH,8/12/14,1440,14:40,2014-08-12  14:00:00 | Nevada,Thunderstorm Wind,56, ,0,0,0,0,Nevada,PST-8,MG,90160,C,31,REV,0,0,RAWS, , , ,72,E,72,E,WADSWORTH,39.584,-117.944,39.584,-117.944,Wind gusts between 60 and 65 mph were recorded at the Cherry Valley RAWS. The time of the wind gusts were estimated based on radar.,"Low pressure moved into northern California on the 11th and 12th, aiding in the development of strong to severe thunderstorms. Some storms dropped very heavy rain (for western NV) with between 0.75 and 1.50 inches of rain in 20 to 30 minutes. The Nevada Department of Emergency Management estimated 2.43M in total damage in Douglas County from several flash flooding events in July and August (through the 11th), with damages split between public infrastructure (around 927K) and private residences (1.5M).",179540874,ELKO CO.,ARTHUR,8/12/14,1528,15:28,2014-08-12  15:00:00 | Nevada,Hail,0.88, ,0,0,0,0,Nevada,PST-8, ,89957,C,7,LKN,0,0,Public, , , ,5,E,5,E,ARTHUR,40.78,-115.03,40.78,-115.03,,"Abundant monsoon moisture generated thunderstorms that produced flash flooding, large hail, and strong winds across portions of central and northeast Nevada.",180540869,EUREKA CO.,(P68)EUREKA,8/12/14,1530,15:30,2014-08-12  15:00:00 | Nevada,Flash Flood, , ,0,0,1000,0,Nevada,PST-8, ,89957,C,11,LKN,0,0,NWS Storm Survey,Heavy Rain, , ,12,NNE,11,N,(P68)EUREKA,39.75,-115.89,39.7602,-115.9652,Flash flooding and debris were observed across Mustang Road in the Diamond Valley area.|Damages estimated.,"Abundant monsoon moisture generated thunderstorms that produced flash flooding, large hail, and strong winds across portions of central and northeast Nevada.",181540870,WHITE PINE CO.,STEPTOE,8/12/14,1600,16:00,2014-08-12  16:00:00 | Nevada,Flash Flood, , ,0,0,500,0,Nevada,PST-8, ,89957,C,33,LKN,0,0,NWS Storm Survey,Heavy Rain, , ,47,WNW,46,WNW,STEPTOE,39.7,-115.77,39.6971,-115.7541,Thunderstorms produced flash flooding that washed debris over State Route 892 between mile marker 24 and 26 in the Newark Valley. Damages estimated.,"Abundant monsoon moisture generated thunderstorms that produced flash flooding, large hail, and strong winds across portions of central and northeast Nevada.",182540871,EUREKA CO.,(P68)EUREKA,8/12/14,1703,17:03,2014-08-12  17:00:00 | Nevada,Flash Flood, , ,0,0,500,0,Nevada,PST-8, ,89957,C,11,LKN,0,0,NWS Storm Survey,Heavy Rain, , ,14,NNW,15,NNW,(P68)EUREKA,39.78,-116.13,39.7911,-116.1211,Thunderstorms with heavy rain produced flash flooding on State Route 278 between mile markers 14 and 17. A plow  truck was needed to clear debris and water off the road. Damages estimated.,"Abundant monsoon moisture generated thunderstorms that produced flash flooding, large hail, and strong winds across portions of central and northeast Nevada.",183540872,WHITE PINE CO.,WARM SPGS,8/12/14,1752,17:52,2014-08-12  17:00:00 | Nevada,Flash Flood, , ,0,0,2000,0,Nevada,PST-8, ,89957,C,33,LKN,0,0,Department of Highways,Heavy Rain, , ,16,ESE,14,ESE,WARM SPGS,39.6,-114.53,39.6041,-114.559,Thunderstorms produced flash flooding on State Route 893 at mile marker 40. Lots of debris was washed onto the roadway. Damages estimated.,"Abundant monsoon moisture generated thunderstorms that produced flash flooding, large hail, and strong winds across portions of central and northeast Nevada.",184540975,WHITE PINE CO.,BAKER,8/12/14,1900,19:00,2014-08-12  19:00:00 | Nevada,Debris Flow, , ,0,0,2000,0,Nevada,PST-8, ,89957,C,33,LKN,0,0,Other Federal Agency,Heavy Rain, , ,16,N,16,N,BAKER,39.25,-114.13,39.245,-114.1288,A large debris flow occurred on the Hampton fire burn scar with debris flowing 4 miles into the valley below the fire burn area. A mesonet site about 5 miles away reported 0.90 inches of rain in 80 minutes. A private residence was impacted by the debris flow. Damages are estimated.,"Abundant monsoon moisture generated thunderstorms that produced flash flooding, large hail, and strong winds across portions of central and northeast Nevada.",185540884,ELKO CO.,ELKO,8/13/14,1100,11:00,2014-08-13  11:00:00 | Nevada,Hail,1, ,0,0,0,0,Nevada,PST-8, ,89963,C,7,LKN,0,0,Trained Spotter, , , ,8,NW,8,NW,ELKO,40.91,-115.88,40.91,-115.88,,"Monsoon moisture generated thunderstorms that produced numerous reports of large hail, flash flooding, and wind damage across northeast Nevada, primarily in Elko county.",186540880,ELKO CO.,PATSVILLE,8/13/14,1120,11:20,2014-08-13  11:00:00 | Nevada,Thunderstorm Wind,50, ,0,0,200,0,Nevada,PST-8,EG,89963,C,7,LKN,0,0,Trained Spotter, , , ,3,S,2,SSW,PATSVILLE,41.75,-115.96,41.7675,-115.959,Strong winds took off a few shingles from a house. Damages are estimated.,"Monsoon moisture generated thunderstorms that produced numerous reports of large hail, flash flooding, and wind damage across northeast Nevada, primarily in Elko county.",187540885,EUREKA CO.,PALISADE,8/13/14,1130,11:30,2014-08-13  11:00:00 | Nevada,Hail,1.25, ,0,0,5000,0,Nevada,PST-8, ,89963,C,11,LKN,0,0,Public, , , ,10,N,10,N,PALISADE,40.77,-116.18,40.77,-116.18,Public reported hail size ranged from dimes to larger than quarters at the Gold Quarry Mine.   The hail dented vehicles and broke at least one window. Damages are estimated.,"Monsoon moisture generated thunderstorms that produced numerous reports of large hail, flash flooding, and wind damage across northeast Nevada, primarily in Elko county.",188540886,ELKO CO.,RYNDON,8/13/14,1130,11:30,2014-08-13  11:00:00 | Nevada,Hail,1.25, ,0,0,500,0,Nevada,PST-8, ,89963,C,7,LKN,0,0,Public, , , ,13,NNW,13,NNW,RYNDON,41.13,-115.65,41.13,-115.65,Hail accumulated up to one foot deep and a vehicle was dented. Damages are estimated.,"Monsoon moisture generated thunderstorms that produced numerous reports of large hail, flash flooding, and wind damage across northeast Nevada, primarily in Elko county.",189540887,ELKO CO.,RYNDON,8/13/14,1203,12:03,2014-08-13  12:00:00 | Nevada,Hail,1.25, ,0,0,0,0,Nevada,PST-8, ,89963,C,7,LKN,0,0,Public, , , ,11,NNE,11,NNE,RYNDON,41.1,-115.56,41.1,-115.56,,"Monsoon moisture generated thunderstorms that produced numerous reports of large hail, flash flooding, and wind damage across northeast Nevada, primarily in Elko county.",190540881,ELKO CO.,OSINO,8/13/14,1230,12:30,2014-08-13  12:00:00 | Nevada,Lightning, , ,0,0,5000,0,Nevada,PST-8, ,89963,C,7,LKN,0,0,Law Enforcement, , , ,1,NW,1,NW,OSINO,40.94,-115.66,40.94,-115.66,A lightning strike ignited a structural fire. Damages are estimated.,"Monsoon moisture generated thunderstorms that produced numerous reports of large hail, flash flooding, and wind damage across northeast Nevada, primarily in Elko county.",191540889,ELKO CO.,RUBY VLY,8/13/14,1300,13:00,2014-08-13  13:00:00 | Nevada,Hail,1, ,0,0,10000,0,Nevada,PST-8, ,89963,C,7,LKN,0,0,NWS Employee, , , ,8,N,8,N,RUBY VLY,40.6,-115.37,40.6,-115.37,The hail did significant damage to vehicles parked at the end of the road in Lamoille Canyon.|Damages are estimated.,"Monsoon moisture generated thunderstorms that produced numerous reports of large hail, flash flooding, and wind damage across northeast Nevada, primarily in Elko c